pmid,title,abstract,journal,pub_date
41577892,"Probiotic potential of mangrove sediment-derived purple non-sulfur bacteria: effects on Artemia growth, vibrio resistance, and nutritional profile.","Aquaculture plays a vital role in ensuring global food security. However, the use of Artemia as crucial live food in the hatchery industry is often limited by cost, availability, and nutritional variability. This study investigated the potential of Purple Non-Sulphur Bacteria isolates, specifically Rhodopseudomonas sp. strain AZR1 and Rhodopseudomonas sp. strain AZW1, isolated from a mangrove ecosystem in Terengganu, Malaysia, as a sustainable feed supplement for Artemia. Following 16 S rRNA gen...",World journal of microbiology & biotechnology,2026-Jan
41516256,From Ecological Threat to Bioactive Resource: The Nutraceutical Components of Blue Crab (Callinectes sapidus).,"Native to the western Atlantic, the Atlantic blue crab Callinectes sapidus (CS) has spread to the Mediterranean, affecting local ecosystems and mussel aquaculture and leading to severe ecological and financial losses in Italy and other areas. Given its rapid spread and socio-economic impacts, several countries have begun to exploit CS commercially, but the consumers' interest is still limited. In this study, we analysed both nutrient and nutraceutical profiles of CS meats, evaluating potential d...",International journal of molecular sciences,2025-Dec
41515196,"Nutraceutical Potential of Astaxanthin in Muscle Metabolism, Exercise Adaptation, and Obesity.","Astaxanthin (AX), a naturally occurring xanthophyll carotenoid, has attracted growing scientific interest due to its potent antioxidant, anti-inflammatory, and metabolic-regulatory properties. This review provides a critical appraisal of the current evidence regarding the nutraceutical potential of AX in muscle metabolism, exercise adaptation, and obesity management. Preclinical and clinical findings indicate that AX enhances lipid utilization, promotes mitochondrial biogenesis through AMPK acti...",Nutrients,2025-Dec
41515122,Nutritional Supplementation for Myopia Prevention and Control: A Systematic Review of Randomized Controlled Trials.,"Nutritional supplementation has been proposed as a potential adjunct strategy in myopia prevention and control through antioxidative, anti-inflammatory, and extracellular matrix-regulating mechanisms. This systematic review aimed to evaluate randomized controlled trial (RCT) evidence on the effects of carotenoids, anthocyanins, polyunsaturated fatty acids, and combined nutraceutical formulations on refractive outcomes, axial length, macular pigment optical density (MPOD), visual function, and sy...",Nutrients,2025-Dec
41495023,Stress-trained microalgae robots with probiotics backpack and intestinal brake for inflammatory bowel disease management.,"Inflammatory bowel disease (IBD) involves elevated intestinal reactive oxygen species (ROS) and microbial imbalance. A key challenge is that current delivery systems cannot adequately protect active agents, such as antioxidants and probiotics, through the harsh gastric environment nor precisely deliver them to inflamed intestinal sites. Here, we present the EcN@PDA@HP biohybrid robot, composed of stress-trained microalgae, probiotics, and an intestinal braking system, enabling rapid gastric pass...",Nature communications,2026-Jan
41437050,Effects of carotenoid supplementation on liver enzymes in adults: a GRADE-assessed systematic review and dose-response meta-analysis of randomized controlled trials.,"Carotenoids are known for their beneficial effects in improving chronic diseases through their antioxidant properties. However, there has been no meta-analysis on the effects of carotenoids on liver enzymes and the evidence is inconsistent. So, this study aimed to evaluate the effects of carotenoid supplementation on liver enzyme levels in adults.",BMC complementary medicine and therapies,2025-Dec
41169386,Comprehensive evaluation of individual and combined dietary carotenoids in Penaeus vannamei and response surface analysis for optimizing combinations.,"Carotenoids are essential in crustacean aquaculture, supporting pigmentation, antioxidant defense, immune function, and sensory quality. However, intensive culture restricts natural carotenoid inputs, and exclusive reliance on astaxanthin is constrained by cost and supply. Evidence to guide cost-effective formulation remains fragmented: reported optimal doses vary widely, head-to-head comparisons under a common basal diet are scarce, mixture effects are poorly defined, and rigorous multi-factor ...",Frontiers in immunology,2025
41162864,"Impact of astaxanthin on oxidative markers, uric acid, and clinical symptoms in heart failure: a randomized clinical trial.","Chronic heart failure (HF) is often linked to increased oxidative stress and metabolic issues like high uric acid, which can worsen outcomes. Astaxanthin (ASX), a strong antioxidant, may help reduce these harmful effects. This study aimed to investigate the effects of ASX supplementation on oxidative stress markers as the primary outcome and clinical symptoms in patients with HF.",BMC cardiovascular disorders,2025-Oct
41155474,Navigating the Effects of Anti-Atherosclerotic Supplements and Acknowledging Associated Bleeding Risks.,"Several nutraceuticals demonstrate potential cardiovascular benefits through lipid-lowering, antithrombotic, and vascular protective mechanisms. Omega-3 fatty acids, berberine, garlic, and nattokinase exert favorable metabolic and vascular effects, yet their clinical efficacy depends on formulation, dosage, and patient characteristics and may be limited by bleeding risk or drug interactions. Antioxidant agents such as vitamin C, vitamin E, resveratrol, astaxanthin, and coenzyme Q provide additio...",International journal of molecular sciences,2025-Oct
40671417,Benefits of Krill Oil Supplementation During Alternate-Day Fasting in Adults With Overweight and Obesity: A Randomized Trial.,To investigate the effect of krill oil (KO) supplementation during alternate-day fasting (ADF) on body composition and muscle function in healthy adults with overweight.,"Obesity (Silver Spring, Md.)",2025-Sep
40569081,"Astaxanthin supplement improves clinical outcomes, quality of life, and inflammatory factors in patients with rheumatoid arthritis: a randomized clinical trial.","Rheumatoid Arthritis (RA) is a chronic, systemic inflammatory disease that results in joint destruction and progressive disability. This study aimed to determine the effect of astaxanthin (ASX) on clinical outcomes, quality of life, and inflammatory factors in patients with RA. In this randomized, triple-blind, placebo-controlled clinical trial, 60 patients with RA were randomly allocated into two groups and given either 20 mg day-1 of ASX supplement in the intervention group (n = 30) or placebo...",Food & function,2025-Jul
40333882,Plasma-based proteomics analysis of molecular pathways in canine diabetes mellitus after astaxanthin supplementation.,"The hyperglycemic state in diabetes mellitus induces oxidative stress and inflammation, contributing to diabetic tissue damage and associated complications. Astaxanthin, a potent antioxidant carotenoid, has been investigated for its potential to prevent and manage diabetes across various species; however, its effect on client-owned dogs remains poorly studied. This study explored the impact of astaxanthin supplementation on canine diabetes mellitus using a proteomics approach. A total of 18 clie...",PloS one,2025
40287452,Astaxanthin supplementation in Arabian racing horses mitigates oxidative stress and inflammation in peripheral blood mononuclear cells through enhanced mitophagy.,"Astaxanthin, a strong antioxidant carotenoid, has shown promising features in mitigating inflammation and oxidative stress and so that has been considered as a supplement for high-performance animals. In this study, we aimed to evaluate the effects of astaxanthin on oxidative stress, inflammation, and mitochondrial health in peripheral blood mononuclear cells (PBMC) isolated from Arabian racehorses. Horse-derived peripheral blood mononuclear cells exposed to hydrogen peroxide (H₂O₂) presented in...",Scientific reports,2025-Apr
40285451,Effects of an astaxanthin-containing supplement on oxidative status in skeletal muscle and circulation during deconditioning and reconditioning periods in polo ponies.,"This study investigated the effects of astaxanthin (ASTX) supplementation on oxidative status during a deconditioning-reconditioning cycle. Twelve polo ponies were assigned to no supplementation (CON) or an ASTX supplemented group, which received oral administration of a supplement containing 75 mg ASTX daily for 32 weeks. Polo ponies underwent a 16-week deconditioning period (DECON) followed by a 16-week reconditioning program (RECON). Submaximal exercise tests (SETs) were performed at the begi...",Physiological reports,2025-Apr
40265257,Mechanism Exploration of Dietary Supplement Astaxanthin on Improving Atherosclerosis through an Integrated Strategy Encompassing Artificial Intelligence Virtual Screening and Experimental Validation.,"Atherosclerosis (AS) is a major and common pathological basis of ischemic intestinal infarction, myocardial infarction, stroke, renal failure, and other highly lethal and disabling diseases. Current pharmacological interventions (e.g., statins) often cause adverse effects, limiting their long-term use. Natural compounds, with their multitarget efficacy and superior safety profiles, have emerged as promising alternatives for AS treatment. As a potent antioxidant carotenoid, astaxanthin exhibits u...",Journal of agricultural and food chemistry,2025-May
40102360,Modulating Multiple Molecular Trajectories by Nutraceuticals and/or Physical Activity in Attention-Deficit/Hyperactivity Disorder (ADHD)-Like Behaviors in Rat Pups.,"Attention deficit/hyperactivity disorder (ADHD) is a neurodevelopmental condition affecting cognitive and social functions all over childhood. Monosodium glutamate (MSG) is a common food additive associated with ADHD-like symptoms in children. Nutraceuticals, like sesamol (SE) and astaxanthin (AST), or physical activity (PHA) were reported to possess beneficial effects on human health. Meanwhile, still their neuroprotective effect against ADHD has been poorly investigated. This study aimed to in...",Journal of neuroimmune pharmacology : the official journal of the Society on NeuroImmune Pharmacology,2025-Mar
39957560,Harnessing Akkermansia muciniphila Membrane Coating for Probiotic Therapy in Inflammatory Bowel Disease.,"Inflammatory bowel diseases (IBDs) are characterized by dysregulated inflammatory responses, increased reactive oxygen species (ROS), and compromised intestinal barrier function. Current clinical treatments often yield suboptimal responses and significant side effects. Given the great potential of Akkermansia muciniphila (AKK) bacterial membrane components in IBD treatment and the possible pathogenicity of live bacteria, to essentially address these challenges, we develop a natural membrane-base...",ACS applied materials & interfaces,2025-Feb
39930022,Dietary supplements and prevention of preeclampsia.,"Preeclampsia (PE) is a common pregnancy complication characterized by hypertension, proteinuria, and end-organ dysfunction. However, to date, no effective treatment has been established other than iatrogenic delivery, and the importance of prevention as an alternative approach to addressing PE has been emphasized. There is growing evidence on the effectiveness of pharmacological and non-pharmacological prophylaxis in preventing PE. In this review, we focused on dietary supplements as non-pharmac...",Hypertension research : official journal of the Japanese Society of Hypertension,2025-Apr
39869136,"Unveiling astaxanthin: biotechnological advances, delivery systems and versatile applications in nutraceuticals and cosmetics.","Astaxanthin (ASX), ""king of carotenoids"", is a xanthophyll carotenoid that is characterized by a distinct reddish-orange hue, procured from diverse sources including plants, microalgae, fungi, yeast, and lichens. It exhibits potent antioxidant and anti-ageing properties and has been demonstrated to mitigate ultraviolet-induced cellular and DNA damage, enhance immune system function, and improve cardiovascular diseases. Despite its broad utilization across nutraceutical, cosmetic, aquaculture, an...",Archives of microbiology,2025-Jan
39804624,Oral Supplements and Photoprotection: A Systematic Review.,"Photoprotective effects of various nutritional components and supplements have been demonstrated in animal and in vitro studies. The objective of this systematic review is to assess the photoprotective effects of various dietary supplements. A systematic review of studies assessing dietary supplements on photoprotective outcomes was performed. Human studies were retrieved from PubMed, Embase, and Cochrane in February 2023. Supplement keywords included ""dietary supplements,"" ""vitamins,"" ""minerals...",Journal of medicinal food,2025-Jun
39766315,Beneficial Effects of a Nutraceutical Combination on Lipid Profiles in Children with Moderate and Severe Hypercholesterolemia.,"The aim of the present study was to evaluate the efficacy and safety of the long-term use of a dietary supplement containing red yeast rice (RYR), combined with other natural compounds, in children and adolescents with primary hypercholesterolemia. A nutraceutical, containing RYR, policosanols, coenzyme Q10, astaxanthin and folic acid (commercial name: Armolipid), was administered once daily in 84 children/adolescents with moderate or severe primary hypercholesterolemia. Moreover, 19 of the part...",Biomolecules,2024-Dec
39720708,"Supplemental effects of Haematococcus pluvialis in a low-fish meal diet for Litopenaeus vannamei at varying temperatures: growth performance, innate immunity and gut bacterial community.","This study examined the effects of Haematococcus pluvialis on the growth performance, innate immunity, and gut microbiota of Litopenaeus vannamei under different water temperature conditions. Feeding regimens included a 20% fishmeal diet (control), a low-fish meal (LFM) diet with 10% fishmeal and an LFM diet supplemented with 0.03% H. pluvialis. These diets were administered to six groups of L. vannamei at normal (30°C) (NT) and low (20°C) (LT) temperatures (NT_C, NT_LFM, NT_LFM_HP, LT_C, LT_LFM...",Frontiers in immunology,2024
39613170,"The benefits of astaxanthin-rich microalgal powder on growth, health, and disease resistance against Fusarium solani in Pacific white shrimp.","In shrimp aquaculture, enhancing health and disease resistance is crucial for sustainable production. This study investigates the pioneering effects of astaxanthin-enriched microalgal powder from Haematococcus pluvialis (HP) on Pacific white shrimp (Litopenaeus vannamei), focusing on growth efficiency, body composition, immune and antioxidant responses, intestinal health, histopathology, gene expression, and resistance against Fusarium solani. Shrimp (initial weight 5.27 ± 0.12 g) were separated...",Fish & shellfish immunology,2025-Jan
39606856,Supplementation of diet with Astaxanthin and DHA prevents gestational and lactational undernourishment-induced metabolic derangements in dams: a metabolomic approach.,Nutrition is the critical nongenetic factor that has a major influence on the health status of an organism. The nutritional status of the mother during gestation and lactation plays a vital role in defining the offspring's health. Undernutrition during these critical periods may induce chronic metabolic disorders like obesity and cardiovascular diseases in mothers as well as in offspring. The present study aims to evaluate the impact of undernutrition during gestational and lactational periods o...,Journal of developmental origins of health and disease,2024-Nov
39599590,The Effects of Antioxidant Supplementation on Soccer Performance and Recovery: A Critical Review of the Available Evidence.,"Background Soccer is linked to an acute inflammatory response and the release of reactive oxygen species (ROS). Antioxidant supplements have shown promising effects in reducing muscle damage and oxidative stress and enhancing the recovery process after eccentric exercise. This critical review highlights the influence of antioxidant supplements on performance and recovery following soccer-related activity, training, or competition. Methods: English-language publications from the main databases th...",Nutrients,2024-Nov
39568140,Impact of astaxanthin supplementation on markers of cardiometabolic health and tactical performance among firefighters.,"Firefighters are at risk for cardiovascular disease due to occupational-related inflammation, oxidative stress, and lifestyle practices. Astaxanthin (AX) possesses anti-inflammatory/antioxidant and purported ergogenic properties. This study examined the impact of supplementing the diet with 12 mg/d AX for four weeks on markers of inflammation, oxidative stress, cardiometabolic health, exercise capacity, and occupation-related performance in career firefighters.",Journal of the International Society of Sports Nutrition,2024-Dec
39543175,The effect of long term astaxanthin supplementation on the antioxidant status of racing Arabian horses - preliminary study.,"Astaxanthin due to its strong antioxidant activity is believed to reduce oxidative stress and therefore is considered as feed additive in pathological conditions and also for the athletes. It is promoted by several equine web portals, however, data supporting that concept in horses is limited. Thus, the aim of this study was to evaluate the effect of astaxanthin supplementation on the parameters of oxidative status in 3 years old, racing Arabian horses during long term observation and the change...",Scientific reports,2024-Nov
39519447,"Antarctic Krill Euphausia superba Oil Supplementation Attenuates Hypercholesterolemia, Fatty Liver, and Oxidative Stress in Diet-Induced Obese Mice.","Several Previous studies indicate that consuming krill oil may aid in reducing hypercholesterolemia and improving cholesterol metabolism. Therefore, our study was designed to investigate the effectiveness of Antarctic krill oil (Euphausia superba) (ESKO) in combating obesity and lowering fat/lipid/cholesterol levels.",Nutrients,2024-Oct
39458422,"Comparison of Dietary Supplementation with Krill Oil, Fish Oil, and Astaxanthin on an Experimental Ethanol-Induced Gastric Ulcer Model: A Biochemical and Histological Study.","Despite advances in ulcer treatment research, the search for new, safe, and effective strategies for preventing and treating ulcer diseases persists.",Nutrients,2024-Oct
39391321,Comprehensive metabolomics and transcriptomics analyses investigating the regulatory effects of different sources of dietary astaxanthin on the antioxidant and immune functions of commercial-sized rainbow trout.,"Astaxanthin is an important aquatic feed additive that enhances the antioxidant capacity, and immune function of rainbow trout (Oncorhynchus mykiss); however, very limited information is available on its underlying molecular mechanisms. Haematococcus pluvialis powder, Phaffia rhodozyma powder, and synthetic astaxanthin were added to the commercial feed (no astaxanthin, NA) to prepare three experimental feeds, referred to as the HPA, PRA, and SA groups, respectively, and their actual astaxanthin ...",Frontiers in immunology,2024
39327454,Effects of carotenoid supplementation on glycemic control: a systematic review and meta-analysis of randomized clinical trials.,"We conducted a systematic review and meta-analysis to assess the effects of carotenoid supplementation on glycemic indices, and the certainty of evidence.",European journal of clinical nutrition,2025-Mar
39286241,"Effects of dietary supplementation with medicinal plant mixtures and immunostimulants on the immune response, antioxidant capacity, and hepatopancreatic health of Chinese mitten crab (Eriocheir sinensis).","This study aimed to evaluate the efficiency of tea polyphenols (TP) and medicinal plant mixtures (Astragalus membranaceus + Lonicera japonica, Rheum officinale Bail + Scutellaria baicalensis + Platycladus orientalis) combined with astaxanthin (AST), benzoic acid (BA), and yeast complex on the health status of Eriocheir sinensis.",Frontiers in immunology,2024
39275173,Exploring the Impact of Astaxanthin Supplementation in Conjunction with a 12-Week CrossFit Training Regimen on Selected Adipo-Myokines Levels in Obese Males.,"Obesity is associated with an exacerbated metabolic condition that is mediated through impairing balance in the secretion of some adipo-myokines. Therefore, the objective of the present study was to explore the impact of astaxanthin supplementation in conjunction with a 12-week CrossFit training regimen on some selected adipo-myokines, insulin insensitivity, and serum lipid levels in obese males.",Nutrients,2024-Aug
39150542,Xanthophyllomyces dendrorhous Is a Safe Dietary Supplement with Potent Antioxidant Defense Enhancing Activity.,"Xanthophyllomyces dendrorhous (X. dendrorhous), previously known as Phaffia rhodozyma, is a red yeast that is widely recognized as a rich source of carotenoids, particularly astaxanthin, which exhibits potent antioxidant activity and other health-promoting functions. However, there is currently a lack of research on the safety of consuming X. dendrorhous. To address this, we conducted an acute toxicity study followed by a 90-day subchronic toxicity trial to evaluate the safety of X. dendrorhous ...",Journal of agricultural and food chemistry,2024-Aug
39127677,Effect of astaxanthin supplementation on female fertility and reproductive outcomes: a systematic review and meta-analysis of clinical and animal studies.,"Oxidative stress (OS) plays a harmful role in female reproduction and fertility. Several studies explored various dietary interventions and antioxidant supplements, such as astaxanthin (AST), to mitigate the adverse effects of OS on female fertility. Ameliorative effects of AST on female fertility and the redox status of reproductive organs have been shown in several animal and clinical studies.",Journal of ovarian research,2024-Aug
39090754,"The effect of astaxanthin supplementation on inflammatory markers, oxidative stress indices, lipid profile, uric acid level, blood pressure, endothelial function, quality of life, and disease symptoms in heart failure subjects.","Heart failure is a chronic and progressive disease where the heart muscle is unable to pump enough blood and oxygen to meet the body's needs. Oxidative stress and inflammation are key elements in the development and progression of heart failure. Astaxanthin, a carotenoid, has strong anti-inflammatory and antioxidant effects that may protect the cardiovascular system. A study will evaluate the effect of astaxanthin supplementation on inflammatory status, oxidative stress, lipid profile, uric acid...",Trials,2024-Aug
39064656,Antioxidant Lipid Supplement on Cardiovascular Risk Factors: A Systematic Review and Meta-Analysis.,"The efficacy of functional lipids with antioxidant properties in reducing cardiovascular risk has not been consistent. Randomized controlled trials (RCTs) reporting estimates for the effects of antioxidant functional lipid supplementations on cardiometabolic risk factors were searched up to 1 May 2024. Overall, antioxidant lipid supplementations, compared with placebo, had favorable effects on systolic blood pressure (lycopene: -1.95 [-3.54, -0.36] mmHg), low-density lipoprotein cholesterol (n6 ...",Nutrients,2024-Jul
39036884,Randomized clinical trial of astaxanthin supplement on serum inflammatory markers and ER stress-apoptosis gene expression in PBMCs of women with PCOS.,"Polycystic ovarian syndrome (PCOS) is related to pro-apoptotic and pro-inflammatory conditions generated by Endoplasmic reticulum (ER) stress. This study aimed to determine the effect of Astaxanthin (ASX), as carotenoid with potent antioxidant and anti-inflammatory properties, on serum inflammatory markers, apoptotic factors and ER stress-apoptotic genes in peripheral blood mononuclear cells (PBMCs) of women with PCOS. This randomized, double-blind clinical trial included 56 PCOS patients aged 1...",Journal of cellular and molecular medicine,2024-Jul
38944253,Effects of dietary astaxanthin on immune status and lipid metabolism in gilthead seabream (Sparus aurata).,"Astaxanthin (AX) is a carotenoid known to have one of the highest documented antioxidant capacities and has attracted considerable scientific and commercial interest. The incorporation of AX into aquaculture practices has been associated with improved pigmentation, modulation of the immune and endocrine systems, stress reduction, reproductive efficiency and general fish health. This study describes the effects of dietary AX (0, control, 20, 100 and 500 mg kg-1 AX per kg of diet) for 15 and 30 da...",Fish & shellfish immunology,2024-Aug
38892705,"An Examination into the Effects of a Nutraceutical Supplement on Cognition, Stress, Eye Health, and Skin Satisfaction in Adults with Self-Reported Cognitive Complaints: A Randomized, Double-Blind, Placebo-Controlled Trial.","Background: Dietary quality and the consumption of antioxidant-rich foods have been shown to protect against memory decline. Therefore, this double-blind, randomized, placebo-controlled study aimed to investigate the effects of a nutritional supplement on changes in cognitive performance. Methods: In adults aged 40 to 70 years with subjective memory complaints, participants were randomly allocated to take a supplement containing vitamin E, astaxanthin, and grape juice extract daily for 12 weeks ...",Nutrients,2024-Jun
