pmid,title,abstract,journal,pub_date
38892683,Astaxanthin Supplementation as a Potential Strategy for Enhancing Mitochondrial Adaptations in the Endurance Athlete: An Invited Review.,"Astaxanthin, a potent antioxidant found in marine organisms such as microalgae and krill, may offer ergogenic benefits to endurance athletes. Originally used in fish feed, astaxanthin has shown a greater ability to mitigate various reactive oxygen species and maintain the structural integrity of mitochondria compared to other exogenous antioxidants. More recent work has shown that astaxanthin may improve: (1) cycling time trial performance, (2) cardiorespiratory measures such as submaximal heart...",Nutrients,2024-Jun
38864465,A systematic review of randomized controlled trials on the health effects of chocolate enriched/fortified/supplemented with functional components.,"The most significant contributor to global mortality are cardiovascular diseases. Dietary factors significantly impact the risk, advancement, and treatment of cardiometabolic conditions. Chocolate, known for its adaptability and capacity to stimulate pleasure centers, emerges as a promising vehicle for integrating different bioactive elements. This systematic review analyzed 10 randomized controlled trials investigating the health effects of consuming enriched, fortified, or supplemented chocola...",Food & function,2024-Jul
38811348,Effects of astaxanthin on gut microbiota of polo ponies during deconditioning and reconditioning periods.,"To determine the effects of astaxanthin (ASTX) supplementation on the equine gut microbiota during a deconditioning-reconditioning cycle, 12 polo ponies were assigned to a control (CON; n = 6) or supplemented (ASTX; 75 mg ASTX daily orally; n = 6) group. All horses underwent a 16-week deconditioning period, with no forced exercise, followed by a 16-week reconditioning program where physical activity gradually increased. Fecal samples were obtained at the beginning of the study (Baseline), after ...",Physiological reports,2024-Jun
38750293,Astaxanthin supplementation ameliorates simulated heat stress by regulating physio-biochemical responses in Sirohi goats.,"The present study was undertaken to assess the ameliorative effect of dietary supplementation of astaxanthin in Sirohi goats under simulated heat stress conditions. Eighteen healthy female Sirohi goats were divided equally into three groups (n = 6): Heat-Stressed Control (HSC), Treatment 1 (T1), and Treatment 2 (T2). During the experiment, goats in the T1 group were supplemented with astaxanthin at the rate of 25 mg/animal/day, while those in the T2 group received supplementation of 50 mg/animal...",Veterinary research communications,2024-Aug
38740518,Readily Available Oral Prebiotic Protein Reactive Oxygen Species Nanoscavengers for Synergistic Therapy of Inflammation and Fibrosis in Inflammatory Bowel Disease.,"A significant gap exists in the demand for safe and effective drugs for inflammatory bowel disease (IBD), and its associated intestinal fibrosis. As oxidative stress plays a central role in the pathogenesis of IBD, astaxanthin (AST), a good antioxidant with high safety, holds promise for treating IBD. However, the application of AST is restricted by its poor solubility and easy oxidation. Herein, different protein-based nanoparticles (NPs) are fabricated for AST loading to identify an oral nanov...",ACS nano,2024-May
38648257,"Effects of dietary nanoliposome-coated astaxanthin on haematological parameters, immune responses and the antioxidant status of rainbow trout (Oncorhynchus mykiss).",Astaxanthin is the most prevalent carotenoid in the marine environment and is widely used as an additive in formulated aquafeeds.,Veterinary medicine and science,2024-May
38578356,Astaxanthin and DHA Supplementation Modulates the Maternal Undernutrition-induced Impairment of Cognitive Behavior and Synaptic Plasticity in Adult Life of Offspring's -Exploring the Molecular Mechanism.,"Maternal nutrition was recognized as a significant part of brain growth and maturation in most mammalian species. Timely intervention with suitable nutraceuticals would provide long-term health benefits. We aim to unravel the molecular mechanisms of perinatal undernutrition-induced impairments in cognition and synaptic plasticity, employing animal model based on dietary nutraceutical supplementation. We treated undernourished dams at their gestational, lactational, and at both the time point wit...",Molecular neurobiology,2024-Nov
38528176,A combination nutritional supplement reduces DNA methylation age only in older adults with a raised epigenetic age.,"An increase in systemic inflammation (inflammaging) is one of the hallmarks of aging. Epigenetic (DNA methylation) clocks can quantify the degree of biological aging and this can be reversed by lifestyle and pharmacological intervention. We aimed to investigate whether a multi-component nutritional supplement could reduce systemic inflammation and epigenetic age in healthy older adults.We recruited 80 healthy older participants (mean age ± SD: 71.85 ± 6.23; males = 31, females = 49). Blood and s...",GeroScience,2024-Oct
38512396,"Impacts of astaxanthin-enriched Paracoccus carotinifaciens on growth, immune responses, and reproduction performance of broodstock Nile tilapia during winter season.","The growth, immune response, and reproductive performance of broodstock of Nile tilapia (Oreochromis niloticus) under winter stress conditions were investigated the effects of supplementary diets with astaxanthin-enriched Paracoccus carotinifaciens. Throughout an eight-week period in the winter season, male and female tilapia were fed with diets containing different levels of P. carotinifaciens dietary supplementation: 0 g/kg (T1; control), 5 g/kg (T2), 10 g/kg (T3), and 20 g/kg (T4). Subsequent...",Fish physiology and biochemistry,2024-Jun
38407143,The effects of astaxanthin supplementation on liver enzyme levels.,"According to previous studies, astaxanthin exerts various biological effects due to its anti-inflammatory and antioxidant capabilities; however, its effects on liver enzymes have not yet been well elucidated. Therefore, we conducted a meta-analysis to assess astaxanthin's effects on liver enzymes. A systematic literature search was conducted using scientific databases including PubMed, Scopus, Web of Science, the Cochrane databases, and Google Scholar up to February 2023 to find relevant randomi...",International journal for vitamin and nutrition research. Internationale Zeitschrift fur Vitamin- und Ernahrungsforschung. Journal international de vitaminologie et de nutrition,2024-Jun
