pmid,title,abstract,journal,pub_date
40332575,Updated Meta-Analysis on Vitamin Supplementation for Chronic Pruritus: Expanding Evidence Beyond Vitamin D.,"Chronic pruritus is a distressing condition associated with various dermatological and systemic diseases, significantly impairing patients' quality of life. While conventional treatments such as antihistamines and corticosteroids offer relief, their efficacy varies, and long-term use may lead to adverse effects. Emerging evidence suggests that certain vitamins, including vitamin D, vitamin E, vitamin B12, and niacinamide (B3), may play a role in alleviating pruritus through their anti-inflammato...",International journal of molecular sciences,2025-Apr
40250530,Towards defining optimal concentrations of micronutrients in adults to optimize health.,"Micronutrients are essential for maintaining physiological homeostasis and optimizing healthspan, defined as the years lived in good health without chronic diseases or disabilities. Despite increasing global life expectancy, improvements in healthspan have not kept pace, partly due to subclinical micronutrient deficiencies that often precede clinical symptoms. The triage theory highlights how micronutrient insufficiencies compromise long-term health by prioritizing critical metabolic functions. ...",Mechanisms of ageing and development,2025-Jun
40249981,"The effects of methyl nutrients on cognition and one carbon metabolism in older adults with mild cognitive impairment, A systematic review and meta-analysis.","Methyl nutrients can influence the one-carbon metabolic cycle and are important for cognitive function in older adults. We aimed to evaluate the effects of methyl nutrient supplementation, including the combination of folate and vitamin B12, and folate or vitamin B12 alone, on cognitive function and one-carbon metabolism in older adults with mild cognitive impairment.","Geriatric nursing (New York, N.Y.)",2025
40218924,"The Role of Vitamin B Complex in Periodontal Disease: A Systematic Review Examining Supplementation Outcomes, Age Differences in Children and Adults, and Aesthetic Changes.","Background and Objectives: Among nutritional factors implicated in periodontal health, the vitamin B complex-particularly folate (vitamin B9), cobalamin (B12), thiamine (B1), and riboflavin (B2)-has gained attention for its role in immunomodulation and tissue repair. This systematic review aims to synthesize current evidence on whether adequate vitamin B complex intake or status is associated with improved periodontal outcomes. Methods: A systematic search was performed in PubMed, Scopus, and We...",Nutrients,2025-Mar
40218880,Effects of B Vitamins on Homocysteine Lowering and Thrombotic Risk Reduction-A Review of Randomized Controlled Trials Published Since January 1996.,"Homocysteine is an amino acid derived from methionine which is metabolized via vitamin B6 (pyridoxine)- and vitamin B12 (cobalamin)-dependent pathways. Supplementation of B vitamins has been shown to effectively reduce plasma homocysteine levels. Previous research has also demonstrated an association between lower plasma homocysteine levels and decreased risk of myocardial infarction, stroke, and venous thromboembolism. However, whether supplementation of B vitamins is associated with risk reduc...",Nutrients,2025-Mar
40192559,The Effect of Prebiotics and Probiotics (Synbiotics) on Weight Loss and Biochemical Parameters in Obese Individuals.,"This study examined the effects of prebiotic and probiotic (synbiotic) supplementation on weight loss and biochemical parameters in treating obesity. The study was conducted with 110 participants in Eskisehir Anadolu Hospital, Turkiye, between February 15, 2019 and February 15, 2020. Individuals with obesity, who were following a weight loss diet, were randomly assigned to two groups. While one group (the control group) followed the diet only, the other group received synbiotic tablets in the mo...",Journal of medicinal food,2025-Jun
40170292,"Prevalence of Reported Dietary Supplement Use in 2019 Older Adult (≥ 55 Years) National Alzheimer's Coordinating Center Participants With Normal Cognition, Mild Cognitive Impairment or Dementia.","In those with mild cognitive impairment (MCI) and dementia, nutritional intake decreases, increasing nutritional deficiency risk. Dietary supplements (DSs) may be an important source of nutrition, but recent insight into their use in those with normal cognition (NC), MCI or dementia is lacking.",Journal of human nutrition and dietetics : the official journal of the British Dietetic Association,2025-Apr
40154078,"The effect of 12-weeks Nutritional supplementation on Nutritional Intake and Status among Indonesian Older Outpatients with Malnutrition Risk, the Prolansia study: a randomized controlled trial.",Standard care for older outpatients who are at risk of malnutrition in Indonesia is still based on the 2017's recommendations of the Indonesian Geriatrics Society. and does not provide nutritional supplementation as recommended by ESPEN guidelines 2019/2022.,"The journal of nutrition, health & aging",2025-Jun
40120349,Dietary supplementation with conjugated linoleic acid induces anemia with combined features of megaloblastic and hemolytic anemia.,"This study investigates whether dietary supplementation with conjugated linoleic acids (CLA) induces anemia in mice. Male Kunming White mice were randomly assigned to two groups: one fed a CLA-supplemented diet and the other a linoleic acid (LA)-supplemented diet as control. Compared with those in LA group, periodic manual erythrocyte counts revealed red blood cells (RBCs) in CLA group significantly reduced on days 47 (p < 0.05), 61 (p < 0.01), and 86 (p < 0.001). Complete blood count (CBC) anal...",Biochemical and biophysical research communications,2025-Apr
