pmid,title,abstract,journal,pub_date
41563463,Management of IBD through improving intestinal barrier function by a novel Lactiplantibacillus plantarum C4 strain.,"Inflammatory bowel disease (IBD) is a globally wide spread chronic disease with remittent attacks. It causes many stressful symptoms which decrease the quality of life of the patients remarkably. IBD requires long term treatment due to its chronic nature. Probiotics are promising treatment approach for IBD due to its improve of the composition of the gut microbiota which have a great role in the development of colitis, in addition to its safety on the long term use in comparison to traditional t...",Archives of microbiology,2026-Jan
41558159,"Review: A systematic review on the use and effects of postbiotics on the general health, gut health, and performance of sows and piglets.","Growing concerns over antibiotic resistance have led to restrictions on antimicrobial use in various regions, including the European Union, prompting the search for alternative strategies to promote gut health. Of these, postbiotics have emerged as a promising strategy due to their potential immunomodulatory, anti-inflammatory, and gut barrier-enhancing properties. Despite extensive research regarding human health, the application of postbiotics in swine nutrition remains unexplored, with limite...",Animal : an international journal of animal bioscience,2026-Feb
41556308,Exploiting the Endogenous Type II-A CRISPR-Cas System for Functional Engineering of Probiotic Lacticaseibacillus rhamnosus GG.,"Lacticaseibacillus rhamnosus GG (LGG) is one of the most extensively studied probiotic strains, widely used in food and health applications. However, the absence of efficient, precise genome editing methods has limited its broader potential and functional versatility. Here, we present an endogenous type II-A CRISPR-Cas genome editing workflow for LGG designed for functional strain construction. Using a plasmid interference assay together with single-nucleotide substitutions, we confirm the preci...",Microbial biotechnology,2026-Jan
41553530,WGS analysis and functional studies illustrate promising gene-signatures for probiotic attributes and molecular-targeted therapeutic prospects of Lactiplantibacillus plantarum LP-ARP2.,"Gene-signatures for probiotic attributes expedite screening of novel probiotic strains as well as identify molecular basis of probiotic benefits. Therefore, strain-specific genomic-studies correlating functional-assays are in demand. Here, we present the same for Lactiplantibacillus plantarum LP-ARP2 using genomic-metabolomic-functional approaches. Genomic-features of LP-ARP2 are further compared with clinically relevant L. plantarum strains to elucidate gene-specific commonality. We find robust...",Archives of microbiology,2026-Jan
41552721,The effect of Massa Medicata Fermentata on the cytokine secretion of colonic mucosa and visceral sensitivity in rats with IBS-D.,To study the effect of MMF(Massa Medicata Fermentata)on the secretion of cytokines of colon mucosa and visceral sensitivity in rats with IBS-D(diarrhea-predominant irritable bowel syndrome).,Frontiers in cellular and infection microbiology,2025
41548440,Limosilactobacillus reuteri alleviates psoriasis via aryl hydrocarbon receptor-mediated regulation of Interkeukin-17A.,Psoriasis is a chronic immune-mediated skin disorder characterized by keratinocyte hyperproliferation and interleukin-17A-driven inflammation. Growing evidence highlights the contribution of microbiome-derived factors to cutaneous immune regulation. The study aimed to evaluate the therapeutic efficacy of heat-killed Limosilactobacillus reuteri NCHBL-005 in an imiquimod-induced psoriasis-like mouse model.,International immunopharmacology,2026-Mar
41545110,Aqueous LC-MS/MS quantification of α-/β-nicotinamide mononucleotide in dietary supplements using a pentabromophenyl column.,"In this study, we developed an LC-MS/MS method that enables baseline separation and quantification of α- and β-nicotinamide mononucleotide (NMN) isomers under fully aqueous reversed-phase conditions. At first, three commonly used reversed-phase columns (Polar C18, F5, and PBr) were evaluated, and only the PBr phase provided sufficient stereoselectivity through enhanced π-π stacking, dipole-dipole interactions, and halogen bonding. Using 0.1 % formic acid in water as the mobile phase, the two iso...",Analytica chimica acta,2026-Feb
41544439,"Effects of live and heat-killed Limosilactobacillus ingluviei C37 on broiler performance, gut health, and bacterial cell wall characterization using Fourier Transform Infrared spectroscopy.","This study investigated the efficacy of Limosilactobacillus ingluviei C37 (LIC37) in live and heat-killed forms on growth performance, carcass characteristics, cecal microbial populations, short-chain fatty acids (SCFAs), and ammonia production in broiler chickens from 1 to 42 days of age. Fourier Transform Infrared spectroscopy (FTIR) was used to characterize protein structural differences between both LIC37 forms. A total of 240 one-day-old male Cobb 500 chicks were assigned to four dietary tr...",Poultry science,2026-Mar
41541626,An open-label interventional study on efficacy and safety of 25 µg of daily calcifediol capsule versus 100 µg of cholecalciferol sachets in apparently healthy volunteers.,"Despite the multiple advantages of 25-hydroxyvitamin D (calcifediol or 25(OH)D) compared to cholecalciferol, it is used sparingly. This study was planned to assess the safety and efficacy of supplementing daily 25 µg of calcifediol capsules vis-a-vis 100 µg (4000 IU) of cholecalciferol sachets in apparently healthy individuals with vitamin D deficiency in Chandigarh, India (latitude 30.7° North, 76.8° East). It was a prospective, interventional study to evaluate the effects of calcifediol vis-a-...",Journal of nutritional science,2026
41539653,Probiotic Administration Reshapes the Sex Differentiation Trajectory of Zebrafish under Perfluorobutanesulfonate Challenge.,"Perfluorobutanesulfonate (PFBS) is an emerging pollutant with potent endocrine disrupting effects, while probiotic bacteria can significantly modulate animal endocrinology. However, whether and how probiotics interact with PFBS to maintain the host's endocrine equilibrium are unknown. Herein, juvenile zebrafish (Danio rerio) were chronically exposed to environmentally relevant concentrations of PFBS during the critical window of gonadal differentiation and maturation (from 21 days postfertilizat...",Environmental science & technology,2026-Feb
41539353,Xylanases targeting unusual glycosidic bonds: Unlocking prebiotic xylooligosaccharides from macroalgae.,"The growing interest in functional foods and prebiotics has encouraged the search for novel bioactive ingredients. Macroalgae (seaweeds) represent an underexplored source of unique xylans with β-1,3 and β-1,3/1,4 glycosidic linkages, that can be enzymatically hydrolysed into novel xylooligosaccharides (XOS). These oligosaccharides, characterized by linkage patterns different from those in terrestrial biomass, may exert distinct biological effects with potential biotechnological applications in f...",Biotechnology advances,2026
