pmid,title,abstract,journal,pub_date
42115858,"Probiotic potential of Lactobacillus helveticus CMI1 isolated from Iranian Khiki cheese: antimicrobial, anti-biofilm, and antioxidant properties for food preservatives.","Lactic acid bacteria (LAB) are widely recognized for their probiotic and antimicrobial potential in food and health-related applications. This study aimed to isolate and characterize Lactobacillus helveticus strain CMI1 from traditional Iranian Khiki cheese and to evaluate its probiotic-related properties, including antimicrobial, anti-biofilm, antioxidant, and cytotoxic activities.",BMC microbiology,2026-May
42113072,Evaluation of the local tolerance and systemic safety of a novel intravaginal probiotic product in cows.,"Since its discovery, the microbiota has been increasingly recognised for its role in maintaining health and contributing to various disease conditions. In the reproductive tract, microbial populations can significantly influence endometrial health, internal homeostasis, and fertility. The preservation or restoration of a balanced microbiota through appropriate probiotic products may support reproductive health; in addition, candidate probiotics must be demonstrated to be safe for use. The aim of...",Veterinary research communications,2026-May
42112335,Evaluation of Imoviral® effects on early immune response in Sparus aurata challenged with Vibrio anguillarum.,"An acute phase response (APR) was experimentally induced in Sparus aurata (Linnaeus, 1758) by intraperitoneal (IP) injection of Vibrio anguillarum to evaluate the effects of dietary supplementation with the Imoviral® complex (CRISTALFARMA) on fish growth performance and health status, through the analysis of key genes involved in the APR. Imoviral® is a blend of exclusively natural extracts, i.e. uncaria (Uncaria tomentosa), shiitake (Lentinula edodes), beta-glucan and black-currant (Ribes nigru...",Frontiers in immunology,2026
42108415,Nutraceutical Potential of Fermented Finger Millet in Type 2 Diabetes Mellitus.,"Finger millet (FM; Eleusine coracana) has gained recognition as a potent dietary intervention for managing Type 2 diabetes mellitus (T2DM) due to its rich nutritional value and bioactive profile. This review focuses on the enhanced antidiabetic potential of fermented FM, emphasizing improvements in the bioavailability of these natural polyphenols and dietary fibers (DFs), via fermentation as well as the modulatory effects on gut microbiota. Finger millet (FM) is rich in complex carbohydrates-spe...",Journal of food science,2026-May
42106028,"A thermostable CBM3-containing endo-β-1,4-glucanase from Paenibacillus sp. XP01 efficiently produces prebiotic oligosaccharides from Konjac glucomannan.","Konjac glucomannan (KGM), a natural high-molecular-weight polysaccharide, is widely utilized as a functional thickener, gelling agent, and dietary fiber in food and health products. However, its large molecular size and high viscosity restrict its efficacy in intestinal and industrial applications, prompting the development of enzymatic strategies to produce KGM-derived oligosaccharides. In this study, a novel endo-β-1,4-glucanase, EglGH5A, belonging to glycoside hydrolase subfamily GH5_1, was i...",International journal of biological macromolecules,2026-Jun
42101791,Research of heat-killed Loigolactobacillus coryniformis NA-3 and Lactiplantibacillus plantarum NA as potential substitutes for live strains in immune regulation and anti-inflammatory effects.,The safety of live probiotics remains debated due to concerns regarding their viability and functional efficacy under harsh in vivo and in vitro conditions. Inflammatory bowel disease (IBD) is a complex disease stemming from various factors. It has been reported that probiotics shows anti-inflammatory function. This study evaluated the immunomodulatory and anti-inflammatory properties of heat-killed Lactobacillus strains (a form of postbiotics). Because viable Loigolactobacillus coryniformis NA-...,World journal of microbiology & biotechnology,2026-May
42084797,Effects of acute HMB-FA supplementation on antioxidant status and muscle damage in Elite Judoka: a randomized pilot trial.,"High-intensity judo bouts induce oxidative stress and muscle damage, impairing recovery. This randomized, double-blind, placebo-controlled pilot trial examined whether acute β-hydroxy-β-methylbutyrate free acid (HMB-FA) supplementation influences muscle damage, oxidative stress, and antioxidant biomarkers in elite judoka.",Journal of the International Society of Sports Nutrition,2026-Dec
42083185,Gamma irradiation for producing functional postbiotic ingredients from industrial probiotic biomass.,"The industrial application of postbiotics based on non-viable probiotic cells (paraprobiotics), requires robust inactivation technologies that ensure replicative death while preserving bioactive bacterial structures and functions. Here, we evaluated cobalt-60 gamma (γ) irradiation as an industrially scalable approach to produce functional postbiotics from freeze-dried biomasses of twelve probiotic strains packaged in sealed multilayer pouches. Viable counts of untreated biomasses ranged from 10....","Food research international (Ottawa, Ont.)",2026-Jul
42068664,Modulation of intestinal morphology and microbial ecosystem by Bacillus-based biotics and enzyme cocktails in broilers.,"This study investigated the effects of Bacillus-based biotics and enzyme cocktails on growth performance, physiological homeostasis, and the intestinal ecosystem in broilers fed a standardized dietary matrix. A total of 105 one-day-old male broilers were assigned to five dietary treatments: (1) CON (basal diet), (2) A (0.05% probiotics), (3) B (0.1% one-strain synbiotics), (4) C (0.1% two-strain synbiotics), and (5) D (0.1% enzyme cocktail). No significant differences were observed in body weigh...",Research in veterinary science,2026-Aug
42049696,Probiogenomic and Functional Profiling of the Novel Human Gut-Derived Probiotic Strain Lactococcus lactis SNU-H10 with Multifunctional Traits.,"Lactococcus lactis is a lactic acid-producing bacterium that is globally recognized as safe and is widely used in the food industry, with certain strains exhibiting probiotic properties. Although most studies on L. lactis have focused on strains isolated from dairy products, bacteria derived from the gastrointestinal tract may possess traits that enhance their survival and colonization in the gut environment. In this study, we investigated the probiotic potential of human gut-derived L. lactis S...",Journal of microbiology and biotechnology,2026-Apr
42046378,A Neutral Triple-Helix Pomegranate (Punica granatum) Peel Polysaccharide with Lipid-Lowering and Prebiotic Activities.,"A homogeneous neutral polysaccharide (PPP-1; 1.5 × 104 Da) was isolated from pomegranate peel and characterized as a glucose-rich glucan with α-/β-pyranose linkages and a triple-helix conformation. PPP-1 improved lipid dysregulation in oleic acid-treated HepG2 cells, reducing total cholesterol and triglycerides (TG) by up to 76.2 and 70.4%, respectively, and lowering low-density lipoprotein cholesterol (LDL-C) while increasing high-density lipoprotein cholesterol (HDL-C), accompanied by suppress...",Journal of agricultural and food chemistry,2026-May
