pmid,title,abstract,journal,pub_date
41373837,Transcriptomic Changes Underlying the Anti-Steatotic Effects of DHA Supplementation in Aged Obese Female Mice.,"The prevalence of metabolic dysfunction-associated steatotic liver disease (MASLD) increases with age and obesity. The aim of this study was to characterize the transcriptomic changes in liver underlying the beneficial effects of docosahexaenoic acid (DHA) supplementation on MASLD progression in aged obese female mice. Two-month-old C57BL/6J female mice were fed ad libitum with high fat saturated diet (HFD, 45%) for 4 months. These diet-induced obese (DIO) mice were divided into two groups: the ...",International journal of molecular sciences,2025-Dec
41349157,Changes in erythrocyte fatty acid profile after 12 weeks of omega-3 fatty acid (EPA+DHA) supplementation and endurance training in amateur runners.,"Fatty acid (FA) profiles can be examined in both plasma and red blood cells (RBCs), with the latter showing the average FA concentrations over the past 3-4 months and not being susceptible to daily fluctuations dependent on diet or supplementation. This study provides data on changes in the FA profile in RBCs as a result of 12 weeks supplementation with long chain omega-3 polyunsaturated fatty acids (n-3 PUFAs; EPA and DHA) and training intervention in amateur runners. The study included 26 amat...","Prostaglandins, leukotrienes, and essential fatty acids",2026-Apr
41295400,Native Collagen and Total Lipid Extract Obtained from Caranx hyppos By-Products: Characterization for Potential Use in the Biomedical and Nutraceutical Fields.,"The processing of fishery products generates a substantial amount of by-products, which can be utilized to promote a circular economy. The objective of the present study was to extract and characterize native collagen and total lipid extract from the fish skin and bones of crevalle jack (Caranx hippos). Physicochemical, structural, and morphological properties were evaluated for collagens. Chemical composition and functional properties were evaluated for lipid extracts. Native type I collagens w...",Marine drugs,2025-Nov
41269033,Nootropic Supplements and Exercise: Patterns and Perceptions of Cognitive Enhancer Use in Physically Active Individuals.,"'Nootropic' describes compounds that enhance cognition. Dietary supplement companies leverage this concept as a descriptor for product marketing. Given that half of all American adults, as well as many active individuals, use a dietary supplement, the purpose of this study was to explore nootropic use in physically active individuals. Nootropic use was evaluated via an online survey. Preferred nootropics, dose, frequency, reasons for use, and perceived effects were evaluated. In total, 152 indiv...",Journal of dietary supplements,2026
41201837,Fish-Oil Supplementation and Cardiovascular Events in Patients Receiving Hemodialysis.,"Cardiovascular disease is the leading cause of death in patients receiving hemodialysis, yet effective preventive therapies remain limited. Supplementation with n-3 polyunsaturated fatty acids, especially eicosapentaenoic acid (EPA) and docosahexaenoic acid (DHA), may have cardiovascular benefits in the general population, but efficacy among patients receiving hemodialysis is uncertain.",The New England journal of medicine,2026-Jan
41176281,Associations of Plasma Omega-3 Fatty Acid Levels and Reported Fish Oil Supplement Use with Depression and Anxiety: A Cross-Sectional Analysis from the United Kingdom Biobank.,The role that marine omega-3 (n-3) polyunsaturated fatty acids (PUFAs) may play in reducing the risk for developing depression and/or anxiety is unclear.,The Journal of nutrition,2026-Jan
41156531,Marine-Based Omega-3 Fatty Acids and Metabolic Syndrome: A Systematic Review and Meta-Analysis of Randomized Controlled Trials.,"Metabolic syndrome (MetS) is a set of cardiometabolic abnormalities, including central obesity, dyslipidemia, hypertension, and hyperglycemia, that substantially increases the risk of cardiovascular disease and type 2 diabetes. Marine-derived omega-3 polyunsaturated fatty acids (n-3 PUFAs), especially eicosapentaenoic acid (EPA) and docosahexaenoic acid (DHA), may improve MetS components through triglyceride-lowering, anti-inflammatory, and insulin-sensitizing effects; however, randomized contro...",Nutrients,2025-Oct
41110030,Effect of Dunaliella salina supplement on growth of probiotic bacteria and nutritional values of Kefir.,"Probiotic-rich foods like kefir are increasingly recognized for their benefits to gut health and overall well-being. This study aimed to improve the functionality and nutritional value of kefir by supplementing it with Dunaliella salina, a microalga rich in bioactive compounds and minerals. The effects of D. salina at 0%, 0.25%, 0.5%, and 1.0% concentrations were evaluated on the growth of bacteria (Lactobacillus delbrueckii subsp. bulgaricus, Streptococcus salivarius subsp. thermophilus, Lactob...",Brazilian journal of microbiology : [publication of the Brazilian Society for Microbiology],2025-Dec
