pmid,title,abstract,journal,pub_date
40931813,Effects of the Probiotics Lactobacillus rhamnosus DM163 and Lactobacillus delbrueckii DPUL-F36 on Anxiety-Related and Emotional Behaviors in Male Wistar Rats Under an Altered Light-Dark Cycle.,"Anxiety and stress are prevalent mental health issues. Traditional drug treatments often come with unwanted side effects and may not produce the desired results. As an alternative, probiotics are being used as a treatment option due to their lack of specific side effects. Probiotics are live microorganisms that, in sufficient amounts, benefit the host's health. The human digestive tract naturally contains hundreds of different types of bacteria; among these bacteria, probiotic strains of Lactoba...",Brain and behavior,2025-Sep
40931392,"Chlorophylls and β-carotene in Spirulina platensis Dietary Supplements: Nano Liquid Chromatography Versus Diffuse Reflectance Spectroscopy for Establishing Composition, Quality Control, and Comparison of Commercial Products.","Spirulina is considered a superfood due to its chlorophylls. Two new methods for the determination of chlorophylls and β-carotene were developed here, one based on in-tube solid-phase microextraction (IT-SPME) coupled online to nanoliquid chromatography (nanoLC) with diode array detection (DAD), and the other on ultraviolet-visible diffuse reflectance spectroscopy (UV-vis DRS). A protocol to extract the pigments from spirulina was proposed using ethanol (1.5 mL). The aim is to provide fast and e...",Journal of separation science,2025-Sep
40927946,Effects of Walnut (Juglans regia L.) Green Husk Supplemented to Total Mixture Ration on In Vitro Rumen Fermentation Parameters and Microbial Protein Synthesis.,"The aim of this experiment was to determine the effects of walnut (Juglans regia L.) green husk (WGH) supplemented to ration on rumen fermentation by in vitro gas production technique. WGH was supplemented at different ratios (0%, 2%, 4%, 6%, 8%, and 10%) to the total mixture ration formed from 80%/20% roughage/concentrate feed. Experimental rations were incubated with 1/2 rumen fluid/artificial saliva mixture in in vitro gas production syringes in a water bath at 39°C ± 1°C for 24 h. WGH supple...",Animal science journal = Nihon chikusan Gakkaiho,2025
40923755,Genomic Analysis for the Safety Assessment of a Potential Probiotic Strain Pediococcus pentosaceus BBS1 Isolated From Lao Fermented Bamboo Shoots (Nor Mai Som).,"Currently, there is an increasing use of whole-genome sequencing (WGS) studies to investigate the molecular taxonomy, metabolic properties, enzyme capabilities, and bioactive substances of lactic acid bacteria (LAB) species. In this study, the genome of strain Pediococcus pentosaceus BBS1 was sequenced using the Illumina HiSeq. 2500 platform to determine its classification, annotate its main features, and evaluate its safety characteristics. Results showed an average nucleotide identity (ANI) va...",MicrobiologyOpen,2025-Oct
40920195,The ameliorative effect of Lactiplantibacillus plantarum SCS2 on DSS-induced murine colitis.,"The inhibitory effects of Lactiplantibacillus plantarum on inflammatory responses are known, but its action mechanisms in oxidative stress, immunomodulation, and intestinal homeostasis remain of interest. Accordingly, we investigated the protective effects of Lactiplantibacillus plantarum SCS2 (L. plantarum SCS2) against sodium dextran sulfate (DSS)-induced colitis in mice as well as elucidated its impact on inflammation, oxidative stress, and intestinal microbiota. The gut microbiota compositio...",Archives of microbiology,2025-Sep
40903738,"Probiotic, antimicrobial and anticancer properties of Lysinibacillus macroides, Kurthia huakuii, and Enterococcus faecium isolated from freshwater snail gut microbiota.","The composition and roles of intestinal microbial populations have been clarified including mammals and humans however, less is understood concerning the gut microbiota of mollusks. For the first time, we investigated non-parasite transmitting freshwater snails Lanistes carinatus (L. carinatus), Cleopatra bulimoides (C. bulimoides) and Helisoma duryi (H. duryi) gut microbiota as a source of probiotic strains with anticancer potential and explore their microbial population structure.",BMC biotechnology,2025-Sep
40895303,Synergistic antibacterial effects of postbiotics combined with linezolid and amikacin against nosocomial pathogens.,"The global rise in antimicrobial resistance (AMR) has rendered many conventional antibiotics less effective, particularly against nosocomial pathogens such as Staphylococcus aureus, Escherichia coli, Pseudomonas aeruginosa, and Proteus mirabilis. This study investigated the antimicrobial and synergistic effects of postbiotics derived from Lacticaseibacillus casei, Lactobacillus bulgaricus, Enterococcus faecium, and Streptococcus thermophilus, administered alone or in combination with either line...",Frontiers in cellular and infection microbiology,2025
40895298,Meta-analysis of probiotic metabolites in the prevention of gestational weight gain and postpartum weight retention.,Maternal weight gain and metabolic health during pregnancy significantly influence both short- and long-term outcomes for mother and child.,Frontiers in cellular and infection microbiology,2025
40886028,The effect of barberry supplementation on components of metabolic syndrome: a grade assessment systematic review and meta-analysis of randomized controlled trials.,"Polyphenol-rich foods, such as barberry, improve cardiovascular risk factors, but evidence remains inconsistent. Therefore, this systematic review and meta-analysis were carried out to assess the effects of barberry supplementation on components of metabolic syndrome in adults.","Journal of health, population, and nutrition",2025-Aug
40883382,"A comparative study of flaxseed gum effect on Lactobacillus acidophilus genes expression, and textural, sensory, structural, and microbiological properties of synbiotic Iranian white cheese.","Flaxseed gum (FG), a natural polysaccharide with prebiotic potential, may enhance probiotic functionality by modulating bacterial gene expression and improving viability in synbiotic dairy matrices. This study evaluated the effect of FG (2.5% and 5%) on Lactobacillus acidophilus gene expression, viability, sensory properties, texture, and microstructure in Iranian white cheese. Four functional genes were selected for their roles in amino acid biosynthesis, stress adaptation, metabolic regulation...",Scientific reports,2025-Aug
40877785,Complete genome sequence of the probiotic candidate strain Lacticaseibacillus rhamnosus B3421 isolated from Panax ginseng C. A. Meyer in South Korea.,"Lacticaseibacillus rhamnosus is a widely recognized probiotic bacteria with therapeutic applications in human and animal health. The L. rhamnosus B3421 strain, isolated from Panax ginseng, has been reported to be associated with antioxidant and anti-inflammatory properties, supporting its functional potential. We sequenced and analyzed the genome of L. rhamnosus B3421 to evaluate its probiotic potential for human healthcare and animal applications, focusing on genomic features related to safety ...",BMC genomic data,2025-Aug
40875762,"Towards holistic colony feeding: Effects of vitamin supplementation on summer and winter honey bee workers, Apis mellifera L.","In managed western honey bee, Apis mellifera, colonies, vitamins are often neglected when it comes to SI feeding despite their importance for health. Moreover, the potential links of vitamin feeding to longevity, food consumption and adult dry weight are poorly understood. Finally, comparative nutritional studies of short-lived summer workers and long-lived winter workers are currently lacking. Here, in a fully-crossed design, multivitamin supplementation of vitamins A, D, E, K, C, B1, B2, B3, B...",PloS one,2025
40871666,Postbiotics Derived from Lactococcus lactis and Streptococcus thermophilus Attenuate Experimental Periodontitis by Modulating Macrophage Polarization and Osteoclastogenesis.,"Background/Objectives: The potential of probiotics and postbiotics as adjunctive or alternative therapies for periodontal disease, which is characterized by chronic inflammation and alveolar bone loss, is gaining increasing attention. In this study, we aimed to elucidate the impact of postbiotic Lactococcus lactis HY449 and Streptococcus thermophilus HY9012 on key cellular processes implicated in the pathogenesis of periodontitis. Methods: THP-1 cells were polarized into M1 macrophages by exposu...",Nutrients,2025-Aug
40871615,Balancing the Cellular Inflammatory-Homeostatic Axis Through Natural Ingredient Supplementation.,"Dietary supplements are sources of nutrients or other substances that added to a healthy lifestyle help to preserve human homeostasis. Since inflammation is one of the major contributors to the alteration of homeostasis, this work investigated the effects of a multi-ingredient dietary supplement on human macrophages, cells involved in the inflammatory response.",Nutrients,2025-Aug
40869419,Efficacy of Lactobacillus spp. Interventions to Modulate Mood Symptoms: A Scoping Review of Clinical Trials.,"Probiotics containing Lactobacillus spp. have demonstrated immunological and gastrointestinal benefits and may aid in recovery from mood disorders. However, evidence of their mood-modulating efficacy remains inconsistent. Aim: To analyze the efficacy of probiotic interventions with Lactobacillus spp. in modulating mood in humans. A scoping review was conducted following the PRISMA guidelines. A systematic search of the PubMed and Scopus databases was performed using nine Boolean combinations of ...",International journal of molecular sciences,2025-Aug
40869311,Synergistic Anti-Obesity Effects of Lactiplantibacillus plantarum Q180 and Phaeodactylum tricornutum (CKDB-322) in High-Fat-Diet-Induced Obese Mice.,"Obesity and associated metabolic disorders are rising globally, necessitating effective dietary strategies. CKDB-322, a formulation containing Lactiplantibacillus plantarum Q180 and Phaeodactylum tricornutum, was evaluated for anti-obesity efficacy using in vitro adipocyte differentiation and in vivo high-fat-diet (HFD)-induced obese mouse models. In 3T3-L1 cells, CKDB-322 suppressed adipogenesis by downregulating PPARγ and C/EBPα and enhancing glycerol release. In mice, 8 weeks of oral administ...",International journal of molecular sciences,2025-Aug
40878323,"Reduced-Calorie Apricot-Based Lacto-Fermented Beverages: Evaluation of Probiotic Content, Physicochemical, and Sensory Properties.","Optimizing the formulation is essential to enhance probiotic viability, sensory quality, and shelf-life stability, thereby supporting the development of a consumer-acceptable and commercially viable non-dairy functional beverage. This study focused on optimizing the fermentation process of apricot-based beverages using three probiotic strains: Lactiplantibacillus plantarum XL963 (LP), Limosilactobacillus fermentum W8 (LF), and Lactiplantibacillus pentosus ML104 (LPN). Fermentation conditions wer...",Journal of food science,2025-Sep
40874562,Lactobacillus brevis ZFM820 Attenuates LPS-Induced Inflammation via Biofilm Formation and Metabolic Reprogramming.,"Emerging evidence implicates lipopolysaccharide (LPS) embedded in the outer membrane of Gram-negative bacteria as a key mediator of intestinal inflammation. A preliminary study found that a potent Lactobacillus brevis strain named ZFM820 showed remarkable antibacterial activity against LPS-producing Escherichia coli compared to other lactic acid bacteria through an unexplored mechanism. This study systematically investigated the anti-LPS phenotypes, responsive factors, and mechanism of ZFM820. T...",Journal of agricultural and food chemistry,2025-Sep
40856866,Clinical and microbiological effectiveness of limosilactobacillus reuteri in supportive periodontal therapy: randomized clinical trial.,The purpose of the present randomized clinical trial was to evaluate the clinical and microbiological effects of Limosilactobacillus reuteri probiotic therapy as an adjunct to Guided Biofilm Therapy (GBT) during supportive periodontal therapy (SPT) of patients with a history of stage III or IV and grade B or C periodontitis and residual pockets.,Clinical oral investigations,2025-Aug
40853071,"Impact of a Novel Dietary Supplement on Efficacy of Pharmacological Treatments for Androgenic Alopecia: A Real-Life, Multicenter, Randomized, Assessor-Blinded Trial on 225 Subjects.","Minoxidil and finasteride are currently the only FDA-approved pharmacological treatments for androgenic alopecia (AGA) and female androgenic alopecia (FAGA). However, substantial improvement is observed in no more than 20% of patients in the medium term. To enhance clinical responses, nonpharmacological dietary supplementation is often utilized.",Journal of cosmetic dermatology,2025-Sep
40859113,Postbiotic-Mediated Obesity Reduction via Bioactive Peptide ETLVK and Gut Microbiota in HFD Mice.,"Although Lactiplantibacillus plantarum (L. plantarum) TCCC11824 (CGMCC 8198) has shown antiobesity effects, its active components remained unclear. This study reveals that the L. plantarum TCCC11824 crushed supernatant (LpS) exerts broad antiobesity activities in high-fat diet (HFD)-induced obese mice. LpS significantly improved blood lipid profiles, reduced hepatic injury, and suppressed inflammation in liver and epididymal fat. It also mitigated ectopic fat accumulation and modulated gut micro...",Journal of agricultural and food chemistry,2025-Sep
40851019,Prebiotic properties and antioxidant effect of crude extracts and polysaccharides from Agaricus bisporus and Pleurotus ostreatus mushrooms.,"Modifying the gut microbiome, also known as bacteriotherapy, is a key strategy that uses probiotics, prebiotics, or synbiotics to reduce inflammation and fight infection and colonization by pathogenic bacteria. Various food sources, particularly those rich in Lactobacillus species, are well-recognized for their probiotic properties. Edible mushrooms are rich with their nutrient-dense composition, including carbohydrates, proteins, fibers, minerals, vitamins, and lipids, which stand out as a prom...",Scientific reports,2025-Aug
40847281,Whole-genome sequencing and probiotic properties of Lactobacillus helveticus KM7 isolated from the gut of the Chinese honey bee (Apis cerana): A promising exopolysaccharide-producing strain.,"Lactobacillus helveticus is a probiotic bacterium widely used in the food industry. In this study, we evaluate the safety and probiotic properties of L. helveticus strain KM7, isolated from the gut of Apis cerana, through whole-genome sequencing and in vitro experiments. The complete genome consists of 2,164,024 bp, encoding 2192 genes with an average GC content of 36.82%. The strain lacks identifiable virulence factor genes and antibiotic resistance genes, shows no hemolytic activity, and canno...",BMC microbiology,2025-Aug
40850424,Postbiotic Limosilactobacillus reuteri cultured with Polygonatum kingianum polysaccharides ameliorates high-fat-high-sugar-deteriorated colitis and associated hepatobiliary disorders.,"Unhealthy diet exacerbates inflammatory bowel disease and its associated hepatic disruptions. The present study demonstrated the superior efficacy of the heat-inactivated Limosilactobacillus reuteri WX-94 (L. reuteri), cultured with Polygonatum kingianum polysaccharides (PKP postbiotic) in ameliorating a high-fat-high-sugar (HFHS)- deteriorated colitis in rats, which outperforming PKP alone, its symbiotic form, and inactivated L. reuteri cultured without PKP. HFHS deteriorated liver functions in...",International journal of biological macromolecules,2025-Sep
40848786,c-Myc derived DNAzyme and its application for the detection of a novel probiotic bacteria L. fermentum using the peroxidase mimicking activity.,"Catalytically active DNA molecules are called DNAzymes. Single-stranded guanine-rich DNA molecules that can fold into G-quadruplex structures, on interaction with hemin, can exhibit peroxidase-like activity. In this study, we report a c-Myc G-quadruplex forming DNA sequence in complex with hemin, which demonstrates DNAzyme properties and aim to develop a rapid, simple, cost-effective, and culture-free method for detecting probiotic bacteria. The interaction between hemin and c-Myc G-quadruplex D...",International journal of biological macromolecules,2025-Sep
40848201,"Isolation, identification and selection of beneficial canine homologous lactic acid bacteria by their potential probiotic characteristics.","Companion animals have become an increasingly important part of human life, consequently, there is a significant increase in the demand of natural food ingredients and functional foods in order to improve their health and well-being. Probiotics have been used in humans and production animals and have recently attracted the focus of the pet industry. Therefore, the main objective of this work was to isolate, and survey the different beneficial properties of lactic acid bacteria (LAB) strains from...",Veterinary research communications,2025-Aug
40845989,Emulgels powered by coco-glucoside: A stable and effective synbiotics delivery system for skin care.,"The synergy of prebiotics and probiotics in the form of emulgels offers a promising solution and may be an essential strategy for delivering bioactive substances to protect the skin. In this study, a series of emulgels were created by incorporating Lactobacillus rhamnosus (L. rhamnosus), Lactobacillus plantarum (L. plantarum), and Lactobacillus acidophilus (L. acidophilus) with lactobionic acid, xylitol, and inulin. Additionally, the surfactant coco-glucoside (CG) was used to formulate the emulg...",International journal of pharmaceutics,2025-Oct
40844622,Levilactobacillus brevis MW362790 and Pediococcus pentosaceus MT323062 Alleviate Cadmium-Induced Oxidative Stress and Hepato-renal Toxicity.,"Heavy metal contamination, particularly cadmium (Cd), poses serious health risks through bioaccumulation and oxidative stress. Certain lactic acid bacteria (LAB) exhibit metal-binding properties and have demonstrated potential in mitigating Cd toxicity. This study evaluated the ameliorative effects of two locally isolated LAB strains Levilactobacillus brevis MW362790 and Pediococcus pentosaceus MT323062 against Cd-induced toxicity in rat model. Over 12 weeks of experiment, rats were divided into...",Current microbiology,2025-Aug
40843981,Novel Probiotic Strains From Honey and Fermented Edible Flowers Mitigate Chronic Cortisol-Induced Leaky Gut Syndrome in the CaCo2 Cell Model.,"Chronic stress and elevated cortisol levels can compromise intestinal barrier function, potentially leading to leaky gut syndrome and associated health conditions. The probiotic potential of novel strains isolated from honey and edible flowers was evaluated in the present study. Five strains identified as Lactiplantibacillus plantarum (MP), Enterococcus lactis (PERI), Lactiplantibacillus plantarum (PARI), Lactocasiebacillus rhamnosus (M1A), and Enterococcus nangengnisis (KK) exhibited strong bil...",Journal of food science,2025-Aug
40839135,Synbiotics as Modulators of Developing Brain for Reproductive Development Via Estrogen Receptors in Male Coturnix Coturnix Japonica.,"The brain-gut-microbiome axis represents a bidirectional communication linking the gastrointestinal microbiome with immunity, digestion, reproduction and nervous system. Dietary supplementation of Lactobacillus rhamnosus, Bifidobacterium longum and mannan-oligosaccharides may modulate the brain-gut-axis and also have an effect on male reproductive physiology. Therefore, the study aims to explore the reproductive and neuronal physiology potentials of synbiotics in immature male Japanese quails. T...",Neurochemical research,2025-Aug
40830792,Goat-derived Lactobacillus amylovorus improved floppy kid syndrome via regulating gut microflora.,"Floppy Kid Syndrome (FKS) severely restricts goat farming due to high mortality from metabolic disturbances and gut dysbiosis. Here, we aimed to isolate a goat-derived probiotic and evaluate its capacity to restore gut homeostasis in FKSaffected goats.",BMC veterinary research,2025-Aug
40828029,Life's homochirality: Across a prebiotic network.,"For centuries, scientists have been puzzled by the mystery of life's biomolecular homochirality-the single-handedness of biological compounds. Sugars and nucleic acids are right-handed, while amino acids are left-handed in biological systems. Likewise, certain metabolites are homochiral, though their handedness varies. However, efforts to address the homochirality problem have often focused on a single compound, a single molecular class, or invoke an extraterrestrial origin. Here, we emphasize t...",Proceedings of the National Academy of Sciences of the United States of America,2025-Aug
40825676,Apoptosis-Inducing Effects of Lactobacillus plantarum DS0709 in Colorectal Cancer.,"In colorectal cancer (CRC) treatment, various approaches, including chemotherapy (5-FU, irinotecan, and oxaliplatin), targeted therapy (VEGF inhibitor) and immunotherapy (PD-1/ PD-L1 inhibitor), are employed. However, due to side effects and limited efficacy, more effective novel therapeutic strategies have been required. In this study, we identified the anti-cancer effects of Lactobacillus plantarum DS0709, isolated from infant feces, on CRC. Treatment with the supernatant (Sup) of L. plantarum...",Journal of microbiology and biotechnology,2025-Aug
40819648,"Ferritin-guided iron supplementation as an alternative or complement to prolonged blood donation intervals (FORTE): a double-blind, randomised, controlled trial.","Regular blood donation is associated with an increased risk of iron deficiency and anaemia. Oral iron supplementation is known to shorten post-donation iron recovery time and could serve as an alternative to extended donation intervals. We aimed to evaluate the effect of different iron supplementation protocols on ferritin and haemoglobin levels, gastrointestinal side-effects, iron deficiency-related symptoms, and donor return compared with placebo supplementation.",The Lancet. Haematology,2025-Sep
40817120,"Strain specific effects of probiotic supplementation on serum amino acid profiles in Alzheimer's disease: a randomized, double blind, placebo controlled trial.","Alzheimer's disease (AD) is a neurodegenerative condition characterized by cognitive decline and associated metabolic disturbances, including altered amino acid profiles. This study investigated the effects of probiotic supplementation with Lactobacillus rhamnosus HA-114 and Bifidobacterium longum R0175 on serum amino acid levels in adults with mild to moderate AD. In a 12-week, randomized, double-blind, placebo-controlled trial, 60 participants (aged 50-90 years) were assigned to three groups: ...",Scientific reports,2025-Aug
40813423,Ameliorative effects of coriander extract supplementation in mitigating nickel toxicity in grass carp (Ctenopharyngodon idella).,"This research explored the ameliorative effects of coriander (Coriandrum sativum) seed extract supplementation in mitigating nickel (Ni) toxicity in fish. For this purpose, Ctenopharyngodon idella fingerlings (average weight: 12.35 ± 0.04 g/fish) were randomly assigned to 18 tanks, divided into six groups with three replicates each. The six treatments were categorized as follows: the negative control group (NC) received no supplement and no Ni exposure, while the positive control group (PC) was ...",Scientific reports,2025-Aug
40813282,Innovative fermented milk enriched with the safe probiotic Lactiplantibacillus plantarum LVS14: genomic characterization and in vivo effectiveness.,"Lactiplantibacillus plantarum is a probiotic known for its diverse health-promoting effects. In the current study, fifty lactic acid bacteria isolates were screened for probiotic characteristics, cholesterol-reducing potential, antioxidant activity, and antimicrobial properties. Among these, one isolate, namely LVS14, exhibited remarkable probiotic and cholesterol-reducing capabilities. Phenotypically, the isolate LVS14 demonstrated no hemolytic activity and was susceptible to antibiotics under ...",Food & function,2025-Aug
40812647,Immune function of a novel lysozyme in Litopenaeus vannamei and its application as a feed supplement.,"As a key component of humoral immunity within the innate immune system, lysozyme plays a crucial role in host defense against pathogenic infections. In this study, the cDNA sequence of an i-type lysozyme was obtained from Litopenaeus vannamei, and designated as LvLysi3. Following stimulation by Vibrio parahaemolyticus, transcripts of LvLysi3 in shrimp intestine, hepatopancreas and hemocytes was significantly up-regulated. Activity assays with recombinant protein showed LvLysi3 had agglutination ...",International journal of biological macromolecules,2025-Sep
40807300,In Vitro Prebiotic Potential of Opuntia humifusa Leaf Extract and Its Active Constituent.,"Opuntia humifusa (commonly known as Cheon-nyun-cho) has traditionally been used for its antioxidant, laxative, and immune-boosting properties, but its potential prebiotic activity remains largely unexplored. In this study, we evaluated the prebiotic potential of O. humifusa leaf and fruit extracts by assessing their effects on the growth of four Lactobacillus spp. strains. Among them, Lactobacillus paracasei KCTC 12576 exhibited the most pronounced response to the extracts and was therefore sele...","Molecules (Basel, Switzerland)",2025-Jul
