pmid,title,abstract,journal,pub_date
42210904,3-Fucosyllactose and 3'-sialyllactose combined with Lacticaseibacillus rhamnosus 1.0320 alleviate necrotizing enterocolitis by modulating the gut microbiota and regulating NF-κB/Nrf2 pathways.,"Necrotizing enterocolitis (NEC) is a severe gastrointestinal disease that primarily affects premature infants. In recent years, increasing attention has been paid to the potential roles of human milk oligosaccharides (HMOs) and probiotics in the prevention and treatment of NEC. In this study, a neonatal rat NEC model was established to evaluate the protective effects of Lacticaseibacillus rhamnosus 1.0320 combined with 3-FL and 3'-SL. The results demonstrated that 1.0320FS improved the macroscop...",Food & function,2026-Jun
42208544,"Pro/synbiotics reduce systemic inflammation and improve gut health in Kenyan infants: An open label, randomized, 4-arm, phase II trial.","Environmental enteric dysfunction, universal in young children exposed to poor sanitation and hygiene, impairs growth and development through malabsorption and as a driver of chronic systemic inflammation (CSI). In an open-label, randomized, four-arm, phase II clinical trial, infants with birthweight ≥2000 g in Homa Bay County, western Kenya receive live, multi-strain Bifidobacterium spp. and Lactobacillaceae pro/synbiotics from 0 to 6 months. CSI (plasma α1-acid glycoprotein >1 g/L) at age 6 mo...",Cell reports. Medicine,2026-Jun
42207096,"Modulation of TLR4, hBD-2, and hBD-3 expression and hepatic tissue response by systemic probiotics in experimental apical periodontitis in rats.","To evaluate whether systemic supplementation with L. rhamnosus LR-04 and L. acidophilus LA-14 modulates the expression of TLR4, hBD-2, and hBD-3 in a rat model of experimental apical periodontitis (AP), and to assess potential histopathological alterations in the liver.",Journal of applied oral science : revista FOB,2026
42202393,Exploratory pilot trial of a multicomponent immunonutritional supplement in children with allergic asthma and rhinitis: The INAPRA study.,Allergic asthma and allergic rhinitis (AR) are among the most frequent chronic conditions in the pediatric age. They frequently coexist in children and are sustained by type 2- driven airway inflammation and impaired epithelial-immune interactions. Immunonutritional and postbiotic strategies have been proposed as adjunctive therapeutic approaches for these diseases.,International immunopharmacology,2026-Sep
42197271,"Cold-Adapted Uric Acid-Degrading Lacticaseibacillus paracasei NEFU-6 Application in Kimchi ""Paocai"".","The use of lactic acid bacteria for the management of hyperuricemia has attracted growing interest, whereas the specific emphasis on cold-adapted uric acid-degrading probiotics in the fermentation of traditional foods remains underexplored. In this study, Lacticaseibacillus paracasei NEFU-6 was isolated from Northeastern Chinese Kimchi and efficiently degraded uric acid (UA) at a temperature relevant to food fermentation (15 °C) and under simulated physiological conditions (37 °C). The results s...","Molecules (Basel, Switzerland)",2026-May
42197057,Vitamin B12 Supplementation: Is More Always Better?,"Vitamin B12 supplementation among people without proven deficiency has become popularized, driven by perceptions of (i) frequent underdiagnosis of deficiency, (ii) promotion as a natural enhancer of well-being, and (iii) a favourable safety profile. Here, we examine whether these claims align with current evidence. We present guidance from major health authorities, which advises against routine testing in asymptomatic individuals without risk factors. The prevalence of B12 deficiency varies grea...",Nutrients,2026-May
42197039,The Effects of Colostrum Bovinum Supplementation on Human Body Fat Content and/or Blood Lipid Profile: A Systematic Review of Clinical Trials.,"Bovine colostrum (COL) is widely used in dietary supplements, and previous studies have suggested its potential benefits for immune function, selected clinical conditions, wound healing, and athletic performance. This systematic review analyzed clinical trials published between 2001 and 2025 that investigated the effects of COL on human body fat and blood lipid profiles. The review was conducted in accordance with PRISMA guidelines, and study quality was assessed using Cochrane risk-of-bias tool...",Nutrients,2026-May
42197013,Myoinositol and Selenium (MYSE) Supplementation Is Associated with Favorable Changes in Thyroid Parameters and Migraine Outcomes in Patients with Migraine and Hashimoto's Thyroiditis: A Retrospective Cohort Study.,"Background/Objectives: Migraine and Hashimoto's thyroiditis (HT) are frequently comorbid, implying shared biological pathways. Selenium and myoinositol are involved in migraine pathophysiology, and their supplementation has been shown to improve thyroid function, particularly in individuals with HT. This study aimed to evaluate the impact of combined myoinositol and selenium (MYSE) supplementation on thyroid function and migraine outcomes in patients with migraine and HT. Methods: We conducted a...",Nutrients,2026-May
42191965,Synergistic and antagonistic interactions between colistin and cell-free supernatants of Lactobacillus species against clinical isolates of Acinetobacter baumannii.,"Acinetobacter baumannii is a major contributor to hospital-acquired infections and presents substantial therapeutic challenges due to its extensive antibiotic resistance. Although colistin remains one of the final treatment options, the rising incidence of colistin resistance underscores the urgent need for alternative or complementary therapeutic strategies. Probiotics such as Lactobacillus rhamnosus and Lactobacillus fermentum have gained attention for their antimicrobial activities and abilit...",Brazilian journal of microbiology : [publication of the Brazilian Society for Microbiology],2026-May
42190999,Electrospun nanofibers for antibiotic and probiotic co-delivery to target bacterial vaginosis.,"Despite initial success, antibiotic therapy for bacterial vaginosis (BV) often fails within a year to prevent recurrence. Probiotic therapy has shown promise, but inconvenient and frequent administration may affect user adherence. Recently, probiotic (lactobacilli) therapy alone was shown insufficient to dislodge fastidious anaerobic bacteria such as Gardnerella. Nanofiber devices offer a means for controlled delivery of active agents for vaginal application. This study developed a novel nanofib...",International journal of pharmaceutics,2026-Jun
