pmid,title,abstract,journal,pub_date
42275129,Effect of postbiotics on biofilm formation and gene expression in Candida spp. isolates from patients with recurrent vulvovaginal candidiasis.,"First-line treatment for vulvovaginal candidiasis (VVC) has reduced efficacy in patients with recurrent VVC (RVVC), prompting the search for therapeutic alternatives such as probiotics. Recently, postbiotics (cellular components and metabolites derived from probiotics) have gained relevance because they offer similar benefits to probiotics without the risks associated with live microorganisms. This study aimed to evaluate the anti-biofilm effect of cell-free supernatants (CFSs) derived from prob...",Medical mycology,2026-Jun
42275112,Preparation and evaluation of mucoadhesive vaginal tablets containing probiotic Lactobacillus gasseri strains isolated from the vaginal microbiota.,"Probiotics are widely used to restore microbiota balance and prevent dysbiosis. In this study, the aim was to develop mucoadhesive vaginal tablets containing probiotic Lactobacillus gasseri H14 and H15 strains, representing low and high exopolysaccharide (EPS) producers, respectively, and isolated from the vaginal microbiota of healthy women.",Journal of applied microbiology,2026-Jun
42270247,Colon-targeted alginate/chitosan microspheres for co-delivery of synbiotics and nanozymes ameliorate inflammatory bowel disease.,"Inflammatory bowel disease (IBD) is closely associated with gut dysbiosis and immune imbalance. Synbiotics, combining probiotics and prebiotics, represent a promising dietary strategy; however, their therapeutic efficacy is often limited by poor gastrointestinal stability and insufficient colon delivery. In this study, we developed a colon-targeted delivery system based on alginate/chitosan microspheres for the co-delivery of L. acidophilus, prebiotic stachyose, and a redox-active component. The...","Food research international (Ottawa, Ont.)",2026-Sep
42269583,Engineered probiotic for hepatic encephalopathy.,"Hepatic encephalopathy is a devastating neuroinflammatory complication of cirrhosis driven by systemic metabolic dysregulation across the gut-liver-brain axis. In a recent article in Cell, Aggarwal et al. engineered a multi-strain bacterial cocktail to simultaneously neutralize toxic ammonia and L-glutamine while replenishing essential amino acids, offering a promising, targeted therapeutic strategy.",Cell host & microbe,2026-Jun
42269342,Portable ratiometric fluorescent sensor based on chiral carbon dots for accurate detection of L-arginine and N-acetylcysteine in commercial dietary supplements.,"Accurate quantitation of L-arginine (L-Arg) and N-acetylcysteine (NAC) in dietary supplements is critical for quality control, while conventional analytical methods suffer from cumbersome pretreatment, long assay times, and lack of on-site screening capability. Herein, the first portable ratiometric fluorescent sensor (D-NCDs@RhB) based on chiral carbon dots were reported for the simultaneous detection of L-Arg and NAC in dietary supplements through static quenching mechanism. Under optimal expe...","Spectrochimica acta. Part A, Molecular and biomolecular spectroscopy",2026-Dec
42256481,The role of specific nutrients in preventing immune system and blood cell disorders: an umbrella review.,"Nutritional deficiencies affecting the immune and haematopoietic systems represent a well-known global public health challenge: only the iron deficiency anaemia affects 1.62 billion individuals, especially in vulnerable populations. However, the protective effect that nutrition might give on disorders of these systems is still poorly understood. This umbrella review aims to synthesise the available evidence on the effectiveness of nutritional interventions in the primary prevention of blood and ...",Journal of preventive medicine and hygiene,2025-Dec
42253130,Influence of Culturing Temperature on Bacteriocin Production and Safety Behavior on Bacteriocinogenic cocci With Antimicrobial and Probiotic Potential.,"The selection of novel probiotic candidates requires rigorous evaluation of safety and functional properties. This study aimed to assess safety, bacteriocin production and probiotic potential of four bacterial strains isolated from artisanal cheeses: Enterococcus faecium ST02JL and ST03JL, Lactococcus garvieae ST04JL, and Staphylococcus epidermidis ST0409KOC. Experiments were conducted at 37°C and 39°C to simulate physiological and thermal stress conditions. All strains were phenotypically safe,...",Molecular nutrition & food research,2026-Jun
42250713,The bioactive potential of red seaweed oligosaccharides obtained using autohydrolysis: Correlation between extract composition and prebiotic activity.,"This study evaluated, for the first time, the prebiotic-like potential of glucooligosaccharides and galactooligosaccharides derived from five red seaweeds, produced using autohydrolysis. The non-purified oligosaccharide-rich extracts were characterized in terms of composition, glycosidic linkages, and molecular weight profiles. They were then evaluated for cytotoxicity (using a co-culture of Caco-2 and HT29-MTX cells), as well as for their ability to serve as the carbon source for the growth of ...",International journal of biological macromolecules,2026-Jul
42250036,Unveiling the Nutraceutical Potential of Yam Dioscorea alata L.: A Comprehensive Review.,"Dioscorea alata L. (water yam and purple yam) is a traditionally important food and medicinal plant widely used in Asia and the Pacific Islands. It has long been utilized in traditional medicine for treating weakness, inflammation, menstrual disorders, wound healing, and gastrointestinal ailments. The dual role as a dietary and therapeutic resource highlights its ethnopharmacological importance and supports the need for scientific validation. This review evaluates existing knowledge on the nutra...","Plant foods for human nutrition (Dordrecht, Netherlands)",2026-Jun
