pmid,title,abstract,journal,pub_date
40806772,Dietary Supplementation with Probiotics Alleviates Intestinal Injury in LPS-Challenged Piglets.,"This study aimed to assess whether dietary supplementation with probiotics could alleviate intestinal injury in lipopolysaccharide (LPS)-challenged piglets. Healthy weaned piglets were randomly allocated to four individual groups (n = 6): (1) a control group; (2) an LPS group; (3) an LPS + Lactobacillus group; and (4) an LPS + Bacillus group. The control and LPS groups received a basal diet, while the probiotic groups were provided with the same basal diet supplemented with 6 × 106 cfu/g of Lact...",International journal of molecular sciences,2025-Aug
40806152,Supplementation with Live and Heat-Treated Lacticaseibacillus paracasei NB23 Enhances Endurance and Attenuates Exercise-Induced Fatigue in Mice.,"Background: Exercise-induced fatigue arises primarily from energy substrate depletion and the accumulation of metabolites such as lactate and ammonia, which impair performance and delay recovery. Emerging evidence implicates gut microbiota modulation-particularly via probiotics-as a means to optimize host energy metabolism and accelerate clearance of fatigue-associated by-products. Objective: This study aimed to determine whether live or heat-inactivated Lacticaseibacillus paracasei NB23 can enh...",Nutrients,2025-Aug
40806138,Antimicrobial and Anticancer Activities of Lactiplantibacillus plantarum Probio87 Isolated from Human Breast Milk.,"Background/Objectives: This study evaluated the in vitro probiotic potential of Lactiplantibacillus plantarum Probio87 (Probio87), focusing on its physiological robustness, safety, antimicrobial properties, and anticancer activity, with relevance to vaginal and cervical health. Methods: Tests included acid and bile salt tolerance, mucin adhesion, and carbohydrate utilization. Prebiotic preferences were assessed using FOS, GOS, and inulin. Antibiotic susceptibility was evaluated per EFSA standard...",Nutrients,2025-Aug
40806121,"Lacticaseibacillus paracasei L21 and Its Postbiotics Ameliorate Ulcerative Colitis Through Gut Microbiota Modulation, Intestinal Barrier Restoration, and HIF1α/AhR-IL-22 Axis Activation: Combined In Vitro and In Vivo Evidence.","Background: Ulcerative colitis (UC), characterized by chronic intestinal inflammation, epithelial barrier dysfunction, and immune imbalance demands novel ameliorative strategies beyond conventional approaches. Methods: In this study, the probiotic properties of Lactobacillus paracaseiL21 (L. paracaseiL21) and its ability to ameliorate colitis were evaluated using an in vitro lipopolysaccharide (LPS)-induced intestinal crypt epithelial cell (IEC-6) model and an in vivo dextran sulfate sodium (DSS...",Nutrients,2025-Aug
40806100,Effect of Akkermansia muciniphila on GLP-1 and Insulin Secretion.,"Background/Objectives: Gut microbiota research has gained momentum in recent years broadening knowledge of microbial components and their potential effects on health and well-being. Strong association between explicit microbes and metabolic diseases associated with obesity and type 2 diabetes mellitus, gastrointestinal disorders, neurodegenerative diseases, and even cancers have been established. Akkermansia muciniphila is a budding next-generation probiotic that plays an important role in syste...",Nutrients,2025-Jul
40806049,Antioxidant and Anti-Inflammatory Activities of Latilactobacillus curvatus and L. sakei Isolated from Green Tripe.,"Green tripe (GRET) is rich in essential fatty acids, vitamins, calcium, phosphorus, and other nutrients and contains various beneficial microorganisms, including lactobacillus, along with feed components consumed by ruminants.",Nutrients,2025-Jul
40806023,"Use of Botanical Supplements Among Romanian Individuals with Diabetes: Results from an Online Study on Prevalence, Practices, and Glycemic Control.","Plant supplements are frequently used by diabetes mellitus (DM) patients in the management of their disease. Background/Objectives: The present study aimed to identify the prevalence of plant supplement use in DM patients from Romania and to evaluate patients' practices, profiles, and beliefs regarding plant supplements and the impact of their use on glycemic control. Methods: A cross-sectional online survey was conducted among Romanian diabetic patients. Results: Out of 329 validated responses,...",Nutrients,2025-Jul
40799052,Dietary Supplementation With White and Common Turmeric Improves Resistance to Argulus siamensis in Labeo rohita.,"This study evaluated white turmeric (Curcuma zedoaria) as a sustainable feed additive alternative to common turmeric (C. longa) for enhancing disease resistance in Labeo rohita against Argulus siamensis infection. Juvenile L. rohita (15.8 ± 1.9 g) were divided into four treatment groups (n = 60 per group): (1) Control (commercial feed), (2) common turmeric-supplemented feed (1% w/w), (3) white turmeric-supplemented feed (1% w/w), and (4) combined turmeric-supplemented feed (0.5% common +0.5% whi...",Parasite immunology,2025-Aug
40796319,Cell surface proteins of indigenous probiotics render antagonistic and protective effect on gut barrier integrity against extended-spectrum beta-lactamase (ESBL) Escherichia coli.,"Gut-mediated infections fostered by extended-spectrum beta-lactamase (ESBL)-producing Escherichia coli are increasingly prevalent in clinical settings, posing a significant challenge to the efficacy of conventional antibiotic therapy. This underscores the urgent need to identify alternatives-to-antibiotics. In this study, we investigated the antagonistic potential of total surface proteins derived from probiotic strains viz. Limosilactobacillus fermentum LbS4 (MTCC 5954), L. fermentum Lf1 (MTCC ...",Letters in applied microbiology,2025-Aug
40788963,Protective and therapeutic effects of Lactobacillus brevis PQ214320 and Bacillus subtilis PQ198038 Against experimental Trichinella Infection.,"One of the most significant lactic acid bacteria genera is Lactobacillus, which is known to generate compounds such as bacteriocins that can stop the growth of harmful bacteria. The current study investigated the protective and therapeutic effects of two novel probiotic strains, Lactobacillus brevis PQ214320, and Bacillus subtilis PQ198038, on parasitological, histopathological, and immunological responses in mice infected with Trichinella spiralis. A total of 120 mice were divided into six grou...",PLoS neglected tropical diseases,2025-Aug
40783570,Impact of a multi-strain L. crispatus-based vaginal synbiotic on the vaginal microbiome: a randomized placebo-controlled trial.,"A clinical trial of a multi-strain vaginal synbiotic (NCT05659745, registered 12/19/2022 at clinicaltrials.gov) led to an optimal vaginal microbiome dominated by L. crispatus (CST I). The synbiotic led to a significant increase in L. crispatus compared to placebo (p < 0.05), and conversion to CST I was significantly higher with the vaginal synbiotic than with placebo (90 vs 11%; p < 0.002). Mechanistically, the synbiotic reduced Gardnerella vaginalis and Candida, clinically important microbes.",NPJ biofilms and microbiomes,2025-Aug
