pmid,title,abstract,journal,pub_date
41199139,Bifidobacterium animalis Subsp. Lactis Bla36 Postbiotics Ameliorate Allergic Rhinitis in Juvenile Mice by Repairing the Mucosal Barrier and Modulating Inflammatory Pathways.,"This study explored the antiallergic effects and mechanisms of postbiotics from Bifidobacterium animalis subsp. Lactis Bla36 (Bla36), focusing on its lysate (Bla36-L), in cellular and juvenile mouse allergic rhinitis models. In RBL-2H3 cells, Bla36-L inhibited mast cell degranulation (lowering β-Hex and HIS release), downregulated Th2 cytokines (IL-4, IL-6, TNF-α), upregulated IL-10, improved HNEpC tight junction integrity to enhance mucosal barrier function, and regulated the FcεRI pathway to b...",Journal of agricultural and food chemistry,2025-Nov
41196878,The protective role of Lactobacillus reuteri in a DSS-induced ulcerative colitis mouse model.,"Ulcerative colitis (UC) is a chronic inflammatory disease of the colon, marked by symptoms such as mucosal ulceration, diarrhea, and abdominal pain. The dextran sodium sulfate (DSS)-induced murine model replicates clinical and histological features of UC and is widely used to explore potential treatments. Lactobacillus reuteri has emerged as a promising probiotic due to its immunomodulatory and anti-inflammatory properties. This study investigates the effects of L. reuteri supplementation on his...",PloS one,2025
41195363,"Lacticaseibacillus paracasei FJG2337 mitigate acute liver injury-related inflammatory responses, gut microbiota and liver metabolism in mice.","Acute liver injury (ALI) has a high global prevalence but limited and suboptimal treatment options. Probiotics can help improve liver function by regulating gut microbiota, suppressing inflammatory responses, and inhibiting oxidative stress. However, substantial variations exist in the hepatoprotective efficacy of different bacterial strains. Lacticaseibacillus paracasei FJG2337 was isolated from the feces of long-lived elderly individuals, but its potential hepatoprotective effects remain uncle...",Frontiers in cellular and infection microbiology,2025
41194976,"The Effect of High-Intensity Interval Training and Mixed Probiotic Supplementation on SMOC-1 Gene Expression, Insulin Resistance, and Blood Glucose in Male Rats With Induced Diabetes.","In this study, we investigated whether high-intensity interval training (HIIT) and mixed probiotic consumption, either autonomously or synergistically, could regulate the expression of calcium-binding protein-1 (SMOC-1), insulin resistance (IR), and blood glucose (BG) in male rats with induced diabetes.",Journal of diabetes research,2025
41193034,"Egg supplementation for 24 weeks does not improve linear growth or reduce small intestinal permeability in Sierra Leonean children with moderate wasting: a randomized, blinded, controlled trial.",Environmental enteric dysfunction and linear growth faltering are common among children with moderate acute malnutrition (MAM) in low-income countries. Eggs contain high-quality protein and bioactive compounds that may improve gut integrity and growth.,The American journal of clinical nutrition,2025-Nov
41184032,Effect of prenatal multiple micronutrient supplements and medium-quantity lipid-based nutritional supplements on maternal weight gain and infant birth weight in rural Niger: a cluster-randomised trial.,"The risk of adverse birth outcomes, such as low birth weight (<2500 g, LBW), is associated with poor maternal nutrition and weight gain in pregnancy and can increase the risk of infant mortality. We evaluated the effect of three prenatal nutritional supplementation strategies to improve maternal nutrition and adverse pregnancy and birth outcomes.",BMJ global health,2025-Nov
41183976,"The Effect of Heat-Killed Lacticaseibacillus paracasei K71 on Abdominal Fat Reduction: A Randomized, Double-Blind, Placebo-Controlled, Parallel-Group Comparative Trial.","It has been confirmed that Lacticaseibacillus paracasei (formerly designated as Lactobacillus paracasei: L. paracasei) K71, a lactic acid bacterium isolated from sakekasu (sake lees) has immunomodulatory and anti-obesity effects. This study aimed to investigate the effect of heat-killed L. paracasei K71 intake on reducing abdominal fat in a randomized, double-blind, placebo-controlled, parallel-group comparative trial. Eighty healthy male and female subjects with a BMI of ≥23 and <30 were select...",Journal of nutritional science and vitaminology,2025
41176013,Chain-length dependent and synergistic prebiotic effects of xylooligosaccharides and xylan on the fecal microbiota of mice in vitro.,"Oligomeric and polymeric prebiotics differ in their structural complexity, which influences microbial accessibility and fermentation kinetics. This study investigated the microbial responses to xylooligosaccharides (XOS), xylan (XY), and their combinations in comparison with inulin (INU) using an in vitro model inoculated with BALB/c mice fecal microbiota. Temporal analyses over 48 h included substrate consumption, acid production, and changes in microbial diversity. XOS was rapidly fermented, y...",International journal of biological macromolecules,2025-Dec
41175552,Probiotic strain identification and safety assessment of unlabeled bacteria in infant products.,"Probiotics are increasingly incorporated into infant and toddler nutritional products for their health benefits; however, concerns regarding the accuracy and safety of commercial probiotic product labeling remain unresolved. This study aimed to establish strain-level identification standards through whole-genome sequencing (WGS) and to evaluate the microbial composition and safety of 23 infant and toddler probiotic products. By integrating culturomics and WGS, analysis of probiotic strains Lacti...",International journal of food microbiology,2026-Jan
41169386,Comprehensive evaluation of individual and combined dietary carotenoids in Penaeus vannamei and response surface analysis for optimizing combinations.,"Carotenoids are essential in crustacean aquaculture, supporting pigmentation, antioxidant defense, immune function, and sensory quality. However, intensive culture restricts natural carotenoid inputs, and exclusive reliance on astaxanthin is constrained by cost and supply. Evidence to guide cost-effective formulation remains fragmented: reported optimal doses vary widely, head-to-head comparisons under a common basal diet are scarce, mixture effects are poorly defined, and rigorous multi-factor ...",Frontiers in immunology,2025
