pmid,title,abstract,journal,pub_date
31463647,"Nicotinamide mononucleotide (NMN) supplementation promotes anti-aging miRNA expression profile in the aorta of aged mice, predicting epigenetic rejuvenation and anti-atherogenic effects.","Understanding molecular mechanisms involved in vascular aging is essential to develop novel interventional strategies for treatment and prevention of age-related vascular pathologies. Recent studies provide critical evidence that vascular aging is characterized by NAD+ depletion. Importantly, in aged mice, restoration of cellular NAD+ levels by treatment with the NAD+ booster nicotinamide mononucleotide (NMN) exerts significant vasoprotective effects, improving endothelium-dependent vasodilation...",GeroScience,2019-Aug
31278280,"Safety and Metabolism of Long-term Administration of NIAGEN (Nicotinamide Riboside Chloride) in a Randomized, Double-Blind, Placebo-controlled Clinical Trial of Healthy Overweight Adults.","Nicotinamide riboside (NR) is a newly discovered nicotinamide adenine dinucleotide (NAD+) precursor vitamin. A crystal form of NR chloride termed NIAGEN is generally recognized as safe (GRAS) for use in foods and the subject of two New Dietary Ingredient Notifications for use in dietary supplements. To evaluate the kinetics and dose-dependency of NR oral availability and safety in overweight, but otherwise healthy men and women, an 8-week randomized, double-blind, placebo-controlled clinical tri...",Scientific reports,2019-Jul
31015147,Nicotinamide mononucleotide (NMN) supplementation rescues cerebromicrovascular endothelial function and neurovascular coupling responses and improves cognitive function in aged mice.,"Adjustment of cerebral blood flow (CBF) to neuronal activity via neurovascular coupling (NVC) has an essential role in maintenance of healthy cognitive function. In aging increased oxidative stress and cerebromicrovascular endothelial dysfunction impair NVC, contributing to cognitive decline. There is increasing evidence showing that a decrease in NAD+ availability with age plays a critical role in a range of age-related cellular impairments but its role in impaired NVC responses remains unexplo...",Redox biology,2019-Jun
30725213,Acute nicotinamide riboside supplementation improves redox homeostasis and exercise performance in old individuals: a double-blind cross-over study.,Older individuals suffer from low NADH levels. We have previously shown that nicotinamide riboside [NR; a NAD(P)(H) precursor] administration impaired exercise performance in young rats. It has been suggested that supplementation of redox agents exerts ergogenic effect only in deficient individuals. We hypothesized that old individuals would more likely benefit from NR supplementation. We investigated the effect of acute NR supplementation on redox homeostasis and physical performance in young a...,European journal of nutrition,2020-Mar
30497454,Safety and efficacy of aged garlic extract in dogs: upregulation of the nuclear factor erythroid 2-related factor 2 (Nrf2) signaling pathway and Nrf2-regulated phase II antioxidant enzymes.,"Plants of Allium spp., including garlic (A. sativum) and onions (A. cepa), are known to be oxidatively toxic to canine erythrocytes resulting in Heinz body hemolytic anemia in dogs. In humans, these plants have been used as medicinal agents for multiple diseases since ancient times. Especially, fresh garlic extracted over a prolonged period produces less irritative and odorless aged garlic extract (AGE), containing unique and beneficial organosulfur compounds that can help prevent many kinds of ...",BMC veterinary research,2018-Nov
30446518,Dietary Tomato Powder Inhibits High-Fat Diet-Promoted Hepatocellular Carcinoma with Alteration of Gut Microbiota in Mice Lacking Carotenoid Cleavage Enzymes.,"Both incidence and death rate due to liver cancer have increased in the United States. Higher consumption of lycopene-rich tomato and tomato products is associated with a decreased risk of cancers. β-Carotene-15, 15'-oxygenase (BCO1), and β-carotene-9', 10'-oxygenase (BCO2) cleave lycopene to produce bioactive apo-lycopenoids. Although BCO1/BCO2 polymorphisms affect human and animal lycopene levels, whether dietary tomato consumption can inhibit high-fat diet (HFD)-promoted hepatocellular carcin...","Cancer prevention research (Philadelphia, Pa.)",2018-Dec
30389613,Upgrade of wood sugar d-xylose to a value-added nutraceutical by in vitro metabolic engineering.,"The upgrade of D-xylose, the most abundant pentose, to value-added biochemicals is economically important to next-generation biorefineries. myo-Inositol, as vitamin B8, has a six-carbon carbon-carbon ring. Here we designed an in vitro artificial NAD(P)-free 12-enzyme pathway that can effectively convert the five-carbon xylose to inositol involving xylose phosphorylation, carbon-carbon (C-C) rearrangement, C-C bond circulation, and dephosphorylation. The reaction conditions catalyzed by all therm...",Metabolic engineering,2019-Mar
30287522,Evidence for Chemopreventive and Resilience Activity of Licorice: Glycyrrhiza Glabra and G. Inflata Extracts Modulate Estrogen Metabolism in ACI Rats.,"Women are increasingly using botanical dietary supplements (BDS) to reduce menopausal hot flashes. Although licorice (Glycyrrhiza sp.) is one of the frequently used ingredients in BDS, the exact plant species is often not identified. We previously showed that in breast epithelial cells (MCF-10A), Glycyrrhiza glabra (GG) and G. inflata (GI), and their compounds differentially modulated P450 1A1 and P450 1B1 gene expression, which are responsible for estrogen detoxification and genotoxicity, respe...","Cancer prevention research (Philadelphia, Pa.)",2018-Dec
29905928,Lactobacillus plantarum AR501 Alleviates the Oxidative Stress of D-Galactose-Induced Aging Mice Liver by Upregulation of Nrf2-Mediated Antioxidant Enzyme Expression.,Lactic acid bacteria (LAB) have been used as ingredients of functional foods to promote health and prevent diseases because of their beneficial effects. This study aimed to investigate the antioxidative effects of LAB on the hepatotoxicity in D-galactose-induced aging mice. LAB were isolated from the traditional Chinese fermented foods and screened by the tolerance of hydrogen peroxide (H2 O2 ). Male ICR (Institute of Cancer Research) mice were subcutaneously injected with D-galactose for 5 week...,Journal of food science,2018-Jul
29863862,An NAD+-Dependent Sirtuin Depropionylase and Deacetylase (Sir2La) from the Probiotic Bacterium Lactobacillus acidophilus NCFM.,"Sirtuins, a group of NAD+-dependent deacylases, have emerged as the key connection between NAD+ metabolism and aging. This class of enzymes hydrolyzes a range of ε- N-acyllysine PTMs, and determining the repertoire of catalyzed deacylation reactions is of high importance to fully elucidate the roles of a given sirtuin. Here we have identified and produced two potential sirtuins from the probiotic bacterium Lactobacillus acidophilus NCFM. Screening more than 80 different substrates, covering 26 a...",Biochemistry,2018-Jul
