pmid,title,abstract,journal,pub_date
34497121,NAD+ supplementation reduces neuroinflammation and cell senescence in a transgenic mouse model of Alzheimer's disease via cGAS-STING.,"Alzheimer's disease (AD) is a progressive and fatal neurodegenerative disorder. Impaired neuronal bioenergetics and neuroinflammation are thought to play key roles in the progression of AD, but their interplay is not clear. Nicotinamide adenine dinucleotide (NAD+) is an important metabolite in all human cells in which it is pivotal for multiple processes including DNA repair and mitophagy, both of which are impaired in AD neurons. Here, we report that levels of NAD+ are reduced and markers of in...",Proceedings of the National Academy of Sciences of the United States of America,2021-Sep
34404939,Boosting mitochondrial metabolism with dietary supplements in heart failure.,Dietary supplementation with NAD+ precursors or ketone esters has been shown to improve mitochondrial function in preclinical models of heart failure with either reduced or preserved ejection fraction. Both supplementation approaches hold promise but are in the early stages of development as clinical therapies for heart failure.,Nature reviews. Cardiology,2021-Oct
34238308,"Nicotinamide mononucleotide supplementation enhances aerobic capacity in amateur runners: a randomized, double-blind study.","Recent studies in rodents indicate that a combination of exercise training and supplementation with nicotinamide adenine dinucleotide (NAD+) precursors has synergistic effects. However, there are currently no human clinical trials analyzing this.",Journal of the International Society of Sports Nutrition,2021-Jul
33888596,Nicotinamide mononucleotide increases muscle insulin sensitivity in prediabetic women.,"In rodents, obesity and aging impair nicotinamide adenine dinucleotide (NAD+) biosynthesis, which contributes to metabolic dysfunction. Nicotinamide mononucleotide (NMN) availability is a rate-limiting factor in mammalian NAD+ biosynthesis. We conducted a 10-week, randomized, placebo-controlled, double-blind trial to evaluate the effect of NMN supplementation on metabolic function in postmenopausal women with prediabetes who were overweight or obese. Insulin-stimulated glucose disposal, assessed...","Science (New York, N.Y.)",2021-Jun
33734555,NAD+ supplementation prevents STING-induced senescence in ataxia telangiectasia by improving mitophagy.,"Senescence phenotypes and mitochondrial dysfunction are implicated in aging and in premature aging diseases, including ataxia telangiectasia (A-T). Loss of mitochondrial function can drive age-related decline in the brain, but little is known about whether improving mitochondrial homeostasis alleviates senescence phenotypes. We demonstrate here that mitochondrial dysfunction and cellular senescence with a senescence-associated secretory phenotype (SASP) occur in A-T patient fibroblasts, and in A...",Aging cell,2021-Apr
33589649,In vitro comparison of major memory-support dietary supplements for their effectiveness in reduction/inhibition of beta-amyloid protein fibrils and tau protein tangles: key primary targets for memory loss.,"Memory loss is primarily caused by the accumulation of both brain plaques [(consisting of beta-amyloid protein (Aβ) 1-42)] and neurofibrillary tangles (consisting of paired helical and straight filaments containing tau protein). Neuroinflammation is the third key and important factor that leads to accelerated memory loss and eventual dementia. Brain plaques, tangles and inflammation is the trilogy mainly responsible for causing memory loss that has now been documented for over 20 years in the sc...",Scientific reports,2021-Feb
33586106,Protective effects of dietary synbiotic supplementation on meat quality and oxidative status in broilers under heat stress.,"This study evaluated protective effects of synbiotic on meat quality and oxidative status of breast muscle in heat-stressed broilers. Twenty 2-day-old broilers were allocated in a 2×2 factorial design, and the main factors consisted of synbiotic level (0 (basal diet) or 1.5 g/kg synbiotic) and temperature (thermoneutral or high temperature), resulting in 4 treatments. From 22 to 42 days, chickens were raised at thermoneutral temperature (22 °C) or subjected to cyclic high temperature (heat stres...",Environmental science and pollution research international,2021-Jun
33444675,Nutraceutical based SIRT3 activators as therapeutic targets in Alzheimer's disease.,"Alzheimer's disease (AD) is the most common neurodegenerative disease, and its incidence is increasing worldwide with increased lifespan. Currently, there is no effective treatment to cure or prevent the progression of AD, which indicates the need to develop novel therapeutic targets and agents. Sirtuins, especially SIRT3, a mitochondrial deacetylase, are NAD-dependent histone deacetylases involved in aging and longevity. Accumulating evidence indicates that SIRT3 dysfunction is strongly associa...",Neurochemistry international,2021-Mar
33256856,Nano chitosan-zinc complex improves the growth performance and antioxidant capacity of the small intestine in weaned piglets.,"The present study was conducted to test the hypothesis that dietary supplementation with a nano chitosan-zinc complex (CP-Zn, 100 mg/kg Zn) could alleviate weaning stress in piglets challenged with enterotoxigenic Escherichia coli K88 by improving growth performance and intestinal antioxidant capacity. The in vivo effects of CP-Zn on growth performance variables (including gastrointestinal digestion and absorption functions and the levels of key proteins related to muscle growth) and the antioxi...",The British journal of nutrition,2021-Sep
32925178,Can nicotinamide riboside protect against cognitive impairment?,"The present review aims to address the clinical benefits of using nicotinamide riboside, a precursor to the essential pyridine nucleotide, nicotinamide adenine dinucleotide (NAD+) as a therapeutic agent to attenuate age-related cognitive decline.",Current opinion in clinical nutrition and metabolic care,2020-Nov
