pmid,title,abstract,journal,pub_date
41028784,Efficacy of probiotic co-supplementation with omega-3 PUFAs on pancreatic beta-cell function in type 2 diabetes.,"The current understanding of the beneficial effects of probiotics in type 2 diabetes (T2D) relies on both animal and clinical data, which focus mainly on their impact on insulin resistance. The use of high-dose omega-3 polyunsaturated fatty acid (PUFA) therapy has been well tolerated in pilot trials and could have a positive effect on the maintenance of β-cell function before and after T1D onset. This study evaluated the effectiveness of live multistrain probiotic co-supplementation with omega-3...",Scientific reports,2025-Sep
41024239,Efficacy of preoperative immunonutrition in malnourished patients undergoing colorectal cancer surgery: a study protocol for a multicenter randomized clinical trial.,"Malnutrition is a significant risk factor for postoperative complications in patients undergoing colorectal cancer surgery. Although current guidelines recommend preoperative immunonutrition for malnourished patients, its clinical benefit remains controversial. Our previous randomized clinical trial assessing immunonutrition in unselected colon cancer patients showed no reduction in infectious complications. This study aims to evaluate the efficacy of preoperative immunonutrition in reducing pos...",Trials,2025-Sep
41010527,Omega-3 Polyunsaturated Fatty Acids and Cognitive Decline in Adults with Non-Dementia or Mild Cognitive Impairment: An Overview of Systematic Reviews.,"As global aging accelerates, prevalence of mild cognitive impairment (MCI) continues to rise, challenging healthcare systems and diminishing older adults' quality of life. There is great interest in better understanding the neuroprotective/anti-inflammatory properties of omega-3 polyunsaturated fatty acids but the results from many published studies in humans come to different conclusions. This review aims to clarify the efficacy of n-3 fatty acids as a preventive or therapeutic strategy for cog...",Nutrients,2025-Sep
41010509,Effects of 30-Day High-Dose Omega-3 Fatty Acid Supplementation on Plasma Oxidative Stress Enzyme Activities in Recreational and Trained Runners: A Pilot Study.,"Background: Physical activity induces the production of reactive oxygen species (ROS), which, at moderate levels mediate beneficial physiological adaptations, including insulin sensitivity and enhanced antioxidant defense. However, excessive ROS production during intense exercise may exceed endogenous antioxidant capacity, leading to oxidative stress and muscle damage. Objective: This study examined the effects of 30-day high-dose omega-3 fatty acid supplementation (9 g/day) on plasma fatty acid...",Nutrients,2025-Sep
41010484,Synbiotic Supplementation with Probiotics and Omega-3 Fatty Acids Enhances Upper-Body Muscle Strength in Elite Swimmers: Evidence for Gut-Muscle Axis Modulation During Race-Pace Training.,"Background: The gut-muscle axis is believed to influence training adaptations through microbiota-derived signals and the regulation of inflammation, but evidence in elite swimmers is limited and mixed. This study aims to determine whether synbiotic supplementation (probiotics + omega-3) combined with ultra-short race-pace training (USRPT) improves sprint-related upper-body strength. Methods: In a randomized, double-blind, 8-week trial of male elite sprint freestyle swimmers, participants complet...",Nutrients,2025-Sep
41010447,The Role of Dietary Supplements in Modulating Menopause Onset: A Comprehensive Analysis of Nutritional and Lifestyle Influences on Menopause Timing.,"Background: The age at natural menopause (ANM) has a significant impact on women's health later in life, although the contribution of changeable dietary and lifestyle factors remains uncertain. Methods: We examined data from 3566 participants in the UK Women's Cohort Study, assessing their baseline use of dietary supplements and lifestyle habits. Associations with ANM were evaluated using multivariable Cox proportional hazards models and gradient boosting machine (GBM) analyses. We adjusted our ...",Nutrients,2025-Sep
41009418,Plant-Derived Nutraceuticals in Mental Health and Brain Function: Mechanisms of Action and Therapeutic Potential.,"Considering the multiple benefits of nutraceuticals, and given the growing interest in exploring these effects, understanding their mechanisms and implications in mental well-being and neurological integrity is essential and requires further examination to clarify their therapeutic potential. This narrative review provides a comprehensive overview of recent advances in plant-derived nutraceuticals, particularly regarding their impact on mental health and brain function, by examining their bioact...",International journal of molecular sciences,2025-Sep
40991537,Combined effect of probiotics and omega-3 fatty acids on blood and liver function biomarkers and gut microbiota diversity in male mice with high fat diet-induced obesity.,"This study investigates the combined effects of probiotics and omega-3 fatty acids on blood and liver function biomarkers, as well as gut microbiota diversity, in a high-fat diet (HFD)-induced obesity model in male mice. Cardiovascular diseases (CVD), often linked to obesity, are major global health issues driven by abnormal cholesterol and triglyceride levels in the blood. Omega-3 fatty acids, known to lower triglycerides and prevent CVD, and probiotics, which enhance gut microbiota balance and...",PloS one,2025
40990181,Omega-3 fatty acid supplementation for distal symmetrical peripheral neuropathy in adults with diabetes mellitus.,"Diffuse distal symmetrical polyneuropathy (DSPN) is a common complication in people living with diabetes mellitus. There is currently no effective treatment for DSPN. There is a biological rationale that omega-3 polyunsaturated fatty acids (PUFAs) may modify peripheral nerve function in DSPN. However, there is a lack of certainty about the potential benefits and harms of omega-3 PUFAs as a treatment for DSPN.",The Cochrane database of systematic reviews,2025-Sep
40971848,Effect of Omega 3 supplementation during pregnancy and lactation on cognitive functions in rat offspring.,"This study investigates the effects of omega-3 supplementation starting in the preconception period, during the 1st, 2nd, and 3rd weeks of pregnancy, and lactation on the cognitive functions of rat offspring.",PloS one,2025
40944123,Beyond the Pill: Unveiling the Characteristics of Prenatal Micronutrient Consumption Among Hungarian Pregnant Women According to Different Levels of Adherence.,"Background/Objectives: There is clear evidence that maternal micronutrient deficiencies result in adverse maternal and fetal health outcomes. Therefore, corrective supplementation should be considered when dietary intake is insufficient, particularly for vitamin D (VD), omega-3 fatty acids (O3), folic acid (FA), or prenatal multiple micronutrient products (PMM). Despite its significance, intake patterns in Hungary remain largely unexplored, and evaluating adherence to recommended intake levels w...",Nutrients,2025-Aug
40942093,The Roles of Micronutrition and Nutraceuticals in Enhancing Wound Healing and Tissue Regeneration: A Systematic Review.,"Micronutrients and nutraceuticals play crucial roles in wound healing and tissue regeneration, supporting various physiological processes. This review aims to synthesize and evaluate the functions of various micronutrients and nutraceuticals, emphasizing the synergistic interactions among different nutrients that facilitate wound healing processes. A thorough literature review was performed using electronic databases, including PubMed, Scopus, Web of Science, Embase, Google Scholar, and Cochrane...","Molecules (Basel, Switzerland)",2025-Aug
40933257,Supplementation with fish oil reduces αβ 42 burden and shifts αβ precursor protein processing toward non-amyloidogenic pathways in a rat model of hyperglycaemic Alzheimer's disease.,"This study examines the influence of fish oil on brain amyloidogenesis in hyperglycaemic Alzheimer's disease animal models, emphasising the potential of omega-3 fatty acids in fish oil to prevent the development of Alzheimer's disease. Thirty males of Wistar rats were divided into five groups: 1) control rats (NS); 2) rats supplemented with 3 g/kg of fish oil (NS+FO3); 3) rats injected via intraperitoneal (i.p) with Streptozotocin-Lipopolysaccharide (STZ-LPS); 4) rats injected with STZ-LPS (i.p)...",Journal of nutritional science,2025
40920291,"Effectiveness of Medical Nutrition Therapy in the Management of Patients with Obesity and Endometriosis: from the Mediterranean Diet To the Ketogenic Diet, Through Supplementation. The Role of the Nutritionist in Clinical Management.","This review aimed to summarize current evidence on the effectiveness of medical nutrition therapy (MNT) in the management of obesity and endometriosis, with a focus on dietary patterns such as the Mediterranean and Ketogenic diets, as well as nutritional supplementation. Additionally, it highlights the central role of the clinical nutritionist in implementing individualized, evidence-based interventions within multidisciplinary care.",Current obesity reports,2025-Sep
40912359,Omega-3 fatty acid supplementation in solid organ transplant recipients: A systematic review and meta-analysis of randomized controlled trials.,"Omega-3 polyunsaturated fatty acids are known for anti-inflammatory and cardiovascular benefits, but their impact on solid organ transplant outcomes is unclear.",Clinical nutrition ESPEN,2025-Oct
40877830,"Effects of spirulina (Arthrospira) platensis supplementation on inflammation, physical and mental quality of life, and anthropometric measures in patients with relapsing-remitting multiple sclerosis (RRMS): a triple-blinded, randomized, placebo-controlled trial.","Multiple sclerosis (MS) is a chronic neuroinflammatory disorder marked by demyelination and axonal damage, where oxidative stress and cytokine-mediated inflammation are key pathological factors. Spirulina, a microalga rich in phycocyanin, phenolic compounds, and omega-3 fatty acids, exhibits potent antioxidant and anti-inflammatory properties, potentially targeting these pathways. This study investigated spirulina's impact on inflammatory biomarkers and quality of life in relapsing-remitting MS ...",Nutrition journal,2025-Aug
40871692,Anti-Inflammatory Diet and Probiotic Supplementation as Strategies to Modulate Immune Dysregulation in Autism Spectrum Disorder.,"Background/Objectives: Autism spectrum disorder (ASD) is a neurodevelopmental condition associated with behavioral and cognitive impairments. Increasing evidence also links ASD with systemic immune dysregulation, including abnormal cytokine profiles and chronic low-grade inflammation. Emerging evidence suggests that targeted dietary strategies and probiotic supplementation may modulate immune responses and gut-brain interactions in patients with ASD. This study aimed to evaluate the immunomodula...",Nutrients,2025-Aug
40840737,Xanthan gum-stabilized docosahexaenoic acid loaded nanoemulgel: A stable nutraceutical delivery system with enhanced bioavailability.,"Docosahexaenoic acid (DHA) is an omega-3 fatty acid beneficial for brain development and cardiovascular health. DHA has poor aqueous solubility and is highly susceptible to oxidation, limiting its bioavailability. To address these challenges, in the present investigation, nanoemulsion was prepared using DHA-enriched edible algal oil and tween 80 as an emulsifier (1 %) initially. Then, the prepared DHA nanoemulsion was subsequently incorporated into xanthan gum gel (1.5 % w/v) to develop nanoemul...",International journal of biological macromolecules,2025-Sep
40836005,A systematic review and dose response meta analysis of Omega 3 supplementation on cognitive function.,"The dose-dependent effects of omega-3 supplementation on cognitive function remain unclear. This study aimed to evaluate the relationship between omega-3 dosage and cognitive outcomes in adults. A systematic search was conducted in PubMed, Scopus, and ISI Web of Science up to December 2024. Only randomized controlled trials (RCTs) were included. For each trial, we estimated the change in cognitive function per 2000 mg/day increment in omega-3 supplementation. Standardized mean differences (SMDs)...",Scientific reports,2025-Aug
40806137,Myokine Circulating Levels in Postmenopausal Women with Overweight or Obesity: Effects of Resistance Training and/or DHA-Rich n-3 PUFA Supplementation.,"Menopause increases the risk of cardiovascular diseases (CVD) accompanied by a decline in muscle function. Myokines, released by skeletal muscle, could play a significant role in cardiovascular health.",Nutrients,2025-Aug
40806109,Impact of Omega-3 and Vitamin D Supplementation on Bone Turnover Markers in Children with Leukemia: Follow-Up During and After Supplementation.,"Background/Objective: In patients with acute lymphoblastic leukemia (ALL), it has been demonstrated that the treatment has a negative effect on bone health. The n-3 polyunsaturated fatty acids (LCPUFAs-ω3) may attenuate bone resorption. We evaluated the effects of LCPUFAs-ω3, vitamin D, and calcium supplementation on bone turnover markers and changes in vitamin D concentrations during 6 weeks of supplementation and during 6 weeks of post-intervention follow-up in pediatric patients with ALL. Met...",Nutrients,2025-Jul
40806017,A Prospective Interventional Study on the Beneficial Effect of Fish Oil-Enriched High-Protein Oral Nutritional Supplement (FOHP-ONS) on Malnourished Older Cancer Patients.,"Background: Malnutrition and cancer-related fatigue (CRF) are prevalent in cancer patients, significantly impacting prognosis and quality of life. Oral nutritional supplements (ONSs) enriched with protein and ω-3 fatty acids may improve nutritional status and mitigate CRF. This study evaluates the effects of a high-protein, fish oil-enriched ONS (FOHP-ONS) on nutritional intake, body composition, fatigue, and quality of life in malnourished cancer patients. Methods: Cancer patients with malnutri...",Nutrients,2025-Jul
40747696,Effects of maternal allergy and supplementation with ω-3 fatty acid and probiotic on human milk oligosaccharides.,"Human milk oligosaccharides (HMOs) are complex carbohydrates that act as prebiotics, supporting infants' gut microbial colonization and immune development. HMO levels are influenced by several maternal factors, including genetics, diet, and health status. In this study, we aim to investigate the effects of ω-3 PUFA (polyunsaturated fatty acids) and Limosilactobacillus (L.) reuteri supplementation on HMO levels in colostrum and mature milk. Another aim is to compare HMO levels between allergic an...",Pediatric allergy and immunology : official publication of the European Society of Pediatric Allergy and Immunology,2025-Aug
40732922,Synergistic Effects of Probiotic and Omega-3 Supplementation with Ultra-Short Race Pace Training on Sprint Swimming Performance.,"Background: Optimal nutrition and training regimens are essential for athletes to maximize performance and recovery. Probiotic supplementation, through the modulation of the gut microbiota, and omega-3 fatty acids, known for their anti-inflammatory properties, may enhance physiological adaptations when combined with targeted training. This study evaluated the effects of probiotics and omega-3 supplementation, alongside ultra-short race pace training (USRPT), on performance metrics in competitive...",Nutrients,2025-Jul
40731220,The omega effect: Harnessing fish oil for health.,"Recent findings from a sub-analysis of the STRENGTH randomized clinical trial reveal that omega-3 carboxylic acids yielded significant cardiovascular risk reduction among Asian participants, despite showing neutral results in the broader high-risk cohort. These observations underscore the potential influence of genetic, metabolic, and lifestyle factors in modulating therapeutic efficacy across ethnic groups. This editorial advocates for a paradigm shift from isolated supplementation to the dieta...",Atherosclerosis,2025-Sep
40717016,Effects of omega-3 fatty acids supplementation on lipids and pregnancy outcomes in pregnant women.,To assess the impact of Omega-3 fatty acid supplementation on maternal blood lipid profiles and pregnancy outcomes.,"The journal of maternal-fetal & neonatal medicine : the official journal of the European Association of Perinatal Medicine, the Federation of Asia and Oceania Perinatal Societies, the International Society of Perinatal Obstetricians",2025-Dec
40701340,Cost-Effectiveness of Long-Chain Omega-3 Supplementation for the Secondary Prevention of Cardiovascular Disease in the United States.,"A variety of eicosapentaenoic (EPA) and docosahexaenoic (DHA) omega-3 dietary supplements of varying dosage and pricing are available in the United States and commonly used for secondary cardiovascular prevention. Although these interventions' efficacy has been studied, their cost-effectiveness remains unknown. The goal of this article is to assess whether omega-3 dietary supplements are cost-effective for secondary cardiovascular prevention in adults in the United States. Our analysis explicitl...",Value in health : the journal of the International Society for Pharmacoeconomics and Outcomes Research,2025-Oct
40699986,Pharmaco-nutraceutical improvement of the response to obeticholic acid with omega-3 polyunsaturated fatty acids.,"Obeticholic acid (OCA) is the second-line therapy for primary biliary cholangitis. While efficient in promoting bile acid (BA) detoxification and limiting liver fibrosis, its clinical use is restricted by severe dose-dependent side effects. We tested the hypothesis that adding n-3 polyunsaturated fatty acids (PUFAs), eicosapentaenoic (EPA) and docosahexaenoic (DHA) acids to OCA may improve the therapeutic effect of the low drug dosage. Several liver cell lines were exposed to vehicle, low or hig...",The Biochemical journal,2025-Aug
40690043,Preliminary evaluation on the effect of oral omega-3 supplementation from herring caviar oil in primary open-angle glaucoma patients.,The study aimed to assess the neuroprotective effect of phospholipid-rich omega-3 fatty acids from herring caviar oil in POAG patients with intraocular pressure (IOP) control.,International ophthalmology,2025-Jul
40686203,Preliminary longitudinal epigenetic clock analyses of patients with mild cognitive impairment through nutritional intervention.,"BackgroundMild cognitive impairment (MCI) is an intermediate stage between normal aging and dementia. Not a small number of patients with MCI progress to Alzheimer's disease within 1 year. Epigenetic changes in DNA methylation, such as those observed in the epigenetic clock, are receiving increasing attention in the field of aging research. It is crucial to demonstrate the effectiveness of interventions for patients with MCI from a biological perspective to promote the prevention of dementia.Obj...",Journal of Alzheimer's disease : JAD,2025-Sep
40669548,Nutraceutical eicosapentaenoic acid in treatment-resistant depression: The psychoneuroimmunity and clinical implications.,"Treatment Resistant Depression is characterized by inadequate response to at least two adequate trials of antidepressants, highlighting the need for alternative or adjunctive strategies. Emerging evidence suggests omega-3 polyunsaturated fatty acids, particularly eicosapentaenoic acid, may offer therapeutic benefits in the management of Treatment Resistant Depression. A total of twelve studies, including randomized controlled trials and open label studies, with a combined sample size of 498 part...",Pharmacological research,2025-Aug
40647297,"Use of Nutritional Strategies, Bioactive Compounds, and Dietary Supplements in Young Athletes: From Evidence to Potential Risks-A Narrative Review.","Young athletes face unique nutritional challenges due to their simultaneous engagement in intensive physical training and ongoing growth and development. Standard adult-based dietary recommendations often fail to meet the specific needs of this population. While the role of macronutrients and micronutrients is well recognized, increasing attention is being paid to bioactive compounds-non-essential food-derived elements with potential health benefits. This review aims to summarize current evidenc...",Nutrients,2025-Jun
40647193,"The Effects of Omega-3 Supplementation Combined with Strength Training on Neuro-Biomarkers, Inflammatory and Antioxidant Responses, and the Lipid Profile in Physically Healthy Adults.","Objectives: This study aimed to comprehensively investigate the physiological effects of omega-3 fatty acid supplementation combined with resistance training on the lipid profile, inflammatory and antioxidant responses, neuro-biomarkers, and physical performance parameters in physically healthy young adults. Methods: Thirty physically active male participants were randomly assigned to an experimental group (omega-3 + resistance training) or a control group (resistance training only). Over eight ...",Nutrients,2025-Jun
40644954,Multimicronutrient and omega-3 fatty acid supplementation reduces low-grade inflammation in older participants: An exploratory study.,"Aging is associated with chronic low-grade inflammation, while the status of anti-inflammatory (INFLA) micronutrients such as long-chain omega-3 fatty acids (n-3 PUFA), vitamin D, folate, and cobalamin is often low in older people. We hypothesized that n-3 PUFA and certain micronutrients reduce low-grade inflammation in older participants. To test this hypothesis the aim of this randomised, double-blinded, 12-week intervention study involving 112 healthy and physically active older participants ...","Nutrition research (New York, N.Y.)",2025-Aug
40637878,"Knowledge, awareness and recommendation on micronutrition during pregnancy-a survey of healthcare providers.","The market for dietary supplements targeting women of reproductive age and pregnant individuals is rapidly expanding. Despite accumulating evidence regarding the benefits of specific micronutrients during pregnancy, there is considerable variability in international and national guidelines, compounded by knowledge gaps among healthcare professionals.",Archives of gynecology and obstetrics,2025-Oct
40611279,The effectiveness of nutritional supplements in improving polycystic ovary syndrome in women: a systematic review and network meta-analysis.,"Nutritional supplements are known to ameliorate polycystic ovary syndrome (PCOS) and have been shown to modulate endocrine and metabolic markers, oxidative stress markers and inflammatory biomarkers in patients with PCOS. A variety of nutritional supplements have been applied in clinics, but a more comprehensive ranking of their efficacy has not yet been investigated.",Reproductive biology and endocrinology : RB&E,2025-Jul
40573125,From Fish Oil to Resolution: A Narrative Review on the Potential of SPM-Enriched Marine Oil for Exercise-Induced Muscle Damage Recovery.,"Exercise-induced muscle damage (EIMD) initiates an inflammatory response that is essential for tissue repair. However, when prolonged or excessive, this response can impair recovery and muscular performance. Specialized pro-resolving mediators (SPMs), derived from the metabolism of omega-3 (n-3) polyunsaturated fatty acids (PUFAs), facilitate the resolution of inflammation without causing immunosuppression. Evidence from preclinical studies indicates that SPM administration accelerates muscle re...",Nutrients,2025-Jun
40573119,An Adapted Cardioprotective Diet with or Without Phytosterol and/or Krill Oil Supplementation in Familial Hypercholesterolemia: Results of a Pilot Randomized Clinical Trial.,"Background/Objectives: Familial hypercholesterolemia (FH) is an increasingly common inherited disorder that increases cardiovascular risk. Despite the importance of lifestyle interventions, adherence to a healthy diet among individuals with FH remains suboptimal. This pilot, multicenter, double-blind, placebo-controlled randomized trial aimed to evaluate the feasibility and preliminary effects of a culturally adapted cardioprotective diet (DICA-FH), alone or in combination with phytosterol and/o...",Nutrients,2025-Jun
40569483,Identification of individuals who benefit from omega-3 fatty acid supplementation to prevent coronary heart disease: a machine-learning analysis of the VITAL.,"Randomized controlled trials (RCTs) have demonstrated benefits of marine omega-3 polyunsaturated fatty acids (omega-3 FA) supplementation for the prevention of coronary heart disease (CHD). However, it has not been clear which individuals benefit the most from supplementation. We sought to develop an omega-3 effect score to stratify individuals according to their expected benefit from supplementation. Among the 25,871 randomized participants without a history of cardiovascular disease in the VIT...",European journal of epidemiology,2025-Jul
40523478,Perspective: Implications of Docosahexaenoic Acid and Eicosapentaenoic Acid Supplementation on the Immune System during Cancer Chemotherapy: Perspectives from Current Clinical Evidence.,"Docosahexaenoic acid (DHA) and eicosapentaenoic acid (EPA) are omega-3 long-chain polyunsaturated fatty acids (n-3 LCPUFAs) with pleiotropic effects on the immune system. Although several preclinical studies support their potential to enhance cancer treatment efficacy, this has not yet been translated into clinical studies. Currently, there are no official recommendations for n-3 LCPUFAs supplementation during cancer chemotherapy. This review examined human studies that supplemented DHA and/or E...","Advances in nutrition (Bethesda, Md.)",2025-Aug
