pmid,title,abstract,journal,pub_date
41073239,Assessing pharmacists' knowledge and practices involving dietary supplement omega-3 fatty acids.,A survey was created to assess the knowledge and clinical practices of licensed pharmacists related to omega-3 fatty acid dietary supplements (OM3FA-DS).,Journal of clinical lipidology,2025
41072116,A review of the relationships between reported fish oil supplement use and health outcomes in the UK Biobank.,Recent lay and medical headlines reported that fish oil supplement (FOS) use in the UK Biobank (UKBB) increased risk for atrial fibrillation (AF) in the general population. The publicity generated by this report (the conclusions of which have since been questioned) led us to consider what other FOS-disease outcome relationships have been examined in this very large population study.,"Prostaglandins, leukotrienes, and essential fatty acids",2025-Dec
41071248,"[Food supplements and fortified foods: benefits, risks and approaches to consumer protection].","In Germany, around two thirds of adults and 5-20% of children take food supplements, many hoping to improve their health or performance. Consumption data show that with a few exceptions the intake of micronutrients through conventional foods is adequate in Germany. Food supplements are thus generally not considered necessary for healthy people who follow a varied and balanced diet. There are thus only a few situations in which a food supplement can be useful. Routine use of high-dose supplements...","Bundesgesundheitsblatt, Gesundheitsforschung, Gesundheitsschutz",2025-Nov
41063697,Exploring the Relationship Between Supplement Usage and Quality of Life Among Cancer Patients in Jordan: A Cross-Sectional Study.,This study explores the use of nutrition supplements by Jordanian cancer patients regarding symptoms of quality of life. It explores the prevalence of the use of nutrition supplements by cancer patients and the related demographic and disease-specific factors. A cross-sectional study was conducted on cancer patients at three major hospitals in Jordan. A total of 220 participants completed structured questionnaires. The EORTC QLQ-C15 scale was used to collect data on supplement usage patterns and...,Nutrition and cancer,2026
41052657,Validation of an ovine model for studying impacts of prenatal docosahexaenoic acid supplementation on fetal tissue membrane composition and metabolism.,"Dietary supplementation with long-chain omega-3 fatty acids such as docosahexaenoic acid (DHA) is recommended to women during pregnancy to prevent preterm birth and support optimal fetal development. DHA supplementation also decreases circulating triglyceride levels through diverse effects on systemic lipid metabolism, but its impacts on fetal metabolism are largely unknown due to inherent limitations of such investigations during pregnancy. The aim of the present study was to validate a large a...",The Journal of nutritional biochemistry,2026-Feb
41028784,Efficacy of probiotic co-supplementation with omega-3 PUFAs on pancreatic beta-cell function in type 2 diabetes.,"The current understanding of the beneficial effects of probiotics in type 2 diabetes (T2D) relies on both animal and clinical data, which focus mainly on their impact on insulin resistance. The use of high-dose omega-3 polyunsaturated fatty acid (PUFA) therapy has been well tolerated in pilot trials and could have a positive effect on the maintenance of β-cell function before and after T1D onset. This study evaluated the effectiveness of live multistrain probiotic co-supplementation with omega-3...",Scientific reports,2025-Sep
41026372,Modulating inflammation and oxidative stress in rheumatoid arthritis: a systematic review of nutraceutical interventions.,"Rheumatoid arthritis is a chronic autoimmune disease characterized by persistent synovial inflammation and progressive joint destruction. The gut microbiome has emerged as a key factor in the regulation of the immune system, and its dysbiosis has been implicated in the pathogenesis of rheumatoid arthritis. Nutraceuticals, including probiotics, omega-3 fatty acids, coenzyme Q10, vitamin D, and polyphenols, have shown potential in modulating the gut microbiota and inflammatory pathways. This revie...",Inflammopharmacology,2025-Nov
41024239,Efficacy of preoperative immunonutrition in malnourished patients undergoing colorectal cancer surgery: a study protocol for a multicenter randomized clinical trial.,"Malnutrition is a significant risk factor for postoperative complications in patients undergoing colorectal cancer surgery. Although current guidelines recommend preoperative immunonutrition for malnourished patients, its clinical benefit remains controversial. Our previous randomized clinical trial assessing immunonutrition in unselected colon cancer patients showed no reduction in infectious complications. This study aims to evaluate the efficacy of preoperative immunonutrition in reducing pos...",Trials,2025-Sep
