pmid,title,abstract,journal,pub_date
40491918,Enhancing tofacitinib's therapeutic efficacy in murine arthritis with a synbiotic formulation comprising Bacillus megaterium DSM 32963 and an Omega-3 fatty acid lysine salt.,"Omega-3 polyunsaturated fatty acids (n3-PUFA) are known for their anti-inflammatory benefits, particularly in chronic conditions like rheumatoid arthritis (RA). To resolve an acute inflammation, conversion of n3-PUFA into specialized pro-resolving mediators (SPM) is crucial. Recently, it was shown that the probiotic Bacillus megaterium DSM32963 supports this conversion.",Frontiers in immunology,2025
40490846,"Safety and efficacy of docosahexaenoic acid supplementation during neoadjuvant breast cancer therapy: Findings from the phase II, double-blind, randomized controlled DHA-WIN trial.","There is limited clinical evidence of docosahexaenoic acid (DHA) efficacy during breast cancer neoadjuvant chemotherapy (NAC). This randomized, double-blind, placebo-controlled trial aimed to investigate the safety and efficacy of DHA supplementation in breast cancer patients undergoing NAC. Participants (n = 49) were assigned to receive either DHA 4.4 g/day orally (algae triacylglycerol) or a placebo (corn/soy oil) over six cycles (18 weeks) of NAC. The primary outcome was the evaluation of cha...",International journal of cancer,2025-Oct
40489713,[Perinatal benefits and recommendations of docosahexaenoic acid and arachidonic acid].,"Docosahexaenoic acid (DHA) and arachidonic acid (AA) are fatty acids, part of the human milk composition. Their concentrations depend on maternal diet and endogenous supply, but recommended levels are not often reached.",Revista medica del Instituto Mexicano del Seguro Social,2025-Jan
40489711,[Omega-3 polyunsaturated fatty acids in pediatric patients with acute lymphoblastic leukemia].,"Interest in omega-3 long-chain polyunsaturated fatty acids has increased in recent years. Several studies suggest that supplementation with these fatty acids decreases metabolic risk, plasma triglyceride levels and attenuates the loss of lean body mass, modulating the inflammatory response. In adults with cancer, the results of different studies that have evaluated the effects of the administration of these fatty acids suggest that they can be used as adjuvants during treatment acting as recepto...",Revista medica del Instituto Mexicano del Seguro Social,2025-Jan
40489651,[Benefits of ω-3 fatty acids in Duchenne muscular dystrophy].,"Duchenne Muscular Dystrophy (DMD), caused by mutations in the dystrophin gene, is the most common congenital muscular dystrophy and is characterized by a chronic inflammatory response mediated by immune cells and cytokines. Obesity, a common feature of DMD, exacerbates this inflammation. Although corticosteroids are the conventional treatment, their adverse effects are substantial. The use of omega-3 polyunsaturated fatty acids (PUFAω-3) as adjuvant therapy is under investigation. A comprehensiv...",Revista medica del Instituto Mexicano del Seguro Social,2025-Jan
40485144,"Supplementation of Omega-3 Increases Serum Levels of Brain-Derived Neurotrophic Factor and Decreases Depression Status in Patients With Bipolar Disorder: A Randomized, Double-Blind, Placebo-Controlled Clinical Trial.",There is a direct relationship between omega-3 and major depression. This study was conducted to investigate the effect of supplementation of omega-3 fatty acids on serum levels of brain-derived neurotrophic factor (BDNF) and depression status in patients with bipolar disorder (BD).,Journal of human nutrition and dietetics : the official journal of the British Dietetic Association,2025-Jun
40441053,Omega-3 polyunsaturated fatty acids and nonalcoholic fatty liver disease in adults: A meta-analysis of randomized controlled trials.,Nonalcoholic fatty liver disease (NAFLD) is the leading cause of liver disease worldwide. Previous meta-analyses investigating the effects of omega-3 polyunsaturated fatty acids (ω-3 PUFA) on NAFLD have reported inconsistent findings. This study aimed to evaluate the efficacy and adverse events (AEs) of ω-3 PUFA in adults with NAFLD.,"Clinical nutrition (Edinburgh, Scotland)",2025-Jul
40440029,Supplement and nutraceutical therapy in traumatic brain injury.,Traumatic brain injury (TBI) continues to be a leading cause of morbidity and mortality. Nutraceuticals and supplements have emerged as potential therapeutics to enhance brain recovery post-injury.,Nutritional neuroscience,2025-Jun
40431450,"The Effect of Dietary Supplements on Male Infertility in Terms of Pregnancy, Live Birth, and Sperm Parameters: A Systematic Review and Meta-Analysis.",The aim of this systematic review and meta-analysis was to investigate the effect of dietary supplements on male infertility.,Nutrients,2025-May
40431398,Nutraceutical Strategies for Metabolic Dysfunction-Associated Steatotic Liver Disease (MASLD): A Path to Liver Health.,"MASLD (Metabolic Dysfunction-Associated Steatotic Liver Disease) is a growing global concern. Nutraceuticals offer an appealing approach by targeting key mechanisms, such as oxidative stress, inflammation, lipid metabolism, and insulin resistance. This narrative review examines the role of various nutraceuticals in MASLD treatment, including silymarin, vitamin E, omega-3, curcumin, berberine, and coenzyme Q10. Some of them show promising biochemical and metabolic changes, while others produce co...",Nutrients,2025-May
