pmid,title,abstract,journal,pub_date
40799052,Dietary Supplementation With White and Common Turmeric Improves Resistance to Argulus siamensis in Labeo rohita.,"This study evaluated white turmeric (Curcuma zedoaria) as a sustainable feed additive alternative to common turmeric (C. longa) for enhancing disease resistance in Labeo rohita against Argulus siamensis infection. Juvenile L. rohita (15.8 ± 1.9 g) were divided into four treatment groups (n = 60 per group): (1) Control (commercial feed), (2) common turmeric-supplemented feed (1% w/w), (3) white turmeric-supplemented feed (1% w/w), and (4) combined turmeric-supplemented feed (0.5% common +0.5% whi...",Parasite immunology,2025-Aug
40740780,The effect of co-administration of vitamin E and C supplements on plasma oxidative stress biomarkers and antioxidant capacity: a GRADE-assessed systematic review and meta-analysis of randomized controlled trials with meta-regression.,There is no conclusion on the effect of vitamins E and C on plasma biomarkers of oxidative stress and antioxidant status. We conducted this meta-analysis to gain a clearer view of this area.,Frontiers in immunology,2025
40737044,"Clostridium butyricum JJ100 and Lacticaseibacillus rhamnosus LR alleviate liver injury in mice caused by continuous high-dose-alcohol exposure by protecting the intestinal barrier, rebuilding the gut microbiota and regulating AMPK and TLR4/NF-κB signaling pathways.","Alcohol consumption poses a major global public health challenge, with excessive drinkers showing heightened susceptibility to alcoholic liver disease (ALD) - a condition with complex pathogenesis. In this study, we used male BALB/c mice with identical enterotypes to establish a sustained high-dose alcohol-induced liver injury model. The model was created through daily intragastric administration of 52% (v/v) ethanol (10 mL kg-1) for four consecutive weeks, allowing us to investigate the hepatop...",Food & function,2025-Aug
40714301,Does Nigella sativa supplementation improve cardiovascular disease risk factors? A comprehensive GRADE-assessed systematic review and dose-response meta-analysis of 82 randomized controlled trials.,This systematic review and meta-analysis aimed to evaluate the effects of Nigella sativa (N. sativa) supplementation on metabolic and cardiovascular health outcomes.,Pharmacological research,2025-Sep
40659225,Probiotic secretomes attenuate inflammation and disrupted antioxidant status induced by polychlorinated biphenyls in human intestinal T84 epithelial cells.,Polychlorinated biphenyls (PCBs) are persistent organic pollutants linked with intestinal inflammation and disrupted antioxidant status. Humans are exposed to PCBs primarily via PCB-contaminated foods. A comprehensive analysis of PCB modulation of intestinal inflammatory networks is lacking. Lactic acid producing bacteria (LAB) secretomes have been shown to attenuate pro-inflammatory cytokine-induced colonic cell inflammation. This study aimed to characterize markers of inflammation and antioxid...,Free radical biology & medicine,2025-Nov
40644772,The beneficial effects of sesame (Sesamum indicum L.) products and their bioactive compounds on cardiovascular disease risk factors in patients with diabetes: A GRADE-Assessed systematic review and meta-analysis.,"This systematic review and meta-analysis aimed to evaluate the clinical effectiveness of sesame supplementation on glycemic control, lipid profile, anthropometric measures, liver enzymes, inflammatory biomarkers, blood pressure, and oxidative stress parameters in patients with diabetes.",Diabetes & metabolic syndrome,2025-Jun
40565170,The Effects of Lutein-Containing Supplement Intake on Glycation Inhibition Among Diabetic Patients with Cataracts.,"Glycation is known as an important factor inducing human diseases, including diabetic complications. As oxidative stress contributes to procedures of glycation, antioxidants may inhibit glycation and delay the progression of diabetic complications. Our previous investigation of human aqueous humor after the intake of a lutein-containing supplement demonstrated increases in antioxidative activities and decreases in peroxidative products. This study enrolled 25 patients with diabetes (DM group) an...",International journal of molecular sciences,2025-Jun
40457028,Comparative Effects of Co-administration of Lactobacillus casei and Bifidobacterium breve vs. Monotherapy on Hippocampal Neurodegeneration in a D-Galactose-Induced Aging Model.,"It has been shown that gut dysbiosis, a hallmark of aging, participates in age-related neurodegenerative conditions. Consumption of probiotics has favorable effects not only on gut hemostasis but also on the brain via the microbiota-gut-brain axis. Ongoing research aims to identify the most suitable probiotic or combination of probiotics tailored to each specific condition. Hence, the present study tested the effects of combination therapy of Lactobacillus casei (L. casei) and Bifidobacterium br...",Molecular neurobiology,2025-Oct
40399880,"Dietary prebiotic-stevioside modulates the growth, antioxidant enzymes, and immune response in thinlip mullets (Liza ramada) subjected to chronic cold stress.","Plant active ingredients, including stevioside, with their prebiotic properties and antioxidant potential, hold promise as innovative components in aquaculture. This study assessed the multi-level impacts of stevioside (0, 100, 200, 300, 400, or 500 mg/kg) on thinlip mullet (N = 540 juveniles with an initial weight 3.50 ± 0.07 g) exposed to a long-term low temperature regime (18 °C) for 60 days. Growth, blood parameters, enzymes, immune genes, and histological structure of intestine and liver we...",BMC veterinary research,2025-May
40390021,The effect of oregano essential oil and Bacillus subtilis supplements on winter fur growth in raccoon dogs (Nyctereutesprocyonoides).,"A total of 160 healthy raccoon dogs with no significant difference in body weight were selected and randomly divided into 10 groups, with each group having 4 replicates and each replicate consisting of 4 individuals. The pre-test period lasted for 7 days, followed by a formal test period of 82 days. The raccoon dogs in the 10 groups were fed basal diet supplemented with 50 mg/kg chlortetracycline and 100 mg/kg quinocetone (control group), 100 mg/kg OEO and 150 mg/kg BS (group I), 100 mg/kg OEO a...",BMC veterinary research,2025-May
40377982,Protective effect of safflower oil supplementation on sciatic nerve crush injury in rats.,"This study aimed to assess the effect of safflower oil (SO), a high-quality edible oil derived from seeds of Carthamus tinctorius L. possessing multiple bioactivities, on rats that underwent sciatic nerve crush (SNC) to induce peripheral nerve injury (PNI).",Nutritional neuroscience,2025-Oct
40376939,The Effect of Aerobic Exercise With an Omega-3 Supplement on the Tendon Healing Process.,"An Achilles tendon rupture is a common orthopaedic injury in athletes and other people. Therefore, it is essential to investigate methods that may yield beneficial results for tendon healing by addressing the inflammatory and gene expression aspects of the healing process.",The American journal of sports medicine,2025-Jun
