pmid,title,abstract,journal,pub_date
40276518,Ligilactobacillus salivarius regulating translocation of core bacteria to enrich mouse intrinsic microbiota of heart and liver in defense of heat stress.,"The aim of this study was to elucidate the intrinsic microbiota residing in the heart and liver, which was enriched with Ligilactobacillus salivarius supplementation and its roles in defending anti-oxidation of heat stress. The specific pathogen free (SPF) mice were employed to perform the study. Genomic sequencing showed that the intrinsic microbes in the heart and liver of SPF mice, which were primarily of the genera Burkholderia and Ralstonia, functioned in organic metabolism, environmental i...",Frontiers in immunology,2025
40256256,Supplementation of the Probiotic LLH135 Reduces Oxidative Stress in a Model of Hemiparkinsonism.,"Oxidative stress and neuroinflammation are considered as the two main etiological reasons behind idiopathic Parkinson's disease (PD). Nevertheless, the actual treatments are focused on improving motor symptoms by restoring dopamine (DA) presence, leaving said causes unattended. Probiotics could be a promising strategy for the improvement of these physiological features behind the disease and therefore constitute a complementary treatment for those having PD. This study evaluated the effect of th...",Behavioural neurology,2025
40237066,Impact of maternal Lactiplantibacillus plantarum S58 supplementation on offspring rat immunity and gut health.,"Pregnancy and lactation provide several opportunities for maternal dietary interventions to confer health benefits to newborns. However, the effects of maternal probiotic supplementation during pregnancy and lactation on offspring immunity and intestinal health remain largely unknown. This study aimed to investigate the effects of supplementation with the probiotic Lactiplantibacillus plantarum S58 (LP.S58) during pregnancy and lactation on the intestinal health and immunity of rat offspring. Th...",Food & function,2025-May
40223092,Colonic bacterial community responding to selenium-enriched yeast supplementation associated with improved gut mucus function in growing-finishing pigs.,"Selenium-enriched yeast (SeY), a high-quality organic source of selenium, enhances antioxidant activity and intestinal health in swine. This study aims to evaluate the effects of varying dietary SeY levels on intestinal morphology, epithelial mucus production, antioxidant activity, and colonic bacterial communities in growing-finishing pigs. Thirty 90-day-old Duroc×Landrace×Yorkshire growing-finishing pigs (average body weight of 54.37±2.13 kg) were randomly assigned to five treatment groups. Th...",BMC microbiology,2025-Apr
40175577,Encapsulation of L. fermentum with chitosan-alginate enhances its bioactivity against acrylamide toxicity in D.mel.,"Acrylamide (ACR), a neurotoxin typically present in thermally processed foods, is a substantial risk to people. The objective of this research is to develop synbiotic capsules with natural substances such as chitosan, alginate, and L. fermentum. Encapsulation is a significant tool in medicine, helping to improve targeted medication delivery and bioavailability. The chitosan/alginate-encapsulated probiotic (CAP) beads increase the bioavailability of probiotics in the gut, allowing for a more effe...",Scientific reports,2025-Apr
40160899,Effects of green tea supplementation on antioxidant status and inflammatory markers in adults: a grade-assessed systematic review and dose-response meta-analysis of randomised controlled trials.,"Green tea, a plant rich in bioactive compounds, has been highlighted for its beneficial effects. In the present systematic review and meta-analysis of randomised controlled trials (RCTs), the impact of green tea on inflammatory and oxidative markers is investigated. Using pre-defined keywords, online databases (PubMed, Scopus, Web of Science Core Collection, and Google Scholar) were searched for relevant articles, published from inception up to February 2024. The outcomes included C-reactive pro...",Journal of nutritional science,2025
40158133,Lactiplantibacillus plantarum FRT4 protects against fatty liver hemorrhage syndrome: regulating gut microbiota and FoxO/TLR-4/NF-κB signaling pathway in laying hens.,"Fatty liver hemorrhage syndrome (FLHS) has become one of the major factors leading to the death of laying hen in caged egg production. FLHS is commonly associated with lipid peroxidation, hepatocyte injury, decreased antioxidant capacity, and inflammation. However, there are limited evidences regarding the preventive effect of Lactiplantibacillus plantarum on FLHS in laying hens and its mechanisms. Our previous results showed that Lp. plantarum FRT4 alleviated FLHS by regulating lipid metabolism...",Microbiome,2025-Mar
40139417,"Probiotics and pregabalin combination prevented ictogenesis, neurobehavioral abnormalities and neurodegeneration in pentylenetetrazole kindling model of epilepsy.","The microbiota-gut-brain axis (MGBA) has emerged as a critical frontier in understanding neurological disorders, including epilepsy. Microbial disequilibrium potentially alters brain homeostasis and could potentiate an inflammatory state linking intestinal dysbiosis and intractable seizures. The current study sought to probe the anti-kindling, electrographical, behavioral and neuropathological impacts of combined intervention of probiotics (PRO; 10 ml/kg) and pregabalin (PRG; 10 mg/kg) in PTZ-in...",Brain research,2025-May
40113837,Nano selenium and plant extracts supplementation enhanced reproductive performance of parity-2 sows.,"To investigate the effects of nano selenium (nano-Se), curcumin (CUR), and glycyrrhiza extracts (GE) on reproductive performance, antioxidant and immune functions of primiparous sows and parity-2 sows, 54 primiparous sows (Landrace × Yorkshire) were randomly divided into three groups (18 sows per group): (1) CON group, basal diet (0.30 mg·kg-1 Se, sodium selenite); (2) CUR group, basal diet + 0.20 mg·kg-1 Se (nano-Se) + 300 mg·kg-1 CUR; (3) GE group, basal diet + 0.20 mg·kg-1 Se (nano-Se) + 500 ...",Scientific reports,2025-Mar
40111251,"Alleviation effects of Lactobacillus plantarum in colitis aggravated by a high-salt diet depend on intestinal barrier protection, NF-κB pathway regulation, and oxidative stress improvement.","A high-salt diet (HSD) can result in numerous health issues, including exacerbation of intestinal inflammation. Therefore, there is an immediate necessity of developing dietary supplements that can mitigate colitis exacerbated by a HSD. This study examined the impact of Lactobacillus plantarum HGD228 on colitis exacerbated by a HSD and the mechanisms underlying its alleviation. HGD228 treatment significantly enhanced colonic goblet cells and MUC2, upregulated ZO-1 and occludin, inhibited epithel...",Food & function,2025-Mar
40078994,"Effect of dietary Clostridium butyricum supplementation on growth performance, immune function, and intestinal health of hybrid grouper (Epinephelus fuscoguttatus ♀ × Epinephelus lanceolatus ♂).","The aim of this study is to investigate the effects of supplementing Clostridium butyricum (C. butyricum) on hybrid grouper (Epinephelus fuscoguttatus ♀ × Epinephelus lanceolatus ♂), with a particular focus on its impact on growth performance, blood composition, intestinal antioxidant capacity, gut microbiota, tight junction protein (ZO-1) expression, and inflammatory gene expression. The study seeks to uncover the potential health benefits of C. butyricum supplementation for hybrid grouper.",Frontiers in immunology,2025
