pmid,title,abstract,journal,pub_date
41236682,Investigation of the Effects of Lacticaseibacillus rhamnosus GG Administration on Penicillin-Induced Epileptiform Activity in Rats.,"Excitatory/inhibitory balance, oxidative and antioxidative regulatory systems play a role in the pathophysiology of epilepsy. In addition, intestinal dysbiosis is also involved in the pathophysiology of epilepsy. The aim of this study was to investigate the effects of Lacticaseibacillus rhamnosus GG (L. rhamnosus or LBR) on epileptic seizures and gamma aminobutyric acid (GABA), malondealdehyde (MDA), superoxide dismutase (SOD, glutathione peroxidase (GPx) and catalase (CAT) levels in serum and b...",Neurochemical research,2025-Nov
41229060,Elucidating the probiotic strategy with Pediococcus acidilactici BCB1H and Lactiplantibacillus plantarum HMX2 for restoring normal functions of gut and suppressing inflammation in a DSS-induced colitis animal model.,"Several inflammatory diseases, including colitis, are treated via probiotics but still the mechanism is not clear.",Allergologia et immunopathologia,2025
41208993,"Weizmannia coagulans BC99 regulates oxidative stress and serum metabolic pathways to improve allergic rhinitis: a randomized, double-blind, placebo-controlled trial.","Probiotics have demonstrated potential application value in alleviating allergic diseases, but their mechanisms of action remain to be explored. This study aimed to investigate the clinical efficacy of probiotics in patients with allergic rhinitis (AR) and explore the underlying mechanisms.",Frontiers in immunology,2025
41162864,"Impact of astaxanthin on oxidative markers, uric acid, and clinical symptoms in heart failure: a randomized clinical trial.","Chronic heart failure (HF) is often linked to increased oxidative stress and metabolic issues like high uric acid, which can worsen outcomes. Astaxanthin (ASX), a strong antioxidant, may help reduce these harmful effects. This study aimed to investigate the effects of ASX supplementation on oxidative stress markers as the primary outcome and clinical symptoms in patients with HF.",BMC cardiovascular disorders,2025-Oct
41131591,"Effect of mixodin supplementation on inflammatory and oxidative stress markers, clinical symptoms, mental health, and quality of life in patients with migraine: study protocol for a randomized clinical trial.","Migraine is a highly prevalent neurological disorder related to severe, unilateral headache and symptoms such as vomiting, nausea, and photophobia. Growing evidence implicates oxidative stress and inflammation as key contributors to migraine pathophysiology, exacerbating symptoms and related mental health conditions. Mixodin is a novel bioactive formulation derived from natural compounds, including curcumin, piperine, and gingerol, which are well-established for their anti-inflammatory and antio...",Trials,2025-Oct
41076092,Bacillus velezensis LG37 protects Macrobrachium rosenbergii from ammonia nitrogen stress.,"This study evaluated the protective effects of Bacillus velezensis LG37 on Macrobrachium rosenbergii under ammonia nitrogen stress, with a focus on survival, antioxidant capacity, and immune response. Juvenile prawns were divided into two groups: a control group without LG37 (Group A) and a treatment group with dietary LG37 supplementation (Group B). The 96-h maximum tolerance and absolute lethal concentrations of ammonia nitrogen were determined as 18.54 ± 1.21 mg/L and 86.52 ± 5.6 mg/L, respec...",Microbial pathogenesis,2025-Dec
41016286,Probiotic characteristics and protective effects of chicken-derived Enterococcus faecium against infection with Avian Pathogenic Escherichia coli and Salmonella in laying hens.,"Avian Pathogenic Escherichia coli (APEC) and Salmonella Enteritidis (SE) cause high mortality and economic losses in poultry. This study identified chicken-derived probiotics that can effectively combat APEC O78 and SE infection in laying hens. 7-day-old Dawu Jinfeng chicks naturally resistant to APEC O78 and SE infection were pre-screened and subjected to antibiotic treatments, revealing that Enterococcus species are crucial for maintaining resistance, as their reduction led to susceptibility a...",Veterinary microbiology,2025-Nov
41010509,Effects of 30-Day High-Dose Omega-3 Fatty Acid Supplementation on Plasma Oxidative Stress Enzyme Activities in Recreational and Trained Runners: A Pilot Study.,"Background: Physical activity induces the production of reactive oxygen species (ROS), which, at moderate levels mediate beneficial physiological adaptations, including insulin sensitivity and enhanced antioxidant defense. However, excessive ROS production during intense exercise may exceed endogenous antioxidant capacity, leading to oxidative stress and muscle damage. Objective: This study examined the effects of 30-day high-dose omega-3 fatty acid supplementation (9 g/day) on plasma fatty acid...",Nutrients,2025-Sep
41002176,"Effects of hydrolyzed yeast on weanling pig growth performance, fecal dry matter, and stress-related blood antioxidant criteria.","A total of 360 weanling pigs (241 × 600, DNA; initially 5.4 ± 0.01 kg) were used to evaluate the effects of a hydrolyzed yeast product (HY) on growth performance, fecal dry matter (DM), and stress-relevant blood antioxidant criteria. Pens of pigs were randomly allotted to one of six dietary treatments in a generalized randomized block design with 5 pigs per pen and 12 pens per treatment. Pigs were blocked with 4 replications of light (4.3 ± 0.01 kg), medium (5.4 ± 0.01 kg), and heavy (6.5 ± 0.01...",Journal of animal science,2025-Jan
40992648,Lactobacillus reuteri attenuates methotrexate-induced liver injury via modulation of oxidative stress and inflammation through HO-1/GPX4 and NF-κB/NLRP3 pathways.,"Methotrexate (MTX) is a chemotherapeutic agent widely used in cancer and autoimmune diseases; however, its clinic use is considerably limited owing to its severe hepatotoxicity. Although gut microbiota is implicated in various liver diseases, its specific role and mechanism in MTX-induced liver injury remain unclear. We established a MTX-induced liver injury model in mice and assessed hepatic damage through biochemical markers and histopathological analysis. Gut microbiota depletion was conducte...",European journal of pharmacology,2025-Nov
40987208,Mitigation of biochemical stress response effects in Swiss albino mice via Syzygium cumini and Nigella sativa seed extract dietary supplementation following deltamethrin exposure.,"Deltamethrin, a synthetic pyrethroid pesticide, is known to induce significant oxidative stress and immunotoxicity upon prolonged exposure. This study investigates the biochemical and physiological impact of deltamethrin on Swiss albino mice and explores the protective potential of Syzygium cumini and Nigella sativa seed extracts. Mice were grouped and administered deltamethrin (18 mg/kg) alone or in combination with seed extracts (100 mg/kg each), and biochemical, hematological, and organ-speci...",Biomedicine & pharmacotherapy = Biomedecine & pharmacotherapie,2025-Nov
40960785,Impact of dietary Selenium nanoparticles on the fillet composition and antioxidant status of Cirrhinus mrigala.,"Oxidative stress affects fish health and poses, significant harm to fish growth and fish physiology in aquaculture when fish are cultured in intensive farming. Selenium nanoparticles (SeNPs) act as a potential antioxidant in their optimal range, but their effect on the growth and health of Cirrhinus mrigala remains unexplored. The study aims to determine the impact of selenium nanoparticles on fish growth, tissue composition and antioxidant effect on Cirrhinus mrigala for sustainable aquaculture...",Brazilian journal of biology = Revista brasleira de biologia,2025
40943613,"Effects of Oligofructose Supplementation on Growth Performance, Antioxidant Capacity, Immunity, and Intestinal Health in Growing Rabbits.","This study aims to investigate the effects of dietary supplementation with different concentrations of oligofructose (FOS) on growth performance, antioxidant capacity, immunity, and intestinal microbial composition in growing rabbits. One hundred female Dehua black rabbits (34 d of age) were randomly assigned to four groups (CON, FOS-1, FOS-2, and FOS-3), with twenty-five rabbits in each group. The CON group received only a basal diet, while the FOS-1/FOS-2/FOS-3 group received the diet suppleme...",International journal of molecular sciences,2025-Sep
40887011,"Potential effects of dietary fermented Sargassum muticum on growth performance, intestinal health, immune-antioxidant related gene responses, and resistance to bacterial infection in Nile tilapia.","Recently, fermented brown algae have gained interest as a food source due to their high functionality and numerous bioactive components. Therefore, the current study used Lactobacillus plantarum and Saccharomyces cerevisiae probiotics to examine the possible effects of dietary fermented Sargassum muticum (DFSM) on the growth performance of Nile tilapia (Oreochromis niloticus), intestinal health, blood indices, antioxidant levels, and immune response. For 60 days, Nile tilapia (15 fish/aquarium) ...",Fish & shellfish immunology,2025-Dec
40876271,Attenuation of MEHP-induced hepatotoxicity and gut microbiota dysbiosis by Lactobacillus brevis Lb-0401 in Carassius auratus.,"Mono-2-ethylhexyl phthalate (MEHP) is one of the major biologically active metabolites of phthalate plasticizers that pose a health threat to aquatic animals. In this study, we investigated the ecotoxicological effects of MEHP on liver damage and gut microbiota in crucian carp (Carassius carassius) and the mitigating effects of Lactobacillus brevis Lb-0401 as a dietary supplement. The results showed that MEHP induced hepatotoxicity and increased serum AST, ALT and triglyceride levels, while L. b...",The Science of the total environment,2025-Oct
40839135,Synbiotics as Modulators of Developing Brain for Reproductive Development Via Estrogen Receptors in Male Coturnix Coturnix Japonica.,"The brain-gut-microbiome axis represents a bidirectional communication linking the gastrointestinal microbiome with immunity, digestion, reproduction and nervous system. Dietary supplementation of Lactobacillus rhamnosus, Bifidobacterium longum and mannan-oligosaccharides may modulate the brain-gut-axis and also have an effect on male reproductive physiology. Therefore, the study aims to explore the reproductive and neuronal physiology potentials of synbiotics in immature male Japanese quails. T...",Neurochemical research,2025-Aug
40827097,"The effects of probiotics, prebiotics, and synbiotics on aversive memory in a premature ovarian failure model in rat.","Cognitive impairment occurs in cisplatin-induced premature ovarian failure (POF). The impacts of probiotics, prebiotics, and synbiotics on passive avoidance memory, oxidative stress markers, and acetylcholinesterase (AChE) activity in the POF model were examined. POF was induced by cisplatin (2 mg/kg, IP/7 days). In the POF + Probiotic, POF + Prebiotic, and POF + Synbiotic groups, the treatments were done during 28 days after 7 days of cisplatin injection. The POF model was confirmed by a decrea...",Physiological reports,2025-Aug
40816604,The isolation of a novel Streptomyces zaomyceticus and its effects on disease resistance of Ctenopharyngodon idellus.,"This research has identified Streptomyces zaomyceticus S1-6 as a promising probiotic candidate exhibiting broad-spectrum antibacterial properties against nine prevalent fish pathogens. Toxicity assessments conducted using liver cells from grass carp (Ctenopharyngodon idella) and subsequent feeding trials demonstrated that S1-6 is both safe and non-cytotoxic. After a 30-day feeding period, S1-6 significantly enhanced growth performance relative to the control group (P < 0.05). Notably, key non-sp...",Microbial pathogenesis,2025-Nov
40813423,Ameliorative effects of coriander extract supplementation in mitigating nickel toxicity in grass carp (Ctenopharyngodon idella).,"This research explored the ameliorative effects of coriander (Coriandrum sativum) seed extract supplementation in mitigating nickel (Ni) toxicity in fish. For this purpose, Ctenopharyngodon idella fingerlings (average weight: 12.35 ± 0.04 g/fish) were randomly assigned to 18 tanks, divided into six groups with three replicates each. The six treatments were categorized as follows: the negative control group (NC) received no supplement and no Ni exposure, while the positive control group (PC) was ...",Scientific reports,2025-Aug
40804320,The impact of almond supplementation on oxidative stress biomarkers: a systematic review and meta-analysis of randomized control trials.,"Oxidative stress, an imbalance between reactive oxygen species and antioxidants, contributes to chronic diseases. Almonds, rich in vitamin E, polyphenols, and monounsaturated fats, exhibit antioxidant potential, though their overall effects on oxidative biomarkers are unclear. This systematic review and meta-analysis evaluate almond supplementation's impact on these biomarkers in adults. Following PRISMA guidelines, PubMed, Scopus, and Web of Science were searched up to January 2025. Randomised ...",Scientific reports,2025-Aug
40803544,Trehalose supplementation ameliorates heat stress-induced intestinal barrier dysfunction by suppressing endoplasmic reticulum stress and modulating gut microbiota in mice.,"Heat stress (HS) compromises intestinal barrier integrity and microbiota homeostasis. Trehalose, a nonreducing disaccharide, is well known as a molecular chaperone to prevent protein misfolding under stress. However, whether trehalose supplementation can affect intestinal barrier integrity and microbiota under HS remains unknown. Male C57BL/6 mice (6-week-old) were randomly divided into 3 groups (7 mice/group): a normal control group (CON, 23℃), a heat stress group (HS, 42℃) and heat stress + tr...",The Journal of nutritional biochemistry,2025-Dec
40799052,Dietary Supplementation With White and Common Turmeric Improves Resistance to Argulus siamensis in Labeo rohita.,"This study evaluated white turmeric (Curcuma zedoaria) as a sustainable feed additive alternative to common turmeric (C. longa) for enhancing disease resistance in Labeo rohita against Argulus siamensis infection. Juvenile L. rohita (15.8 ± 1.9 g) were divided into four treatment groups (n = 60 per group): (1) Control (commercial feed), (2) common turmeric-supplemented feed (1% w/w), (3) white turmeric-supplemented feed (1% w/w), and (4) combined turmeric-supplemented feed (0.5% common +0.5% whi...",Parasite immunology,2025-Aug
40740780,The effect of co-administration of vitamin E and C supplements on plasma oxidative stress biomarkers and antioxidant capacity: a GRADE-assessed systematic review and meta-analysis of randomized controlled trials with meta-regression.,There is no conclusion on the effect of vitamins E and C on plasma biomarkers of oxidative stress and antioxidant status. We conducted this meta-analysis to gain a clearer view of this area.,Frontiers in immunology,2025
40737044,"Clostridium butyricum JJ100 and Lacticaseibacillus rhamnosus LR alleviate liver injury in mice caused by continuous high-dose-alcohol exposure by protecting the intestinal barrier, rebuilding the gut microbiota and regulating AMPK and TLR4/NF-κB signaling pathways.","Alcohol consumption poses a major global public health challenge, with excessive drinkers showing heightened susceptibility to alcoholic liver disease (ALD) - a condition with complex pathogenesis. In this study, we used male BALB/c mice with identical enterotypes to establish a sustained high-dose alcohol-induced liver injury model. The model was created through daily intragastric administration of 52% (v/v) ethanol (10 mL kg-1) for four consecutive weeks, allowing us to investigate the hepatop...",Food & function,2025-Aug
40714301,Does Nigella sativa supplementation improve cardiovascular disease risk factors? A comprehensive GRADE-assessed systematic review and dose-response meta-analysis of 82 randomized controlled trials.,This systematic review and meta-analysis aimed to evaluate the effects of Nigella sativa (N. sativa) supplementation on metabolic and cardiovascular health outcomes.,Pharmacological research,2025-Sep
40659225,Probiotic secretomes attenuate inflammation and disrupted antioxidant status induced by polychlorinated biphenyls in human intestinal T84 epithelial cells.,Polychlorinated biphenyls (PCBs) are persistent organic pollutants linked with intestinal inflammation and disrupted antioxidant status. Humans are exposed to PCBs primarily via PCB-contaminated foods. A comprehensive analysis of PCB modulation of intestinal inflammatory networks is lacking. Lactic acid producing bacteria (LAB) secretomes have been shown to attenuate pro-inflammatory cytokine-induced colonic cell inflammation. This study aimed to characterize markers of inflammation and antioxid...,Free radical biology & medicine,2025-Nov
40644772,The beneficial effects of sesame (Sesamum indicum L.) products and their bioactive compounds on cardiovascular disease risk factors in patients with diabetes: A GRADE-Assessed systematic review and meta-analysis.,"This systematic review and meta-analysis aimed to evaluate the clinical effectiveness of sesame supplementation on glycemic control, lipid profile, anthropometric measures, liver enzymes, inflammatory biomarkers, blood pressure, and oxidative stress parameters in patients with diabetes.",Diabetes & metabolic syndrome,2025-Jun
40565170,The Effects of Lutein-Containing Supplement Intake on Glycation Inhibition Among Diabetic Patients with Cataracts.,"Glycation is known as an important factor inducing human diseases, including diabetic complications. As oxidative stress contributes to procedures of glycation, antioxidants may inhibit glycation and delay the progression of diabetic complications. Our previous investigation of human aqueous humor after the intake of a lutein-containing supplement demonstrated increases in antioxidative activities and decreases in peroxidative products. This study enrolled 25 patients with diabetes (DM group) an...",International journal of molecular sciences,2025-Jun
40457028,Comparative Effects of Co-administration of Lactobacillus casei and Bifidobacterium breve vs. Monotherapy on Hippocampal Neurodegeneration in a D-Galactose-Induced Aging Model.,"It has been shown that gut dysbiosis, a hallmark of aging, participates in age-related neurodegenerative conditions. Consumption of probiotics has favorable effects not only on gut hemostasis but also on the brain via the microbiota-gut-brain axis. Ongoing research aims to identify the most suitable probiotic or combination of probiotics tailored to each specific condition. Hence, the present study tested the effects of combination therapy of Lactobacillus casei (L. casei) and Bifidobacterium br...",Molecular neurobiology,2025-Oct
40399880,"Dietary prebiotic-stevioside modulates the growth, antioxidant enzymes, and immune response in thinlip mullets (Liza ramada) subjected to chronic cold stress.","Plant active ingredients, including stevioside, with their prebiotic properties and antioxidant potential, hold promise as innovative components in aquaculture. This study assessed the multi-level impacts of stevioside (0, 100, 200, 300, 400, or 500 mg/kg) on thinlip mullet (N = 540 juveniles with an initial weight 3.50 ± 0.07 g) exposed to a long-term low temperature regime (18 °C) for 60 days. Growth, blood parameters, enzymes, immune genes, and histological structure of intestine and liver we...",BMC veterinary research,2025-May
40390021,The effect of oregano essential oil and Bacillus subtilis supplements on winter fur growth in raccoon dogs (Nyctereutesprocyonoides).,"A total of 160 healthy raccoon dogs with no significant difference in body weight were selected and randomly divided into 10 groups, with each group having 4 replicates and each replicate consisting of 4 individuals. The pre-test period lasted for 7 days, followed by a formal test period of 82 days. The raccoon dogs in the 10 groups were fed basal diet supplemented with 50 mg/kg chlortetracycline and 100 mg/kg quinocetone (control group), 100 mg/kg OEO and 150 mg/kg BS (group I), 100 mg/kg OEO a...",BMC veterinary research,2025-May
40377982,Protective effect of safflower oil supplementation on sciatic nerve crush injury in rats.,"This study aimed to assess the effect of safflower oil (SO), a high-quality edible oil derived from seeds of Carthamus tinctorius L. possessing multiple bioactivities, on rats that underwent sciatic nerve crush (SNC) to induce peripheral nerve injury (PNI).",Nutritional neuroscience,2025-Oct
40376939,The Effect of Aerobic Exercise With an Omega-3 Supplement on the Tendon Healing Process.,"An Achilles tendon rupture is a common orthopaedic injury in athletes and other people. Therefore, it is essential to investigate methods that may yield beneficial results for tendon healing by addressing the inflammatory and gene expression aspects of the healing process.",The American journal of sports medicine,2025-Jun
40372377,Enhancing raw trout fillet quality with Lactiplantibacillus plantarum postbiotics and potassium sorbate.,"This study investigates the impact of Lactiplantibacillus plantarum postbiotics (LPP) on microbiological and chemical alterations in raw rainbow trout fillets stored at 4°C. LPP, containing chemicals such as methyl ester, oleic acid, and eucalyptol, demonstrated considerable radical scavenging action and improved cellular safety, enhancing cell survival by 118.70% to 170.60% and elevating SOD (20.10-33.14 mU mg-1) and GSH-Px (99.80-120.30 mU mg-1) activity. The use of LPP (1.5%, 0.8%, 0.5%) and ...",Letters in applied microbiology,2025-May
40355053,Lactobacillus salivarius alleviated dextran sulfate sodium (DSS)-induced colitis in mice by mitigating oxidative stress and inflammatory responses through modulation of the intestinal flora.,"Colitis is a multifactorial inflammatory bowel disease (IBD) involving intestinal barrier dysfunction, immune dysregulation, oxidative stress, and microbiota imbalance. Lactobacillus salivarius (L. salivarius), a probiotic with antioxidative and anti-inflammatory properties, was evaluated in a mouse model of DSS-induced colitis. Treatment with L. salivarius significantly reduced weight loss, colon shortening, and disease activity index, while improving histopathological damage. DSS-induced colit...",Microbial pathogenesis,2025-Aug
40319583,"Effects of Bacillus subtilis ZY1 on production performance, egg quality, serum parameters and intestinal health in laying hens.","To evaluate the effects of Bacillus subtilis ZY1 supplementation, production performance, egg quality, serum parameters, and intestinal health in laying hens were investigated. A total of 240 healthy 59-week-old Hy-Line Brown laying hens were randomly assigned to four groups: a control group (Con) fed a basal diet and three treatment groups supplemented with Bacillus subtilis ZY1 at levels of 0.05 % (LG), 0.1 % (MG), and 0.2 % (HG). The duration of trial lasted eleven weeks, including a one-week...",Poultry science,2025-Jul
40315587,Gut-testis axis in roosters: Lactiplantibacillus plantarum supplementation improves reproductive performance.,"Probiotics are widely used in poultry farming and industry, as they offer numerous health and performance benefits for birds. Probiotic Lactobacilli maintain gut microbiota balance, aid nutrient utilization, boost the immune system, increase stress resistance and serve as antibiotic alternatives. However, their impact on male reproductive function is not yet fully understood. This study investigated the effect of a novel probiotic strain, Lactiplantibacillus plantarum SNI3 (LbSNI3), on the repro...",Poultry science,2025-Jul
40298159,Lactiplantibacillus Plantarum YDJ-03 and Limosilactobacillus fermentum YDJ-6 Alleviate Metabolic Syndrome in Mice.,"Probiotics are increasingly recognized for promoting beneficial effects on intestinal health. However, most probiotic strains have been insufficiently researched, underscoring the need for further studies to fully understand their potential health benefits, especially in metabolic conditions. Therefore, this study aimed to explore the role and possible mechanism of Lactiplantibacillus plantarum YDJ-03 (YDJ-03) and Limosilactobacillus fermentum YDJ-6 (YDJ-6) in metabolic syndrome (MetS) and hyper...",International journal for vitamin and nutrition research. Internationale Zeitschrift fur Vitamin- und Ernahrungsforschung. Journal international de vitaminologie et de nutrition,2025-Apr
40282880,Protective Effect of Probiotics on Cardiac Damage in Experimental Sepsis Model Induced by Lipopolysaccharide in Rats.,"Background and Objective: Probiotics have been shown to be effective in controlling various adverse health conditions such as antibiotic-associated diarrhea, inflammatory bowel disease, obesity, and neurological diseases. However, to our knowledge, there is no research on the preventive effect of probiotics on heart damage caused by infections. This study examined the preventive benefits of probiotics against sepsis-related heart injury using a rat model caused by lipopolysaccharide (LPS). Mater...","Medicina (Kaunas, Lithuania)",2025-Mar
