pmid,title,abstract,journal,pub_date
41545110,Aqueous LC-MS/MS quantification of α-/β-nicotinamide mononucleotide in dietary supplements using a pentabromophenyl column.,"In this study, we developed an LC-MS/MS method that enables baseline separation and quantification of α- and β-nicotinamide mononucleotide (NMN) isomers under fully aqueous reversed-phase conditions. At first, three commonly used reversed-phase columns (Polar C18, F5, and PBr) were evaluated, and only the PBr phase provided sufficient stereoselectivity through enhanced π-π stacking, dipole-dipole interactions, and halogen bonding. Using 0.1 % formic acid in water as the mobile phase, the two iso...",Analytica chimica acta,2026-Feb
41543515,Multi-Omics Analysis Reveals the Potential Preventive Mechanism of Lactobacillus salivarius Li01 Against L-Arginine-Induced Acute Pancreatitis in Mice.,"Acute pancreatitis (AP) pathogenesis involves gut microbiota dysbiosis. Although Lactobacillus salivarius Li01 (Li01) is a well-characterised probiotic strain, its specific role in AP via the 'gut-pancreas axis' remains unclear. Li01 pretreatment via oral gavage was assessed in an L-arginine-induced AP mouse model. The gut microbiota composition and abundance were analysed via 16S rRNA sequencing, complemented by untargeted faecal metabolomics and pancreatic transcriptomics analyses. Li01 pretre...",Microbial biotechnology,2026-Jan
41539856,Oral intake of Heat-Killed Lactiplantibacillus plantarum Alleviates Bone Loss in an Ovariectomized Mouse Model Similarly to Live L. plantarum.,"Probiotics, including Lactiplantibacillus plantarum, have therapeutic potential to alleviate osteoporosis, which is particularly common in postmenopausal women with increasing bone fracture risk. Since live probiotics may cause adverse effects under certain conditions, such as in immunocompromised individuals, postbiotics, could be a safer alternative. In this study, we investigated whether heat-killed L. plantarum KCTC 10887BP (K-Lp, postbiotic form) has comparable therapeutic effects to live L...",Journal of microbiology and biotechnology,2026-Jan
41532096,"Oral administration of Lacticaseibacillus rhamnosus HM126 alleviates DNFB-induced atopic dermatitis in BALB/c mice by modulating immunity, gut microbiota, and metabolites.","Probiotics have emerged as a promising and safe alternative therapy for atopic dermatitis (AD) by regulating the gut microbiota-immune axis, correcting type 1/type 2 imbalance, and repairing the skin barrier.",Frontiers in immunology,2025
41521729,Effects of Vitamin C and/or E Supplementation on Glycemic Control and Cardiovascular Risk Factors in Type 2 Diabetes: A Systematic Review and Subgroup Meta-analysis.,"Type 2 diabetes (T2D) is one of the fastest-growing global health emergencies of the 21st century. However, high antioxidant capacity of supplementation of vitamin C and/or E was inversely associated with insulin resistance. However, each antioxidant possesses a distinct biological function that may be influenced by both dosage and duration of supplementation, potentially resulting in significantly different effects.",Nutrition reviews,2026-Feb
41518761,In vitro digestion stability of a Bifidobacterium-derived extracellular polysaccharides and its prebiotic potential in gut microbiota modulation.,"This study systematically evaluated the digestive stability and prebiotic potential of extracellular polysaccharides (EPS) derived from Bifidobacterium animalis RH using in vitro digestion and fecal fermentation models. Digestion (INFOGEST 2.0) revealed that EPS maintained structural integrity: total carbohydrates remained stable (59.38-60.12 %), while reducing sugars increased moderately (0.125-0.207 mg/mL), indicating partial dissociation. Structural characterization (SEM, GPC, IC, FT-IR) conf...",Food chemistry,2026-Mar
41516256,From Ecological Threat to Bioactive Resource: The Nutraceutical Components of Blue Crab (Callinectes sapidus).,"Native to the western Atlantic, the Atlantic blue crab Callinectes sapidus (CS) has spread to the Mediterranean, affecting local ecosystems and mussel aquaculture and leading to severe ecological and financial losses in Italy and other areas. Given its rapid spread and socio-economic impacts, several countries have begun to exploit CS commercially, but the consumers' interest is still limited. In this study, we analysed both nutrient and nutraceutical profiles of CS meats, evaluating potential d...",International journal of molecular sciences,2025-Dec
41515289,The Role of Omega-3 Polyunsaturated Fatty Acid Supplementation in Postoperative Recovery of Colorectal Cancer: Systematic Review and Meta-Analysis.,"Background: China is currently developing standards for Food for Special Medical Purposes (FSMP) targeting for oncology patients. However, substantial challenges remain in defining optimal fortification levels of omega-3 polyunsaturated fatty acids (ω-3 PUFAs). Accumulating evidence suggests that ω-3 PUFA intake improves postoperative prognosis by modulating oncological parameters in colorectal cancer (CRC) patients. This meta-analysis aimed to evaluate the therapeutic efficacy of ω-3 PUFA suppl...",Nutrients,2026-Jan
41515260,Effects of Green Tea Extract Supplementation on Inflammatory Cytokines Among Postmenopausal Women with Overweight or Obesity-A Secondary Analysis of a Randomized Controlled Trial.,"Background: Excess adiposity induces low-grade inflammation, including increased C-reactive protein (CRP), interleukin-6 (IL-6), and tumor necrosis factor-alpha (TNF-α). Green tea contains epigallocatechin gallate (EGCG), with anti-inflammatory potential. EGCG metabolism is influenced by individual variations in catechol-O-methyltransferase (COMT) genotypes. Objectives: To evaluate the effect of green tea extract (GTE) supplementation on circulating inflammatory cytokines among postmenopausal wo...",Nutrients,2026-Jan
41515249,Comprehensive Effects of Melatonin Supplementation on Cardiometabolic Risk Factors: A Systematic Review and Dose-Response Meta-Analysis.,"Background/Objectives: There is no definitive consensus regarding the effects of melatonin on cardiometabolic risk factors (CMRFs). This systematic review and dose-response meta-analysis of randomized controlled trials (RCTs) evaluated the impacts of melatonin supplementation on CMRFs, including anthropometric, lipid, glycemic, inflammatory, oxidative, and liver function parameters. Methods: A systematic search across multiple databases retrieved 63 eligible RCTs published up to October 2025. Re...",Nutrients,2025-Dec
41515240,Subcellular Localization Dictates Therapeutic Function: Spatially Targeted Delivery of Amuc_1100 by Engineered Lacticaseibacillus paracasei L9 Enhances Intestinal Barrier in Colitis.,"Background/Objectives: Impaired intestinal barrier function is a hallmark of inflammatory bowel disease (IBD). Akkermansia muciniphila and its outer membrane protein Amuc_1100 can enhance this barrier, but the clinical application of Amuc_1100 is limited by the fastidious growth of its native host. This study aimed to overcome this by utilizing the robust probiotic Lacticaseibacillus paracasei L9 for targeted Amuc_1100 delivery. Methods: We engineered Lc. paracasei L9 to express Amuc_1100 via in...",Nutrients,2025-Dec
