pmid,title,abstract,journal,pub_date
40839943,Boar fecal and seminal microbiomes in relation to semen quality and probiotic supplementation in an antibiotic-free feeding program.,"This study aimed to investigate the fecal and seminal microbiomes of boars in relation to semen quality and the effects of transitioning from antibiotics to probiotics within an antibiotic-free feeding regimen. A total of 21 fecal and 21 semen samples were collected from seven Duroc boars at three different time points: before antibiotic withdrawal (Day 0, serving as the control), after 48 days (Day 48), and after 96 days (Day 96). The fresh semen characteristics, bacterial culture contents, and...",Theriogenology,2026-Jan
40839135,Synbiotics as Modulators of Developing Brain for Reproductive Development Via Estrogen Receptors in Male Coturnix Coturnix Japonica.,"The brain-gut-microbiome axis represents a bidirectional communication linking the gastrointestinal microbiome with immunity, digestion, reproduction and nervous system. Dietary supplementation of Lactobacillus rhamnosus, Bifidobacterium longum and mannan-oligosaccharides may modulate the brain-gut-axis and also have an effect on male reproductive physiology. Therefore, the study aims to explore the reproductive and neuronal physiology potentials of synbiotics in immature male Japanese quails. T...",Neurochemical research,2025-Aug
40836708,Corynebacterium glutamicum alleviated colitis by downregulating the TNF signaling pathway mediated by cIAP1/2 in mice.,"The gut microbiota and its associated micro-ecosystem are closely related to the onset and development of ulcerative colitis (UC). It is known that Corynebacterium glutamicum (C. glutamicum) helps rebuild gut eubiosis from diabetes dysbiosis; however, its effects on UC remain unknown. This study aims to investigate the therapeutic effects and mechanisms of C. glutamicum on UC. In this study, C. glutamicum was encapsulated with thiolated hyaluronic acid (HA-SH) to form a hydrogel, termed as CG-HA...",Food & function,2025-Sep
40832781,Ameliorating Effect of Bifidobacterium breve CM02-09T on High-Fat Diet-Induced Nonalcoholic Fatty Liver Disease in Mice.,"Evidences have demonstrated that the regulation of gut microbiota by probiotics can be utilized to prevent nonalcoholic fatty liver disease (NAFLD); Bifidobacterium was widely used as a potential therapeutic alternative for metabolic diseases. In this study, the probiotic functions of Bifidobacterium breve CM02-09T and its effects on NAFLD were investigated through genome annotation and high-fat diet (HFD)-induced mouse model. The genome of B. breve CM02-09T consists of a single circular chromos...",FASEB journal : official publication of the Federation of American Societies for Experimental Biology,2025-Aug
40832058,"Gut Microbiota Dysbiosis in Preeclampsia: Mechanisms, Biomarkers, and Probiotic-Based Interventions.","Background: This study aimed to investigate the impact of fecal microbiota transplantation (FMT) on gut microbiota composition and serum inflammatory factors in a murine model. Methods: Female C57BL/6J mice (n = 60) were divided into four groups: control (Con), negative (Neg), normal transplantation (NT), and preeclampsia transplantation (PET). The Con group received no treatment, while the Neg, NT, and PET groups were administered a triple antibiotic regimen (ampicillin, neomycin sulfate, and m...",Mediators of inflammation,2025
40829489,Anti-inflammatory effect of probiotics in patients with Blastocystis spp. infection.,Blastocystis hominis BH infection has been linked to a variety of intestinal immunopathologies. Probiotic therapy is suggested to improve gastrointestinal inflammation during blastocystosis by inducing a pro-inflammatory cytokine response and modulating immune signaling pathways. A hundred patients infected with BH were divided into 4 groups. Group 1: 20 patients did not receive any treatment; Group 2: 40 patients received probiotic therapy; Group 3: 20 patients received metronidazole; and Group...,Cytokine,2025-Nov
40829204,"Effect of dietary L-arginine supplementation on the expression of vascular endothelial growth factor A, its receptors, and nitric oxide system components in the pancreas of streptozotocin-induced diabetic rats.","T1DM is characterized by elevated blood glucose levels, insulin insufficiency, and alterations in vessel formation. Therefore, the expression of insulin, active caspase-3, inflammatory factors such as TNF-α and NF-κB, and components of the NO and VEGFA systems were investigated in the pancreas of STZ-induced diabetic rats. Blood glucose levels and body weight were also measured. Additionally, the effects of L-arginine supplementation on the same parameters were evaluated. The body weight of the ...",Tissue & cell,2025-Dec
40826150,High-dose multi-strain Bacillus probiotics enhance treatment and reduce antibiotic usage in children with persistent diarrhea through immune and microbiota modulation.,"Persistent diarrhea remains medical challenge to date regarding both its etiology and therapeutic interventions. Here, we conducted a randomized, double-blind, controlled clinical trial to evaluate the effectiveness of high-dose multi-strain Bacillus spore probiotics (LiveSpo DIA30) containing B. subtilis, B. clausii, and B. coagulans at 5 billion CFU/5 mL ampoule, in the supportive treatment of persistent diarrhea in children. Our findings revealed a significant 3-day shorter recovery period, 1...",Scientific reports,2025-Aug
