pmid,title,abstract,journal,pub_date
42451076,The Role of Polyunsaturated Fatty Acids (PUFAs) in the Primary Prevention of Allergic Diseases in Children: A Position Paper of the SIAIP Primary and Secondary Prevention of Allergic Diseases and Nutraceuticals Committees.,"Background: Type 2 inflammatory diseases are among the most common chronic inflammatory conditions in childhood and represent a growing global health burden. Increasing evidence suggests that early-life nutritional exposures may influence immune programming and allergic disease development. This Position Paper aims to summarize the current evidence regarding the immunomodulatory role of polyunsaturated fatty acids (PUFAs), particularly omega-3 long-chain fatty acids, in the prevention of allergi...",Nutrients,2026-Jun
42451071,Strain-Specific Effects of Early-Life Probiotic Supplementation on Respiratory Infections in Infants: A Systematic Review and Meta-Analysis.,"Probiotic and synbiotic supplementation has been proposed as a preventive strategy against respiratory tract infections (RTIs) in early childhood, although evidence in infants and young children remains inconsistent. This systematic review and meta-analysis aimed to evaluate the effects of probiotic or synbiotic supplementation administered during the first 24 months of life on respiratory infection outcomes.",Nutrients,2026-Jun
42451046,Dietary Tryptophan Supplementation Attenuates Lipopolysaccharide-Induced Acute Lung Injury in a Murine Model of Colitis.,"Objectives: Inflammatory bowel disease (IBD) is associated with extraintestinal comorbidities, and lung diseases are widespread manifestations. Respiratory bacterial insult is a common illness that results in acute lung injury (ALI) in critical patients. IBD concurrence with respiratory infection may further exacerbate lung injury. Tryptophan (Try), an essential amino acid, is processed by gut microbiota and produces aryl hydrocarbon receptor (AhR) ligands. These ligands can activate the AhR pat...",Nutrients,2026-Jun
42451042,The Effectiveness of Non-Soy Oral Herbal Supplements for Menopausal Symptoms: A Systematic Review.,"Background: Menopause is a biological process characterised by the cessation of menstruation and substantial changes in ovarian hormone production. As many women seek non-hormonal alternatives to hormone replacement therapy, interest in herbal supplements has increased. However, the evidence for their effectiveness remains inconsistent due to the diversity of available supplements. This systematic review aimed to evaluate whether oral herbal supplements improve menopausal symptoms in women. Meth...",Nutrients,2026-Jun
42450145,"Colloidal Gold Dietary Supplements as Nanomaterials: Physicochemical Evaluation, Estimated Oral Exposure, and Preliminary Biological Assessment.","Colloidal gold dietary supplements intended for oral consumption are increasingly marketed as nano-enabled products, yet their physicochemical characteristics and biological effects remain insufficiently documented. In this study, commercially available colloidal gold supplements produced and marketed in Romania (30, 55, and 110 mg/L) were investigated to determine their classification as nanomaterials and to assess their preliminary biological effects in the context of oral exposure. Transmissi...",International journal of molecular sciences,2026-Jun
42450050,Camel Milk Extracellular Vesicles as Functional Foods and Nutraceuticals: Bridging Dairy Science and Chronic Disease Prevention.,"Camel milk is increasingly recognized as a premium functional food, attributed to its rich nutraceutical compounds. Recent research has concentrated on the nanoscale extracellular vesicles derived from camel milk (CM-EVs), which exhibit distinctive properties. This review examines the methodologies for isolating and characterizing CM-EVs, alongside their potential health benefits in functional foods and nutraceuticals. CM-EVs have the capacity to safeguard functional proteins, noncoding RNAs, an...",International journal of molecular sciences,2026-Jun
42446092,Biological Safety and Functional Properties of Açaí Seed Extract: Antioxidant Capacity and Prebiotic Potential.,"Açaí (Euterpe oleracea) is widely recognized as a functional food due to its nutritional value and abundance of bioactive compounds. Its seeds, representing approximately 80%-95% of the fruit mass, constitute an abundant agro-industrial byproduct with promising biotechnological potential. This study aimed to chemically characterize a 70% ethanolic extract obtained from E. oleracea seeds through liquid chromatography-mass spectrometry (LC-MS) annotation and total phenolic content (TPC) determinat...",Journal of food science,2026-Jul
42445850,Associations of probiotics combined with Tongli Gongxia Chinese medicine with intestinal barrier biomarkers and day 7 short-chain fatty acids in patients with severe acute pancreatitis.,"Severe acute pancreatitis (SAP) is characterized by intestinal barrier dysfunction and altered short-chain fatty acid (SCFA) profiles, contributing to bacterial translocation and systemic complications. This study examined whether receipt of probiotics combined with Tongli Gongxia Chinese medicine was associated with intestinal barrier biomarker changes and day 7 fecal SCFA concentrations in SAP patients.",Frontiers in cellular and infection microbiology,2026
42445303,"Liposomes in drugs, nutraceuticals, and cosmetics.","Liposomes are spherical vesicular structures formed by lipid bilayers with a hydrophilic internal nucleus. The size varies from about 20 nanometers to several micrometers. They were initially described in the sixties by the biophysicist Alec Bangham. Since then, multiple studies have been conducted to characterize them according to the number of layers: unilamellar, bilayers, multilamellar vesicles, and vesicles containing more vesicles called multivesicular vesosomes; size: between 0.025 µm and...",PeerJ,2026
42444334,Efficacy of a Microencapsulated Sugar-Free Probiotic Oral Rinse on Gingival Health and Salivary Matrix Metalloproteinases 8 and 9 in Children With Down Syndrome: A Pilot Randomized Clinical Trial.,"Children with Down Syndrome (DS) are at heightened risk for oral diseases due to their distinct physiological and immune characteristics. Matrix metalloproteinases (MMPs), particularly MMP-8 and MMP-9, are key mediators of periodontal tissue breakdown. Probiotics may provide a novel, well-tolerated alternative to conventional antiseptics by modulating these biomarkers.","Special care in dentistry : official publication of the American Association of Hospital Dentists, the Academy of Dentistry for the Handicapped, and the American Society for Geriatric Dentistry",2026
