pmid,title,abstract,journal,pub_date
41819931,"Bioactive molecules from Agave salmiana bagasse: Study of their antioxidant, prebiotic potential, and cytotoxicity.","Bioactive compounds present in agro-industrial waste have been an attractive alternative for reducing current health problems. However, high concentrations of bioactive compounds may affect the growth of intestinal microbiota and cause unpleasant flavors. Therefore, the objective of this study was to evaluate the effect of reducing the content of bioactive compounds present in Agave salmiana waste on antioxidant activity (DPPH, ABTS, and FRAP), the prebiotic potential using probiotic strains (Bi...","Food research international (Ottawa, Ont.)",2026-May
41819915,Xylo-oligosaccharide supplementation exacerbates colitis susceptibility in mice via taurine depletion.,"Xylo-oligosaccharides (XOS) are widely utilized as functional food ingredients and additives. However, the impact of long-term dietary supplementation with XOS on intestinal inflammation and its underlying mechanisms has yet to be fully elucidated. This study investigated the XOS supplementation on susceptibility to DSS-induced ulcerative colitis (UC) in C57BL/6 J mice and explored the underlying mechanisms, with a particular focus on the intestinal microenvironment and bile acids (BAs) metaboli...","Food research international (Ottawa, Ont.)",2026-May
41819877,Ligilactobacillus murinus alleviates binge-eating behavior by restoring serotonin metabolism.,"Overeating disorder (OD) is characterized by recurrent binge eating episodes without compensatory behaviors. It is linked to gut dysbiosis and impaired serotonin (5-HT) metabolism; however, the specific microbial mechanisms driving these neurochemical changes remain poorly understood. To address this research gap, a stress and food restriction-based mouse model that recapitulates key OD phenotypes, including elevated palatable food intake, increased caloric consumption, and heightened food impul...","Food research international (Ottawa, Ont.)",2026-May
41818307,"Beneficial Effect of Xanthohumol Supplementation on the Clinical Course of IgA Nephropathy Refractory to Conventional Treatment-A Prospective, Open-Label Case Series.","Immunoglobulin A nephropathy (IgAN) is the most common glomerulonephritis worldwide. Xanthohumol (XN) exhibits anti-inflammatory, anti-oxidant, anti-fibrotic, anti-microbial, anti-proliferative, and immunomodulatory effects that all are associated with the IgAN pathogenesis. Our study aims to evaluate the potential impact of XN on the clinical course of IgAN refractory to conventional treatment. Included were five rigorously selected IgAN patients with poor prognosis assessed on the basis of cli...",Molecular nutrition & food research,2026-Mar
41817093,A Comparative Study on the Structural Properties of Polysaccharides From Nitraria sibirica Fruits With Different Extraction Methods and Their Antioxidant and Prebiotic Activities.,"In this paper, the physicochemical, structural properties, antioxidant, and prebiotic activities of polysaccharides obtained from Nitraria sibirica pall fruit with different extraction methods were investigated and compared. Structural features were characterized using Fourier transform infrared spectroscopy, scanning electron microscopy, x-ray diffraction, Congo red staining, thermogravimetric analysis, periodate oxidation, and Smith degradation analysis. Results showed that extraction methods ...",Chemistry & biodiversity,2026-Mar
41814629,Probiotic Lactiplantibacillus plantarum WB4404 and WB4503 from Kimchi Induce Apoptosis in Human Colorectal Cancer Cells In Vitro.,"Lactic acid bacteria isolated from kimchi include beneficial microorganisms with diverse health-promoting properties. Among these, Lactiplantibacillus plantarum has attracted attention owing to its potential anticancer effects. In this study, we investigated the anticancer activity and underlying mechanisms of L. plantarum WB4404 and L. plantarum WB4503, isolated from kimchi, in HT-29 human colorectal cancer cells in vitro. Both strains significantly inhibited HT-29 cell proliferation and activa...",Journal of microbiology and biotechnology,2026-Mar
41811986,Amino acid supplementation enhances in vivo efficacy of lipid nanoparticle-mediated mRNA delivery in preclinical models.,"Lipid nanoparticles (LNPs) play a critical role in the delivery of therapeutic messenger RNA (mRNA). Despite extensive efforts to optimize lipid formulations for in vivo delivery, efficacy of mRNA by LNPs remains suboptimal in many organs. Here, we demonstrate that LNP delivery efficacy is influenced by cellular metabolism, with the physiologic metabolome imposing constraints on mRNA expression from LNPs. Using an in vitro system, we found that simulated physiologic metabolic conditions led to t...",Science translational medicine,2026-Mar
41810630,Effects of live and heat-killed Bifidobacterium lactis in rats with induced periodontitis.,"Probiotics and postbiotics have emerged as promising adjunctive therapies in managing periodontal disease. Bifidobacterium animalis subsp. lactis HN019 has shown antimicrobial and immunomodulatory effects in both experimental and clinical settings when administered orally. However, the systemic impact of this strain, independent of local oral effects, remains unclear.",Journal of applied oral science : revista FOB,2026-Mar
41810439,Traditional Chinese medicine alleviate gastrointestinal symptoms during bismuth quadruple therapy for Helicobacter pylori infection: A complementary perspective.,"Liu et al recently published research suggesting that multistrain probiotics significantly relieved bismuth quadruple therapy (BQT)-associated gastrointestinal symptoms without affecting eradication success. They conducted a rigorous randomized, double-blind, placebo-controlled trial, demonstrating that a 4-week regimen of a multistrain probiotic supplement significantly reduced symptoms such as reflux, dyspepsia, and diarrhea. The reduction in side effects and enhanced patient comfort highlight...",World journal of gastroenterology,2026-Mar
41810309,Comparative effectiveness of exercise modalities and nutritional supplementation for sarcopenic obesity in older adults: a network meta-analysis based on randomized controlled trials.,"Sarcopenic obesity is highly prevalent among older adults and is associated with adverse clinical outcomes. However, direct comparative evidence on the relative efficacy and safety of different exercise-based rehabilitation strategies, with or without nutritional supplementation or high-protein intake, remains limited. This study aimed to compare and rank the effects of diverse rehabilitation interventions using a systematic review and network meta-analysis.",Frontiers in public health,2026
41809989,Lactobacillus rhamnosus confers protection against enteropathogenic bacteria by enhancing mucosal immunity and epithelial barrier function.,"Probiotics such as Lactobacillus rhamnosus represent promising alternatives to antibiotics for combating enteric infections, yet their mechanisms of action remain incompletely understood. This study aimed to elucidate the protective mechanisms of L. rhamnosus CIQ249 against enteropathogenic bacterial infection, focusing on the intestinal physical barrier and mucosal immune responses.",Frontiers in cellular and infection microbiology,2026
