pmid,title,abstract,journal,pub_date
41830040,The Ergogenic Potential of Succinic Acid in Exercise Performance and Post-Exercise Recovery: A Systematic Review.,"Background: Succinic acid plays a central role in human energy metabolism as a key intermediate of the Krebs cycle that releases energy accumulated as guanosine triphosphate (GTP). Through its conversion via succinate dehydrogenase (SDH), succinate directly links the Krebs cycle to oxidative phosphorylation (OXPHOS), contributing to adenosine triphosphate (ATP) production. Exercise induces pronounced changes in succinate concentrations in skeletal muscle, blood, and saliva, with responses influe...",Nutrients,2026-Mar
41830038,Dysglycemia and Cardiometabolic Risk: Pathophysiological Rationale and the Emerging Role of Nutraceuticals in Integrated Prevention.,"Dysglycemia represents an early and progressive stage of cardiometabolic disease, characterized by IR, metabolic inflammation, and increased cardiovascular risk. Its high prevalence and largely asymptomatic course often lead to diagnostic and therapeutic inertia, resulting in missed opportunities for early intervention. Recognizing dysglycemia as a disease continuum rather than a transitional condition supports the need for anticipatory and integrated preventive strategies. Within this framework...",Nutrients,2026-Mar
41830030,Long-Term Beetroot Extract Supplementation Improves Morphological Muscle Quality and Rate of Force Development in Postmenopausal Women: A Randomized Clinical Trial.,"Background: Low estrogen levels during menopause reduce nitric oxide (NO) production, contributing to decline in skeletal muscle quality and function. Although acute and short-term dietary nitrate supplementation has demonstrated promising effects, long-term benefits, particularly on muscle quality in postmenopausal women, are not well established. Objectives: The objective was to investigate the effects of long-term (12-week) nitrate-rich beetroot extract supplementation on morphological and fu...",Nutrients,2026-Mar
41830024,A Randomized Controlled Trial to Determine the Effects of Curcumin and Epigallocatechin-3-Gallate Supplementation on Serum Brain-Derived Neurotrophic Factor and Mood Disturbance in Adults.,"Background/Objectives: Mood disorders like depression, anxiety, and stress have increased steadily among adults, with growing interest in non-pharmaceutical treatments to improve symptomology. Epigallocatechin-3-gallate (EGCG) and curcumin are polyphenols with evidence to support their positive impacts on mood disorder symptomology and potential mood-associated biomarkers like brain-derived neurotrophic factor (BDNF). This study examined the effects of combined EGCG and curcumin supplementation ...",Nutrients,2026-Mar
41830012,Complex Effects of B-Vitamin Combinations on Cardiovascular Diseases: A Systematic Review and Meta-Analysis of Randomized Controlled Trials over Three Decades.,"Background and Purpose: The effects of B-vitamin combinations on the prevention of cardiovascular diseases, such as myocardial infarction (MI) and stroke, remain controversial. We conducted a systematic review and meta-analysis of randomized controlled trials (RCTs) over three decades to evaluate the association between B-vitamin combinations and mortality and arterial thrombotic outcomes. Methods: PubMed, Embase, Web of Science, and the Cochrane Library were systematically searched for RCTs wit...",Nutrients,2026-Mar
41830004,Latilactobacillus curvatus IM01 Alleviates Allergic Airway Inflammation Through Microbial and Metabolic Crosstalk Along the Gut-Lung Axis.,"Background: Gut microbiota dysbiosis is critically implicated in the pathogenesis of allergic airway inflammation (AAI) via the gut-lung axis. While Latilactobacillus curvatus is a promising probiotic candidate, its specific immunomodulatory mechanisms in respiratory diseases remain poorly understood. Objective: In this study, we investigated the protective effects and underlying mechanisms of L. curvatus IM01 in an ovalbumin (OVA)-induced murine AAI model using an integrated multi-omics approac...",Nutrients,2026-Mar
41829987,Neurocosmetics or Hype? Psychobiotic Potential of Strain-Specific Cosmeceuticals.,"Background: There is increasing interest in cosmeceuticals-cosmetic regimes incorporating a specific probiotic or postbiotic strain, fully characterized genetically and phenotypically-which, when topically applied, have the ability to modulate the skin microbiome, exhibit anti-inflammatory properties and improve the overall skin appearance by reducing signs of aging. In addition, claims have been made that emotional and psychological well-being can be improved by neuroactive substances released ...",Nutrients,2026-Mar
41829973,Nutraceutical Effects of Gastrodiae elata and Coenzyme Q10 on Oxidative Stress and Inflammatory Pathways in an In Vitro Gut-Prostate Axis Model.,"Background/Objectives: Benign prostatic hyperplasia (BPH) is a multifactorial condition associated with androgen imbalance, oxidative stress, and chronic inflammation, leading to growing interest in food-derived bioactive compounds with multitarget activity. This study aimed to investigate the biological effects of a nutraceutical combination of Gastrodiae elata Blume extract and coenzyme Q10 (Q10), focusing on mechanisms relevant to prostate physiological balance using food-relevant in vitro mo...",Nutrients,2026-Feb
41829972,"Gut-Centric Multi-System Regulation by Bacillus subtilis and Bacillus natto: A Review of Their Probiotic Functions in Nutrition, Immunity, and Metabolism.","Compared with lactic acid-producing probiotics, spore-producing probiotics such as Bacillus subtilis (BS) and Bacillus natto (BN) exhibited superior metabolic capacity and stress resistance and are more suitable for industrial applications. However, limited understanding of their nutritional and intestinal health mechanisms has constrained their food potential.",Nutrients,2026-Feb
41829971,"Caffeine Supplementation Increases Muscle Strength, but Not Endurance, While Both Caffeine and Its Expectation Elevate Blood Lactate: A Balanced-Placebo Design Study.","Objectives: To determine whether caffeine supplementation and its expectancy influence muscle strength (ST) and muscle endurance (ME) using a balanced-placebo design. Methods: Using a randomized, double-blind, balanced-placebo design, resistance-trained men (18-30 years; n = 16) participated in two assessment/familiarization visits (demographics; one repetition maximum (1RM) followed by four counterbalanced sessions: C/C (informed caffeine/used caffeine), P/C (informed placebo/used caffeine), C/...",Nutrients,2026-Feb
41829966,Probiotic-Driven Competitive Exclusion in the Human Gut: A Meta-Analysis of Microbial Diversity and Pathogen Suppression.,"Background: The gut microbiota is essential for maintaining health and preventing disease. Probiotics, defined as beneficial live microorganisms, are increasingly recognized for their ability to inhibit pathogens through competitive exclusion. This meta-analysis systematically evaluates the effectiveness of probiotics in reducing pathogen colonization within the human gut. Methods: A comprehensive literature search was conducted across PubMed and Scopus from October 2018 to August 2023, identify...",Nutrients,2026-Feb
41829964,"Effect of Supplementation with Lactobacillus reuteri SGL 01 in Lactating Women on Breast Milk and Neonatal Gut Microbiota: An Exploratory, Randomized, Open-Label Clinical Trial.","Background/Objectives: Early-life gut colonization is crucial for immune system development and metabolic programming. Lactobacillus reuteri has been investigated for its capacity to modulate neonatal gut microbiota, but evidence regarding maternal supplementation during lactation remains limited. This study aimed to evaluate the effect of maternal supplementation with L. reuteri SGL 01 on the microbial composition of breast milk and neonatal feces over the first month of life. Methods: This is ...",Nutrients,2026-Feb
41829958,Effect of a Nutraceutical Combination on Oxidative Stress Biomarkers in Healthy Subjects and Patients with Alzheimer's Disease.,Advanced glycation end products (AGEs) and oxidative stress increase with aging and are implicated in Alzheimer's disease (AD). We developed an anti-glycation blend using LC-MS-based screening and assessed its effects on oxidative and glycation-related biomarkers in humans.,Nutrients,2026-Feb
41829950,Current Evidence of Ergogenic and Post-Exercise Recovery Effects of Dietary Supplementation with Cordyceps militaris in Humans-A Narrative Review.,"Cordyceps militaris is an entomopathogenic fungus traditionally used in Asian ethnomedicine and increasingly investigated for its potential health-promoting properties, including immunomodulatory and anti-inflammatory activities. In recent years, it has gained attention as a dietary supplement with possible applications in sports nutrition. This narrative review summarizes and critically evaluates the current human evidence regarding the ergogenic and post-exercise recovery effects of C. militar...",Nutrients,2026-Feb
41829947,Intermittent Fasting and Akkermansia muciniphila Exert Independent and Combined Benefits on Behavioral and Neurobiological Deficits in a VPA-Induced Autism Rat Model.,"Background/Objectives: Autism is a complex neurodevelopmental condition characterized by social and cognitive impairments, with growing evidence implicating neuroinflammation, disrupted autophagy, apoptosis, GABAergic dysfunction, and gut permeability in its pathophysiology. Thus, this study aimed to evaluate the independent and combined effects of intermittent fasting (IF) and the next-generation probiotic Akkermansia muciniphila on behavioral outcomes and molecular markers in prenatal valproic...",Nutrients,2026-Feb
41829943,Is the Juice Worth the Squeeze? Vitamin C Supplementation in Hemodialysis Patients: A Systematic Review.,"Background: Patients undergoing hemodialysis commonly exhibit deficiencies in water-soluble vitamins, primarily as a result of inadequate dietary intake and loss into the dialysate. Given the essential role of vitamin C in numerous metabolic pathways, routine supplementation has been proposed as a potentially beneficial intervention in this population. Aim: We aimed to evaluate the current evidence on vitamin C supplementation in patients undergoing hemodialysis, with particular attention to cli...",Nutrients,2026-Feb
41829938,Supplementation with Animal- and Plant-Derived Proteins Modulates the Structure and Predicted Metabolic Potential of the Gut Microbiota in Elite Football Players.,"The primary outcome of this 8-week randomized, controlled, parallel trial was to assess longitudinal shifts in gut microbiota structure and predicted metabolic potential in 45 elite football players following protein supplementation.",Nutrients,2026-Feb
41829930,Epigenetically Active Supplements and the Risk of Sports Injuries: Narrative Review from Molecular Mechanisms to Practical Implications.,"Background/Objectives Sports-related musculoskeletal injuries remain a major challenge in physically active populations, with substantial interindividual variability in susceptibility and recovery that cannot be fully explained by biomechanics or genetics alone. Epigenetic mechanisms, including DNA methylation, histone modifications, and non-coding RNAs, provide a dynamic interface through which mechanical loading, inflammation, and metabolic signals regulate gene expression during tissue adapta...",Nutrients,2026-Feb
41829928,A Fiber- and Plant-Based Nutraceutical Attenuates Insulin Resistance and Oxidative Stress in Type 2 Diabetic Mice.,"Background/Objectives: Nutraceuticals, consisting of bioactive compounds or materials, are increasingly regarded as promising strategies for the prevention and management of diabetes. This study aimed to evaluate the antidiabetic potential of a nutraceutical formulation (Sugar Care, SC) composed of indigestible maltodextrin, pumpkin extract, and bitter melon extract, using a type 2 diabetic mouse model. Methods: A starch postprandial model in fasted normal mice was first used to assess postprand...",Nutrients,2026-Feb
41829924,Impact of an Oral Nutrition Supplement on the Nutritional Status of Stunted and At-Risk of Stunting Children: A Community-Based Intervention Trial.,"Introduction: Stunting is associated with poor nutritional intake during early childhood. This study evaluated the effect of a daily intake of 510 mL of an oral nutritional supplement for 180 days on linear growth among children with stunting and at-risk of stunting aged 12-36 months. Methods: A community-based, single-arm intervention was conducted among 91 children in Kelantan, Malaysia. The children at enrolment had height-for-age Z-scores (HAZs) between <-1.0 SD and >-3 SD based on WHO Growt...",Nutrients,2026-Feb
41829906,"Forensic Perspective of Unintentional Doping, Cardiovascular Health, and the Role of Nutrition in Competitive Sports.","Unintentional doping, often caused by contaminated supplements or misinterpreted therapeutic prescriptions, poses significant health, ethical, and regulatory challenges in competitive sports. Understanding the cardiovascular risks associated with performance-enhancing substances (PESs) and the preventive role of nutrition requires integrated analysis. A systematic review was conducted in accordance with PRISMA guidelines. Searches of comprehensive bibliographic databases yielded studies publishe...",Nutrients,2026-Feb
41829899,"Protecting Citizens, Enabling Prevention: A Framework for Responsible Dietary Supplement Use in Europe.",We welcome the Europe Commission's growing ambition to protect cardiovascular health across the life course [...].,Nutrients,2026-Feb
41829897,Effects of Rhodiola rosea on Physical and Decision-Making Performance in Football Players: A Randomised Controlled Trial.,"Objectives: To determine whether four weeks of Rhodiola rosea (RHO) supplementation improves intermittent exercise performance, post-exercise blood lactate concentrations, and decision-making under fatigue in competitive football players. Methods: Twenty-four male competitive football players completed a randomised, double-blind, placebo-controlled 4-week intervention (RHO vs. placebo). Outcomes included Yo-Yo IR2, repeated-sprint ability (RSA), post-RSA blood lactate (0, 3, 5 min), football-spe...",Nutrients,2026-Feb
41829891,Migraine and the Gut-Brain Axis-The Role of Microbiome-Targeted Biotics.,"Background: Migraine is a highly prevalent and disabling primary headache disorder frequently accompanied by gastrointestinal symptoms and comorbid gastrointestinal diseases. Increasing evidence suggests that alterations in the gut microbiota and dysregulation of the microbiome-gut-brain axis may contribute to migraine pathophysiology through immune activation, oxidative stress, impaired intestinal barrier function, and neuroinflammatory signaling. Objectives: This narrative review aims to summa...",Nutrients,2026-Feb
41829888,Effect of Prebiotic Supplementation With and Without Physiotherapy on Pain and Pain Sensitivity in People with Knee Osteoarthritis.,"Background: Emerging evidence links the gut microbiome to chronic pain processing. Inulin, a prebiotic fibre, modulates the gut microbiome, while physiotherapy-supported exercise (PSE) improves pain and function. We evaluated the effects of inulin supplementation with and without PSE on knee osteoarthritis (OA) pain. Methods: In a 2 × 2 factorial RCT, 117 community-dwelling adults with knee OA received 6 weeks of: (A) 20 g/day inulin, (B) digital PSE (Joint Academy™), (C) inulin +PSE, or (D) 10 ...",Nutrients,2026-Feb
41829885,Lacticaseibacillus paracasei MG5012 and Bifidobacterium animalis subsp. lactis MG741 Alleviate Metabolic Dysfunction-Associated Steatotic Liver Disease and Preserve Skeletal Muscle Integrity in High-Fat-Diet-Fed Mice.,"This study investigated the systemic metabolic effects of two probiotic strains, Lacticaseibacillus paracasei MG5012 and Bifidobacterium animalis subsp. lactis MG741, on metabolic dysfunction-associated steatotic liver disease (MASLD) and obesity-related muscle dysfunction in high-fat-diet (HFD)-induced obese mice.",Nutrients,2026-Feb
41829884,The Combination of Lactobacillus reuteri RC-14® and Lactobacillus rhamnosus GR-1® Induces Anxiolytic-like and Antidepressant-like Effects via Estrogenic Receptors in Ovariectomized Rats.,"Background/Objetives: Menopause increases anxiety and depression risk, linked to gut microbiota changes. Probiotics show psychobiotic effects that could therapeutically alleviate these symptoms in menopausal women. However, this potential and its mechanism of action involving estrogen receptors remain largely unexplored. To investigate whether Lactobacillus reuteri RC-14® and Lactobacillus rhamnosus GR-1® exert anxiolytic-like and antidepressant-like effects in ovariectomized rats via estrogenic...",Nutrients,2026-Feb
41828874,Coffee Silverskin Supplementation Alleviates High-Glucose-Diet-Induced Obesity by Modulating Lipogenic Gene Expression in Caenorhabditis elegans Model.,"Coffee silverskin (CSS), the major by-product of coffee roasting, is reported to contain bioactive compounds, including xanthines and polyphenols, showing promising potential for food and nutraceutical applications. This study investigated the beneficial effects of CSS hydroalcoholic extracts, which were chemically characterized by Attenuated Total Reflectance-Fourier-Transform Infrared Spectroscopy and ElectroSpray Ionization tandem Mass Spectrometry, on Caenorhabditis elegans physiology. CSS s...","Molecules (Basel, Switzerland)",2026-Mar
41828712,Seminal Redox Improvement and Sperm Proteome Remodeling After Deprox-HP Nutraceutical Supplementation in Male Accessory Gland Inflammation: A Pilot Study.,"Male accessory gland inflammation (MAGI) can impair male fertility through inflammation-driven oxidative stress and direct sperm damage; nutraceutical approaches may be useful when antibiotics are not indicated. Here, we evaluated a 3-month treatment with a Graminex™-based dietary supplement (Deprox-HP) in twenty MAGI patients integrating conventional semen analysis and oxidative stress assessment with sperm proteomics before and after therapy. After treatment, total and progressive sperm motili...",International journal of molecular sciences,2026-Mar
41828592,A Combined Probiotic-Morus alba Strategy Enhances Glucose Homeostasis in an In Vitro Gut-Pancreas-Liver Axis Model: A Preliminary Mechanistic Screening Study.,"Type 2 Diabetes Mellitus (T2DM) is a chronic metabolic disorder linked to gut microbiota dysbiosis and impaired inter-organ metabolic signalling. This study investigated the combined effects of the probiotic Lactiplantibacillus plantarum TJA7 and Mulberry Leaf extract (Morus alba) on cellular processes relevant to T2DM-related metabolic dysfunction. An advanced in vitro gut-pancreas-liver axis model, using Caco-2, EndoC-βH5, and HepG2 cells, was employed under hyperglycemic and oxidative stress ...",International journal of molecular sciences,2026-Mar
41828545,In Vivo Evaluation of the Effect of Limosilactobacillus fermentum MC1 and Its EPSs on the Microbiota and Inflammatory Processes in the Mouse Intestine.,"Limosilactobacillus fermentum MC1 is an exopolysaccharide (EPS)-producing strain with previously determined probiotic potential in vitro. This study aimed to investigate the in vivo capacity of the MC1 strain or its EPSs to modulate intestinal microbiota and assess its anti-inflammatory effects in both healthy and dysbiotic conditions. Therefore, Lb. fermentum MC1 and its EPSs were administered to a mouse model of dextran sulfate sodium (DSS)-induced colitis (DIC) and to a healthy group, and the...",International journal of molecular sciences,2026-Mar
41828445,From Probiotics to Postbiotics-An Update on Their Biotherapeutic Potential and the Emerging Strategies in Human Health.,"Probiotics and postbiotics have gained increasing attention in microbiome research due to their potential roles in maintaining gut homeostasis and supporting human health. While probiotics are defined as live microorganisms that confer health benefits when administered in adequate amounts, postbiotics represent preparations of inanimate microorganisms and/or their components that also exert biological effects on the host. This narrative review provides an updated overview of the current knowledg...",International journal of molecular sciences,2026-Feb
41828410,Integrated Untargeted and Targeted Metabolomics Reveals Distinct Bioactive Metabolite Profiles Between Probiotic Supplements and Yogurt.,"Probiotics are widely consumed as health-promoting agents, with probiotic supplements (PS) and yogurt (YG) representing formulated products and fermented foods, respectively. Despite their broad consumption, systematic comparisons of their biochemical characteristics remain limited. In this study, integrated untargeted and targeted metabolomics approaches were applied to compare the comprehensive metabolite profiles of PS and YG. PS exhibited relatively higher levels of amino acids, dicarboxylic...",International journal of molecular sciences,2026-Feb
41824867,Different response to vitamin D supplementation in children with RVOT morphology PVCs vs LV fascicular PVCs.,"Outflow tract premature ventricular contractions (PVCs) are typically benign arrhythmias in structurally normal hearts. Vitamin D insufficiency has been shown to cause PVCs in both children and adults. This study examined the impact of vitamin D supplementation in children with an increased burden of PVCs in 2 patient categories with distinct electrocardiogram morphologies: right ventricular outflow tract (RVOT) and left fascicular. We enrolled 46 patients (mean age 10.6 ± 4.1 years, 26% female)...",Medicine,2026-Mar
41823995,"Effects of combined dietary fiber and probiotic supplementation on gut microbiota, immune function, and clinical outcomes in patients with advanced colorectal cancer: a retrospective cohort study.","To evaluate the efficacy of a combined intervention of dietary fiber and probiotics on gut microbiota composition, systemic immune response, nutritional status, and long-term prognosis in patients with advanced colorectal cancer (CRC) undergoing conventional therapy.",Supportive care in cancer : official journal of the Multinational Association of Supportive Care in Cancer,2026-Mar
41823363,"Effect of Supplemented Spent Mushroom Substrate (Pleurotus ostreatus) on Growth Performance, Nutrient Digestibility, Nitrogen Balance, and Blood Metabolites of Goats.","This study evaluated the effects of Pleurotus ostreatus spent mushroom substrate (SMS), supplemented with 4% urea and 18% molasses, as a partial replacement for Napier grass. Four dietary treatments were formulated with 70% roughage (Napier grass) and 30% concentrate, replacing Napier grass with SMS at 0%, 20%, 35%, or 50% inclusion levels. A 120-day feeding including a 7-day digestibility trial was conducted using 20 3-month-old upgraded Anglo-Nubian goats (7.81 ± 0.39 kg). Goats fed diets cont...",Animal science journal = Nihon chikusan Gakkaiho,2026
41823362,"Precision Microbial Therapeutics for Infertility: Next-Generation Probiotics, Engineered Biologics and Translational Pathways.","Infertility affects ~1 in 6 people of reproductive age and remains difficult to treat because causes are heterogeneous and diagnostics are incomplete. Recent evidence reframes the female reproductive tract as a low-biomass but biologically active microbial ecosystem. Dysbiosis, typically loss of protective Lactobacillus species (notably L. crispatus) with overgrowth of anaerobic pathobionts, is associated with implantation failure and recurrent pregnancy loss. Framing conditions such as chronic ...",Microbial biotechnology,2026-Mar
41819940,"Luteolin-stabilized pickering emulsion for encapsulating Enterococcus hirae: preparation, characterization, and synergistic effects on hyperuricemia.","Luteolin, a natural flavonoid with potent antioxidant, anti-inflammatory, and urate-lowering activities. In this study, luteolin processed via anti-solvent precipitation (ASP-LUT) was utilized as an emulsifier to formulate Pickering emulsions (PEs) for encapsulating the probiotic Enterococcus hirae (EH), which possesses uric acid-lowering activity. The results demonstrated that higher ASP-LUT concentrations facilitated the construction of PEs with enhanced stability and viscoelasticity. The phys...","Food research international (Ottawa, Ont.)",2026-May
41819935,Lactiplantibacillus plantarum ZJUIDS51 improves androgenic alopecia via gut-skin axis.,"Androgen dysregulation is the primary driver of androgenetic alopecia (AGA), the most prevalent form of hair loss. This study aimed to evaluate the efficacy of Lactiplantibacillus plantarum ZJUIDS51 (Z51) in alleviating AGA using a C57BL/6 mouse model and to explore the underlying mechanisms associated with the gut-skin axis. The model was induced via intraperitoneal injection of dihydrotestosterone (DHT). Z51 was administered orally via gavage, while topical minoxidil and PBS gavage were used i...","Food research international (Ottawa, Ont.)",2026-May
