pmid,title,abstract,journal,pub_date
41516030,Manganese Deficiency and Mn2O3 Nanoparticles Supplementation Disrupt Bone Remodeling and Mineral Matrix Maturation in Rats.,"This study aimed to investigate the effects of dietary manganese deficiency and compare the impact of manganese macroparticles (MnCO3) and nanoparticles (Mn2O3NPs) on bone remodeling and metabolism. Twenty-seven male Wistar rats were divided into three groups (n = 9): control (standard MnCO3, 65 mg Mn/kg), manganese-deficient, and Mn2O3NPs-supplemented (65 mg Mn/kg). After a 12-week feeding period, bone-related markers and gene expression were analyzed in the femur and blood. Mn-deficient rats s...",International journal of molecular sciences,2025-Dec
41515480,Potential Nutraceutical Properties of Vicia faba L: LC-ESI-HR-MS/MS-Based Profiling of Ancient Faba Bean Varieties and Their Biological Activity.,"Vicia faba L. is a widely cultivated legume known to contain numerous specialised metabolites. In this study, the seed coats and cotyledons of two ancient V. faba L. varieties, historically consumed in southern Italy and distinguished by black and purple seed coats, were extracted using 80% methanol and 80% ethanol. Extracts were analysed for total polyphenol, flavonoid and proanthocyanidin contents, and antioxidant activity using DPPH, ABTS, and FRAP assays. The purple seed coats exhibited the ...","Molecules (Basel, Switzerland)",2026-Jan
41515313,Determination of Monacolin K and Citrinin in the Presence of Other Active Ingredients Found in Selected Food Supplements by HPLC-DAD.,"A universal HPLC method with diode array detection was developed for the separation and determination of the lactone and acid forms of monacolin K in the presence of other active ingredients (vitamins B1, B6, B12, and folic acid) found in selected dietary supplements. The method also enables the quantitative determination of citrinin in monacolin K. Chromatographic separation was performed on an ACE 5 C18-PFP column (250 × 4.6 mm) thermostated at 25 °C. The mobile phase consisted of 0.005 M phos...","Molecules (Basel, Switzerland)",2025-Dec
41515291,Effects of High-Dose Vitamin D Supplementation and Physical Exercise on Vitamin D Metabolites in Professional Football Players: A Pilot Study.,"Background/Objectives: Vitamin D plays an important role in muscle metabolism and recovery, yet its kinetics during and after football-specific physical activity remain poorly understood. Therefore, this study aimed to determine whether physical effort during a football match influences the concentration of vitamin D metabolites and to explore the effect of a single high-dose cholecalciferol supplementation combined with physical exercise on the levels of vitamin D metabolites in professional fo...",Nutrients,2026-Jan
41515290,Multi-Strain Probiotic Improves Tryptophan Metabolism and Symptoms in Chronic Fatigue Syndrome Patients with Co-Occurring Irritable Bowel Syndrome: An Open-Label Pilot Study.,"Background/Objectives: Gut dysbiosis in Chronic Fatigue Syndrome (CFS) drives low-grade inflammation and shifts tryptophan metabolism toward neurotoxic pathways. The causal link between bacterial translocation, kynurenine pathway dysregulation, and symptom severity remains under-defined. We evaluated the impact of a high-concentration multi-strain probiotic on the ""gut-kynurenine axis"" and clinical status in CFS patients with co-morbid IBS-U and confirmed dysbiosis. Methods: Forty female patient...",Nutrients,2026-Jan
41515289,The Role of Omega-3 Polyunsaturated Fatty Acid Supplementation in Postoperative Recovery of Colorectal Cancer: Systematic Review and Meta-Analysis.,"Background: China is currently developing standards for Food for Special Medical Purposes (FSMP) targeting for oncology patients. However, substantial challenges remain in defining optimal fortification levels of omega-3 polyunsaturated fatty acids (ω-3 PUFAs). Accumulating evidence suggests that ω-3 PUFA intake improves postoperative prognosis by modulating oncological parameters in colorectal cancer (CRC) patients. This meta-analysis aimed to evaluate the therapeutic efficacy of ω-3 PUFA suppl...",Nutrients,2026-Jan
41515260,Effects of Green Tea Extract Supplementation on Inflammatory Cytokines Among Postmenopausal Women with Overweight or Obesity-A Secondary Analysis of a Randomized Controlled Trial.,"Background: Excess adiposity induces low-grade inflammation, including increased C-reactive protein (CRP), interleukin-6 (IL-6), and tumor necrosis factor-alpha (TNF-α). Green tea contains epigallocatechin gallate (EGCG), with anti-inflammatory potential. EGCG metabolism is influenced by individual variations in catechol-O-methyltransferase (COMT) genotypes. Objectives: To evaluate the effect of green tea extract (GTE) supplementation on circulating inflammatory cytokines among postmenopausal wo...",Nutrients,2026-Jan
41515257,School-Age Neurodevelopmental and Atopy Outcomes in Extremely Preterm Infants: Follow-Up from the Single Versus Triple-Strain Bifidobacterium Randomized Controlled Trial.,"Background: Probiotic supplementation for very preterm infants is a common practice in many neonatal units. Assessing the effects of early postnatal exposure to probiotics on long-term neurodevelopment, growth, and atopy-related outcomes is important. Extremely preterm (EP: <28 weeks) infants enrolled in our previously reported randomized trial (SiMPro) comparing short-term effects of single (SS: B. breve M-16V) versus triple-strain (TS: B. breve M-16V, B. longum subsp. infantis-M63, B. longum s...",Nutrients,2026-Jan
41515256,Effects of a Red-Ginger-Based Multi-Nutrient Supplement on Optic Nerve Head Blood Flow in Open-Angle Glaucoma.,"Objectives: Glaucoma is an age-related neurodegenerative disease, characterized by retinal ganglion cell loss and progressive visual field deterioration. Beyond intraocular pressure (IOP), vascular and metabolic dysregulation contributes to optic nerve head (ONH) ischemia and neuronal vulnerability. Nutritional factors with antioxidative and vasodilatory properties may help preserve ocular perfusion. This study investigated the acute and subacute effects of a single dose of a dietary supplement ...",Nutrients,2026-Jan
41515249,Comprehensive Effects of Melatonin Supplementation on Cardiometabolic Risk Factors: A Systematic Review and Dose-Response Meta-Analysis.,"Background/Objectives: There is no definitive consensus regarding the effects of melatonin on cardiometabolic risk factors (CMRFs). This systematic review and dose-response meta-analysis of randomized controlled trials (RCTs) evaluated the impacts of melatonin supplementation on CMRFs, including anthropometric, lipid, glycemic, inflammatory, oxidative, and liver function parameters. Methods: A systematic search across multiple databases retrieved 63 eligible RCTs published up to October 2025. Re...",Nutrients,2025-Dec
