pmid,title,abstract,journal,pub_date
41931531,Lactobacillus casei culture supernatant ameliorates acute alcohol-induced liver injury by inhibiting cellular stress and promoting intestinal integrity in mice.,"Alcohol-associated liver disease (ALD) is a common liver disease worldwide. Probiotics prevent alcohol-induced liver injury and improve intestinal integrity. However, the precise mechanisms behind these effects are not fully understood. In the present study, we investigated the effects of Lactobacillus casei (L. casei) AS1.2435 on ALD in a mouse model. Ten-week-old ICR mice were pretreated with L. casei intracellular product or L. casei supernatants in drinking solution for 2 weeks before gavage...",PloS one,2026
41931124,Probiotic novel strain Lactobacillus reuteri MRD01 alleviates dextran sulfate sodium-induced colitis in male mice by promoting intestinal barrier integrity.,"Intestinal barrier dysfunction contributes to the progression of inflammatory bowel disease (IBD), yet current therapies provide limited symptom relief, are associated with substantial long-term adverse effects, and exhibit high recurrence rates. Lactobacillus reuteri (L. reuteri), a probiotic with strong colonisation capacity in the gastrointestinal tract, produces metabolites that regulate intestinal microecology. This study explored the therapeutic efficacy and underlying mechanisms of a newl...",Antonie van Leeuwenhoek,2026-Apr
41930749,Feasibility of Early Oral Nutritional Supplementation After Liver Transplantation: A Randomized Pilot Study.,"Catabolic and inflammatory changes after liver transplantation (LT) increase energy and protein requirements. This study assessed the feasibility of a 12-week high-energy/high-protein oral nutrition supplementation (ONS) initiated after resumption of solid oral intake post-LT. Secondary objectives were 1) to describe changes in nutritional risk, muscle strength, and quality of life during the pre-transplant period, and 2) to explore the potential impact of ONS after LT on these outcomes and musc...",Clinical transplantation,2026-Apr
41923280,Real-World Effectiveness and Safety of Saccharomyces boulardii CNCM I-745 as Adjunct Therapy for Helicobacter pylori Eradication: Data From the European Registry on H. pylori Management (Hp-EuReg).,Saccharomyces boulardii CNCM I-745 (Sb) is one of the most widely used probiotics in clinical practice. The aim of this study was to assess the impact of adding Sb to Helicobacter pylori eradication therapy on treatment outcomes (effectiveness and safety) in routine European gastroenterology clinical practice.,Helicobacter,2026
41922785,Polydopamine cross-linked Bifidobacterium single cell core-shell system with multi-target regulation to alleviate constipation in mice.,"Bisazolidine (BD) to alleviate constipation by stimulating intestinal nerves and increasing the secretion of water and electrolytes. However, it is prone to cause serious side effects, such as electrolyte imbalance and drug dependence. Bifidobacterium, can alleviate constipation from the root through a series of biological cascade reactions, such as ""regulating the flora, promoting acid production, softening feces, and anti-inflammatory repair"". But Bifidobacterium has the characteristic of slow...",Archives of microbiology,2026-Apr
41918874,Integrative multi-omics analysis reveals probiotic-induced microbiota shifts in women with gestational diabetes.,"Gestational diabetes mellitus (GDM) is a common pregnancy disorder. It is associated with impaired glucose tolerance and insulin resistance, increasing the potential risks for both maternal and fetal complications. GDM is associated with an increased risk of type 2 diabetes later in life. Management is a big issue in maternal health. New work has underscored the role of the gut microbiota in metabolism and immune function. This indicates that probiotics might exert their mode of action through m...",Frontiers in cellular and infection microbiology,2026
41918422,Determination of diuretics in the whey protein supplements: uncovering hidden contaminants in the sports nutrition market.,"The widespread use of whey protein supplements raises concerns about contamination with banned diuretics, posing health risks and the potential for inadvertent doping. In this study, a liquid-liquid extraction (LLE) procedure coupled with liquid chromatography-tandem mass spectrometry (LC-MS/MS) was developed and validated for the simultaneous detection of 23 diuretics in whey protein supplements. The method was assessed for selectivity, linearity, matrix effect, recovery, precision, and sensiti...",Acta chimica Slovenica,2026-Jan
41916937,Magnesium supplementation as an adjunct to fluoxetine therapy for depression.,To evaluate the effectiveness of magnesium supplementation as an adjunct to fluoxetine therapy for improving depressive symptoms and serum serotonin levels in patients with depression.,East Asian archives of psychiatry : official journal of the Hong Kong College of Psychiatrists = Dong Ya jing shen ke xue zhi : Xianggang jing shen ke yi xue yuan qi kan,2026-Mar
41914920,Dietary Vitamin E and Selenium Supplementation Mitigates Saline Drinking Water-Induced Stress in Crossbred Muscovy Ducks.,"This study evaluated the effects of vitamin E and selenium supplementation on growth efficiency and physiological adaptation of Muscovy ducks consuming diluted seawater. The experiment used a completely randomized design with four treatments and five replicates, including fresh water (FW); diluted seawater at 0.45% (DSW); S1: DSW supplemented with vitamin E (20 mg/kg diet) and selenium (0.3 mg/kg diet); S2: DSW supplemented with vitamin E (40 mg/kg diet) and selenium (0.6 mg/kg diet). The result...",Animal science journal = Nihon chikusan Gakkaiho,2026
41914100,Does Vitamin D₃ Supplementation Improve Exercise Tolerance of D₃ Deficient Chronic Obstructive Lung Disease Patients? - A Randomized Controlled Trial.,"Newer functional aspects of vitamin D₃ have been revealed in tissue and organs other than bones. In several studies, vitamin D₃ supplementation showed significant improvement in exercise tolerance in various co-morbid patients but precise connection is not clear, in Chronic Obstructive Pulmonary Disease (COPD) patients. This study aimed to evaluate the effects of vitamin D₃ supplementation on exercise tolerance in D₃ deficient patients with COPD. A double-blinded randomized controlled trial was ...",Mymensingh medical journal : MMJ,2026-Apr
41910295,A randomized controlled trial of probiotics to reduce the severity of oral mucositis in patients with oropharyngeal carcinoma undergoing concurrent chemoradiotherapy.,"While probiotics show promise in reducing chemoradiotherapy side effects like oral mucositis in head and neck cancer patients, robust clinical evidence of their consistent effectiveness is still needed. The objectives of this study were to compare the incidence and severity of oral mucositis, dysphagia, and compliance of radiotherapy treatment between the study arm (oral probiotics, along with concurrent chemoradiotherapy) and the control arm (concurrent chemoradiotherapy alone) in patients of l...",Journal of cancer research and therapeutics,2026-Jan
41910214,Limosilactobacillus reuteri normalizes gut microbiota dysfunction and social deficits of rat offspring associated with prenatal exposure to stress.,"Prenatal stress (PS) is a potential risk factor for social behavior impairment in offspring. Here, we demonstrate that PS induces gut microbiota alterations that are associated with impaired sociability and social novelty preference in rat offspring. In addition, we found that these behavioral deficits could be partially rescued through either cohousing with normal offspring or fecal microbiota transplantation from control donors. Metagenomic analysis identified Limosilactobacillus reuteri (L. r...",Gut microbes,2026-Dec
41906504,"Effects of a Lactobacillus salivarius probiotic short-term intervention on S. mutans, Lactobacillus spp. and C. albicans - a randomized pilot study with pre-school children.","The aim of the study is to evaluate the effect of short-term, oral supplementation of non-viable Lactobacillus salivarius (HM6 Paradens) on the number of caries-related microorganisms in the supragingival plaque biofilm of pre-school children.",Annals of agricultural and environmental medicine : AAEM,2026-Mar
41905960,"Lactobacillus acidophilus Postbiotics Differentially Modulate Nutrient Sensing, Intestinal Barrier Integrity, and Inflammatory Signaling in Broiler.","The global restriction of antibiotic growth promoters (AGPs) has accelerated the search for sustainable nutritional alternatives that support growth performance and intestinal health of poultry. Postbiotics and their bioactive metabolites derived from probiotic microorganisms have emerged as promising candidates due to their functional stability and immunometabolic regulatory potential. This study evaluated the effects of Lactobacillus acidophilus-derived postbiotics on growth performance, nutri...",Comprehensive Physiology,2026-Apr
41901740,Native Bacillus-Based Probiotic Consortia Suppress Vibrio parahaemolyticus and Restructure Hatchery Water Microbiomes in Shrimp Larval Systems.,"Shrimp aquaculture is constrained by opportunistic bacterial pathogens, particularly Vibrio parahaemolyticus, whose proliferation in hatchery systems is shaped by microbial community structure. We evaluated the antagonistic activity and microbiome effects of two native Bacillus-based probiotic consortia (CN5, RS3) applied alone or combined (MIX) in shrimp larval culture water over 30 days, relative to a no-probiotic control. Treatments were assessed using standardized in vitro inhibition assays,...","Pathogens (Basel, Switzerland)",2026-Mar
41901543,"Nutritional Status in Obesity: A Comprehensive Narrative Review of Dysbiosis, Micronutrient Deficiencies and the Effects of Probiotics/Synbiotics.","Obesity is a chronic, relapse-prone disease often associated with comorbidities such as type 2 diabetes, dyslipidemia, and non-alcoholic fatty liver disease. Intestinal dysbiosis, defined as an imbalance in the composition and function of the gut microbiota, is commonly observed in individuals with excess body weight and plays a key role in the development of related metabolic complications. Moreover, dysbiosis can disrupt nutrient metabolism, leading to imbalances in energy homeostasis. Those a...","Medicina (Kaunas, Lithuania)",2026-Feb
41901188,Gut Microbiota Changes Following Short-Term Probiotic Supplementation in Older Home Enteral Nutrition Patients.,"Home Enteral Nutrition (HEN) patients, often older adults, are susceptible to gut microbiota dysbiosis and low-grade chronic inflammation (inflammaging), which negatively impacts overall health and intestinal integrity. However, evidence on microbiota-targeted interventions in this population remains limited. The development of targeted nutritional strategies, such as probiotic supplementation, has been proposed to address these age-related changes.",Nutrients,2026-Mar
41901170,Vitamins as Modulators of Neurodegenerative Disease Pathways: Mechanisms and Therapeutic Perspectives.,"Neurodegenerative diseases, including Alzheimer's disease, Parkinson's disease, and amyotrophic lateral sclerosis, currently represent one of the major challenges in contemporary medicine and geriatrics. Progressive degeneration of the nervous system affects not only patients' physical functioning but also their psychosocial well-being, often leading to social isolation and disruption of interpersonal relationships. These processes are most strongly associated with individuals over 65 years of a...",Nutrients,2026-Mar
41901166,Gut Microbiota Profile and the Impact of Probiotic Supplementation in Competitive Cyclists: A Scoping Review.,"Background/Objectives: The recent discovery of the importance of gut microbiota has enhanced our understanding of several issues related to energy metabolism, immune systems, and post-exercise recovery, which could have an impact on sports performance. Probiotics are used as sports supplements and have recently been proposed to be effective in reducing the incidence of gastrointestinal and respiratory infections during training and competition. This scoping review aimed to evaluate the gut micro...",Nutrients,2026-Mar
41901156,"Personalized Nutrition, Lifestyle, and Supplementation Strategies to Support Cognitive Performance and Well-Being in Esports Athletes: A Narrative Review.","Esports are a rapidly expanding form of competitive activity that demand high levels of cognitive alertness, motor precision, stress management, and resilience to mental and physical fatigue. At the same time, the sedentary lifestyle, extended screen exposure, and psychological pressures associated with competitive gaming raise concerns for both performance and long-term health. Growing evidence highlights the importance of nutrition and lifestyle behaviors in supporting cognitive performance an...",Nutrients,2026-Mar
41901133,Selenium-Biofortified Probiotics: A Synergistic Microbial-Nutritional Strategy Against Exercise-Induced Stress.,"This review aims to explore the potential and mechanisms of selenium-biofortified probiotics as an innovative nutritional strategy for alleviating exercise-induced physiological stress. Exercise, particularly high-intensity or exhaustive exercise, triggers a cascade of physiological perturbations, including oxidative stress, inflammatory responses, gut barrier dysfunction, and muscle damage. Traditional single-nutrient strategies, such as inorganic selenium or probiotic supplementation, are ofte...",Nutrients,2026-Mar
41901124,From Macromolecule to Microbe: Identification of Ligilactobacillus salivarius D3-8 as a Key Degrader of Ejiao and a Novel Therapeutic Probiotic for Ulcerative Colitis.,"Background/Objectives: Ejiao, a macromolecular protein complex derived from donkey hide, is a traditional Chinese medicine with clinically demonstrated efficacy against ulcerative colitis (UC). Due to its large molecular size and poor absorbability, its therapeutic effects are presumed to depend on gut microbiota. We hypothesized that specific gut bacteria capable of degrading Ejiao might also mediate its biological functions. Methods: To test this hypothesis, a systematic investigation was cond...",Nutrients,2026-Mar
41901112,Fruit and Vegetable Supplemented-Diet Ameliorates Dextran Sodium Sulfate (DSS)-Induced Colitis by Modulating Host Transcriptome and Gut Metagenome Response.,"Background/Objectives: Dietary intake of fruits and vegetables (FVs) has been inversely associated with a lower risk of ulcerative colitis. Using a pig model, we evaluated the effect of FV supplementation on dextran sulfate sodium (DSS)-induced colitis. Methods: Six-week-old pigs were fed a grower diet (negative control), grower diet + 4% DSS (positive control), half-FV diet + DSS, or full-FV diet + DSS. FV levels matched half or full daily recommendations from the Dietary Guidelines for America...",Nutrients,2026-Mar
41901110,Evidence-Based Nutraceuticals in Human Health and Longevity Medicine.,"According to the World Health Organization (WHO), all countries face major challenges in adapting health and social systems to the rapid aging of the population, as the proportion of people over 60 is expected to nearly double from 12% to 22% between 2015 and 2050, and since the year 2020 older adults have already outnumbered children under 5 years globally [...].",Nutrients,2026-Mar
41901100,"Effect of Alpha-Lipoic Acid, Betaine, and L-Carnitine Supplementation on Gut Microbiota and Obesity Biomarkers in Mice.","Background/Objectives: This exploratory study (n = 6 per group) investigated the associations between supplementation with α-lipoic acid (AL), betaine (BT), and L-carnitine (LC) and gut microbiota composition in a high-fat diet (HFD)-induced obesity mouse model. Methods: Four-week-old male C57BL/6J mice were fed a control diet (10% fat), HFD (60% fat), or HFD supplemented with AL, BT, or LC (300 mg/kg BW/day) for nine weeks. Results: All three compounds were associated with shifts in microbial c...",Nutrients,2026-Mar
41901087,Extracellular Vesicles from the Probiotic Yeast Pichia kudriavzevii: Proteomic Characterization and Modulation of Immune and Defense Responses in an Induced Inflammation Model of Intestinal Epithelial Cells.,"Background/Objectives: Extracellular vesicles (EVs) derived from probiotics represent a new and exciting frontier in host-microbe therapeutics. These nanoscale carriers are not merely cellular byproducts but are sophisticated mediators of intercellular communication, capable of modulating immune responses, reducing inflammation, and inhibiting pathogens through a rich cargo of bioactive molecules. Methods: The EVs isolated from the culture supernatants of the yeast probiotic candidate Pichia kud...",Nutrients,2026-Mar
41901084,"Comparative Effects of Dietary Protein, Creatine, and Omega-3 Supplementation on Muscle Strength, Endurance, and Recovery in Trained Athletes: A Systematic Review and Network Meta-Analysis.","This systematic review and network meta-analysis aimed to compare the effects of dietary protein, creatine, and omega-3 fatty acid supplementation on muscle strength, endurance performance, and recovery outcomes in trained athletes. A comprehensive literature search across MEDLINE, Embase, Cochrane CENTRAL, Web of Science, SPORTDiscus, and Scopus identified randomized controlled trials evaluating these supplements in individuals engaged in structured training for a minimum of six months. Network...",Nutrients,2026-Mar
41901082,Dietary Bioactives in Alzheimer's Disease: A Critical Appraisal of Clinical Trials and Future Nutritional Strategies.,"Background: Alzheimer's disease (AD) remains a major public health challenge. Observational associations between dietary patterns and reduced dementia risk have prompted investigations of dietary bioactives (DBs) as cognitive nutraceuticals. Methods: This critical narrative review examines interventional trials for nine prominent DBs relevant to AD: docosahexaenoic acid (DHA), curcumin, resveratrol, epigallocatechin gallate (EGCG), nicotinamide riboside (NR), tricaprilin, vitamin E (α-tocopherol...",Nutrients,2026-Mar
41901080,"Effects of Long-Term Supplementation with Centella asiatica (L.) Urb. Extract (CA-HE50) on Macular Pigment Optical Density: A Randomized, Double-Blind, Placebo-Controlled Trial.","Background/Objectives: Macular pigment optical density (MPOD) is a nutrition-responsive biomarker that indicates the antioxidant status of the macula. This study aimed to evaluate the effects of long-term supplementation with a standardized Centella asiatica (L.) Urb. extract (CA-HE50) on MPOD in a randomized, double-blind, placebo-controlled clinical trial. Methods: Eighty men and women aged 45-65 years, with baseline MPOD values between 0.2 and 0.4, were randomly assigned to receive either CA-...",Nutrients,2026-Mar
41901079,Assessing the Impact of Heyndrickxia coagulans Administered Through Sugar-Free Chewing Gum on Dental Biofilm: A Double-Blind Randomized Controlled Trial.,"Background:Heyndrickxia coagulans has emerged as a candidate for oral health applications, and chewing gum offers a promising delivery method. This study evaluates whether H. coagulans delivered via sugar-free chewing gum can induce detectable changes in plaque microbial ecology. Methods: A randomized, double-blind, placebo-controlled clinical trial was conducted on 52 healthy adults. Participants consumed probiotic or control gum for 4 weeks. Dental plaque was collected at baseline (T0), mid-in...",Nutrients,2026-Mar
41901074,"Bifidobacterium animalis subsp. lactis Ca360 Promotes Oral Iron Repletion, Alters the Gut Microbiota, and Regulates Host Metabolism and Inflammatory Status in a Murine Model of Iron Deficiency Anemia Caused by a Low-Iron Diet.","Background/Objectives: Iron deficiency anemia (IDA) is a widespread nutritional disorder characterized by impaired iron absorption, inflammation-associated iron restriction, and disrupted iron homeostasis. Increasing evidence suggests that gut microbiota play an important role in iron metabolism; however, the mechanisms underlying probiotic-assisted iron supplementation remain unclear. Our research group previously conducted in vitro fermentation screening experiments and obtained a bacterial st...",Nutrients,2026-Mar
41901064,Effects of Nicotinamide Mononucleotide Supplementation on Blood Pressure: A Systematic Review and Meta-Analysis of Randomized Controlled Trials.,"Background/Objectives: High blood pressure remains a primary modifiable risk factor for cardiovascular disease. Nicotinamide mononucleotide (NMN) has emerged as a promising supplement; however, its efficacy with respect to blood pressure in humans is unclear. This meta-analysis systematically evaluated the effects of various NMN supplements on resting systolic blood pressure (SBP) and diastolic blood pressure (DBP) in adults with elevated blood pressure. Methods: A systematic literature search w...",Nutrients,2026-Mar
41901062,"Diet Quality, Supplementation, and Professional Support as Markers of Injury Load in Polish Football Players: A Cross-Sectional Study.","Background/Objectives: American football (AF) is a contact sport with a high injury risk, where an integrated model of interdisciplinary care may support recovery. The aim of this study was to assess the relationship between diet quality, supplementation, dietician's and physiotherapist's support, injury rates and musculoskeletal pain among AF players in Poland. Methods: The study involved 53 male players from the FA Panthers Wrocław team and was conducted using the KomPAN questionnaire and an o...",Nutrients,2026-Mar
41900087,"Evaluation of Physicochemical Properties, Bioactive Composition, and Antioxidant Activity of Prunus armeniaca L. Cultivars for Functional Food and Nutraceutical Development.","Advancing the characterization of bioactive compounds in Prunus armeniaca L. is critical for identifying high-value cultivars with enhanced nutritional and functional potential. In this study, selected apricot varieties were evaluated, with particular emphasis on their sugar composition, phenolic profile, and antioxidant capacity. Sugar and phenolic compounds were analyzed using RP-HPLC-RID and RP-HPLC-PDA methods, respectively. Total phenolic content (TPC), total flavonoid content (TFC), and as...","Molecules (Basel, Switzerland)",2026-Mar
41899717,Awareness and Use of Folic Acid Among Pregnant Women in Western Ukraine: A Pilot Study.,Neural tube defects remain a significant global health concern. This pilot study assessed folic acid (FA) knowledge and supplementation practices among pregnant women in Ukraine.,International journal of environmental research and public health,2026-Mar
41898729,Dietary Supplementation of L-Carnosine Attenuates High Starch-Induced Disorders of Carbohydrate and Lipid Metabolisms in Zebrafish.,"The global prevalence of obesity continues to rise, posing serious risks to human health largely because obesity itself leads to metabolic disorders of carbohydrate and lipids. Currently, effective and healthy interventions for lowering blood glucose, reducing blood lipids, and promoting weight loss remain limited due to the complexity of obesity development. Lactobacillus plantarum (GDMCC 1.140) was shown to promote catabolic processes and reduce hepatic lipid accumulation in largemouth bass fe...",International journal of molecular sciences,2026-Mar
41898683,Topical Probiotics in Diabetic Wound Healing: Emerging Therapeutic Strategies.,"Diabetic foot ulcers (DFUs) are among the most serious and costly complications of diabetes, characterised by delayed healing, frequent infections, and a high risk of recurrence. Despite advances in wound care, many current therapies fail to address the multifactorial pathophysiology of diabetic wounds, including vascular dysfunction, immune dysregulation, chronic inflammation, and microbial imbalance. In this context, topical probiotics have emerged as a promising microbiome-based strategy aime...",International journal of molecular sciences,2026-Mar
41896312,Oral calcium supplements to reduce the bioaccessibility and bioavailability of arsenic and lead in contaminated soil.,"While increasing dietary calcium (Ca) intake can reduce the oral bioavailability of heavy metal(loid)s, it remains unclear whether a series of Ca compounds can simultaneously reduce the oral bioavailability of As and Pb from soil. The influence of eight Ca compounds on As and Pb bioaccessibility in soils was determined using an in vitro gastrointestinal model, following which an in vivo bioassay was used to determine the most effective Ca compounds on As and Pb bioavailability. The results showe...",Scientific reports,2026-Mar
41895984,Therapeutic potential of Lactobacillus kefiranofaciens ZW18 postbiotic in alleviating hepatocellular carcinoma.,"Hepatocellular carcinoma (HCC) poses a global public health challenge due to its high mortality rate and poor prognosis. Intestinal flora exerts a crucial influence on its occurrence and development. The modulation of the gut microbiota by probiotics to alleviate cancer has been extensively studied. Postbiotics, derivatives of probiotics, are gaining attention as a novel therapeutic strategy for cancer due to their stability and safety. This study used metabolomics to show that the Lactobacillus...","Food research international (Ottawa, Ont.)",2026-May
