pmid,title,abstract,journal,pub_date
41895956,The novel synbiotic (Lacticaseibacillus rhamnosus NKU FL1-11 and galacto-oligosaccharides) alleviates HCA IQ-triggered aging by reprogramming gut microbial metabolism to coordinate the enterohepatic β-glucuronidase activity.,"2-Amino-3-methylimidazo[4,5-f]quinoline (IQ), a nitrogen-containing heterocyclic amine, mainly enters the human body through thermally processed foods and is recognized as a dietary organic pollutant. Although current toxicological studies have focused on the direct health effects of IQ, its pro-gerontic potential remains unknown. In this study, we evaluated the efficacy of a novel synbiotic composed of Lacticaseibacillus rhamnosus NKU FL1-11 and galacto-oligosaccharides against IQ-triggered agi...","Food research international (Ottawa, Ont.)",2026-May
41895830,"Anaemia and adherence to weekly iron-folic acid supplementation among female senior high school students in stunting-risk areas of Ambon city, Indonesia.","Weekly iron-folic acid (IFA) supplementation has been implemented in Indonesia to reduce the prevalence of anaemia in adolescent girls. This study aimed to assess the prevalence of anaemia and adherence to weekly IFA supplementation and their associated factors among adolescent girls in senior high schools in two high-stunting-prone areas of Ambon City, Indonesia.",Asia Pacific journal of clinical nutrition,2026-Apr
41893555,"Simultaneous Determination of Multiclass Cyanotoxins in Aquatic Products, Vegetables and Algal Dietary Supplements Using Dispersive Solid-Phase Extraction (dSPE)-UHPLC-MS/MS.","Cyanotoxins, prevalent in eutrophic aquatic ecosystems, pose significant health risks via contaminated food, yet analytical methods for detecting multiple toxin classes in foodstuffs remain limited. In the current study, a method based on dispersive solid-phase extraction (dSPE) coupled with ultra-high-performance liquid chromatography-tandem mass spectrometry (UHPLC-MS/MS) was developed to simultaneously determine four common classes of cyanotoxins (i.e., microcystins, cylindrospermopsins, nodu...",Toxins,2026-Mar
41891174,Effects of Omega-3 Supplementation on Inflammation and Recovery in Sports: A Meta-Analysis.,"Omega-3 polyunsaturated fatty acids (PUFAs) are known to modulate inflammatory signaling and enhance muscle recovery from exercise-induced stress. In this work, a meta-analysis was conducted that adhered to the PRISMA 2020 criteria, incorporating evidence from 41 randomized controlled trials on eicosapentaenoic acid (EPA) and docosahexaenoic acid (DHA) supplementation, all of which had been conducted as evidence between 2011 and 2025 and evaluated the effects of EPA and DHA supplementation on th...",FASEB journal : official publication of the Federation of American Societies for Experimental Biology,2026-Apr
41887628,"Effect of carotenoids supplementation on visual function in Chinese adults free of retinal disease: protocol for the CSV double-blind, randomised, placebo-controlled trial.","The macula is a pigmented area located at the centre of the retina, responsible for central, high-resolution colour vision. Previous research has demonstrated that oral carotenoid supplementation can enhance contrast sensitivity (CS) in European populations. This study aims to investigate whether carotenoid supplementation can also improve visual function in the Chinese population.",BMJ open,2026-Mar
41883170,Synbiotic supplementation reduces intestinal permeability and inflammation in overweight or obese kidney transplant recipients: a randomized controlled trial.,"Increased intestinal permeability resulting from gut dysbiosis, cardiovascular disease (CVD), and graft failure is common among kidney transplant (KT) recipients. This study was designed to investigate the effects of synbiotics on intestinal permeability, systemic and vascular inflammation markers, oxidative stress, and fibrosis in KT recipients. In this randomized controlled trial, 46 KT recipients were randomly assigned to either the synbiotic or the placebo group. Participants in the synbioti...",Renal failure,2026-Dec
41882829,Dietary supplementation of myo-inositol for preventing fatty liver disease by altering hepatic epigenetic modifications in the transcribed regions of Fasn and Elovl6.,"Myo-inositol (MI) reduces hepatic histone acetylation in the enhancer-promoter regions of Elovl6 (ELOVL fatty acid elongase 6) in high-fructose diet (HFD)-fed rats. We examined whether dietary MI supplementation altered the epigenetic modifications in the transcribed regions of Fasn (fatty acid synthase) and Elovl6 in fatty livers of HFD-fed rats. MI supplementation alleviated HFD-induced hepatic expression of Fasn and Elovl6 probably by decreasing the acetylation of histones H3 and H4, and bind...","Biomedical research (Tokyo, Japan)",2026
41882457,Advances in Nanoparticle-Based Vitamin Delivery Systems for Precision Nutrition and Improved Bioavailability.,"Deficiencies of vitamins D, A, E, K, B12, and Folate remain a significant public health concern, even with the broad implementation of supplementation efforts. Traditional oral vitamin formulations have low bioavailability due to poor water solubility, instability in the digestive tract, and significant first-pass metabolism. Nanocarrier-based techniques have emerged as a promising approach to overcome these problems, enabling better solubility, protecting vitamins from degradation by enzymes, a...",AAPS PharmSciTech,2026-Mar
41880417,EXPLORING THE IMPACT OF GUT MICROBIOTA MODULATION ON COLORECTAL CANCER THERAPY: A BIBLIOMETRIC ANALYSIS OF PROBIOTIC AND PREBIOTIC INTERVENTIONS.,This study is a bibliometric analysis of scientific publications reporting the beneficial effects of gut microbiota modulation by probiotics and/or prebiotics on colorectal cancer.,Arquivos de gastroenterologia,2026
41880311,"Evaluation of Ascophyllum nodosum extract supplementation on feed degradability, ruminal fermentation and methane production using the rumen simulation technique (RUSITEC).","This study investigated the effects of liquid Ascophyllum nodosum (ASC) extracts on feed degradability, ruminal fermentation, total gas and methane (CH4) production using the rumen simulation technique (RUSITEC). Two experiments were conducted: Experiment 1 assessed a grass-based diet with an ASC extract included at 0.1%, 0.2% and 0.3% of dry matter (DM), while Experiment 2 evaluated a grass silage-based diet with an ASC extract included at 0.3%, 0.4% and 0.5% of DM. Both diets included a contro...",PloS one,2026
41879385,Pharmacological and metabolic effects of Bifidobacterium triple viable capsules and Five-animal Play in patients with impaired glucose tolerance.,Impaired glucose tolerance (IGT) is a reversible pre-diabetic condition characterized by early disruptions in insulin resistance and glucose control. Wingless-type MMTV integration site family member 5a/ secreted frizzled-related protein 5 (Wnt5a/Sfrp5) signaling and GLP-1 modulation have been identified as possible treatment approaches.,Pakistan journal of pharmaceutical sciences,2026-May
