pmid,title,abstract,journal,pub_date
41042351,Biofloc system with synbiotic supplementation improves Penaeus vannamei immunity against AHPND.,"Mass mortality due to disease emergence has resulted in enormous losses in shrimp production. One of the deadliest shrimp pathogens is the disease-causing Vibrio parahaemolyticus (VPAHPND), which induces acute hepatopancreatic necrosis and has recently become resistant to various classes of antibiotics. Biofloc systems and synbiotic feed supplementation are potential alternative strategies for overcoming this problem. In this study, a biofloc system was generated by inoculating the probiotic Hal...",Applied microbiology and biotechnology,2025-Oct
41039273,Prophylactic efficacy of probiotics and their metabolites against Staphylococcus epidermidis.,"Staphylococcus epidermidis is a prevalent common microorganism found on the skin of most mammals, including humans. However, S. epidermidis is also known as an opportunistic pathogen that can cause diseases if the skin microbiome becomes skewed to favor its overgrowth. This situation can be worsened if the causative strains are antibiotic-resistant. To explore potential alternatives to replace conventional antibiotics, we aim to use probiotics, specifically Lacticaseibacillus rhamnosus and Lacti...",BMC microbiology,2025-Oct
41039263,Probiotics for pediatric diarrhea and constipation: an umbrella meta-analysis.,The current evidence regarding the impact of probiotics on diarrhea and constipation outcomes in children is inconclusive. This umbrella review of systematic reviews and meta-analyses aims to deliver a comprehensive and conclusive summary of the effectiveness of probiotics in managing these conditions in pediatric populations.,BMC pediatrics,2025-Oct
41039193,Effects of supplementation of garlic with apple pomace or blackcurrant on the gastrointestinal microbial ecosystem of organic pigs after weaning.,"Weaning stress compromises piglet immune and digestive development, increasing susceptibility to Escherichia coli (ETEC) infections. We have previously shown that combinations of antibacterial plants alleviate postweaning diarrhea caused by ETEC. Here, we evaluated the effect of feeding garlic combined with either apple pomace or blackcurrant on the gastrointestinal microbial ecosystem of organic weaners three weeks after an ETEC challenge at weaning. The study involved two blocks of 32 pigs (7 ...",BMC microbiology,2025-Oct
41039185,Phenotypic and safety exploration of indigenous bacterial strains for probiotic applications in aquaculture.,"Quorum-sensing (QS) interference is a promising antivirulence strategy in aquaculture. This study investigated six indigenous bacterial strains for their ability to degrade N-hexanoyl homoserine lactone, a key QS signaling molecule. All strains demonstrated significant QS interference, indicating potential as biocontrol agents. Furthermore, we assessed the key in vitro traits relevant to probiotic application. These included growth rate, pH tolerance and salinity resilience. MYUG presented the f...",BMC microbiology,2025-Oct
41039029,"Effects of vitamin D supplementation under different salinities on hybrid red tilapia growth performance, hormonal profile and growth genes expression.","This study investigated the effects of salinity and vitamin D (VD) supplementation on the physiological and molecular responses of red tilapia hybrid juvenile. The research comprehensively examined growth performance, hormonal profiles, and gene expression under different experimental conditions. Growth performance analysis revealed significant improvements with increasing salinity levels and VD supplementation. The highest growth parameters were observed at 30 ppt salinity with vitamin D3 suppl...",Scientific reports,2025-Oct
41038680,Modulation of gene expression by traditional Asian antidiabetic nutraceuticals: A review of potential effects.,Type 2 diabetes mellitus (T2DM) has emerged as a significant global public health concern. Multiple studies have shown that traditional nutraceuticals are potential to treat T2DM and its complications. This review will explore traditional nutraceuticals with antidiabetic properties with a focus on traditional Asian nutraceuticals and their antioxidant effects on gene expression associated to T2DM.,Asia Pacific journal of clinical nutrition,2025-Oct
41037809,"Feasibility, Safety, and Impact of the Probiotics Lactiplantibacillus plantarum and Bifidobacterium longum subspecies infantis in Papua New Guinean Infants: Protocol for a Randomized Controlled Trial.","Childhood mortality in low- or middle-income countries (LMICs) remains a major public health concern, with infections being a leading cause of infant death. Probiotics have shown promise in reducing infection-related morbidity and mortality in preterm infants, but their use in newborns born at or near term in LMICs requires further investigation.",JMIR research protocols,2025-Oct
41037152,"The discovery, probiotic properties, and genome analysis of Lactiplantibacillus plantarum HP-B1280 with potential therapeutic application for the treatment of non-alcoholic fatty liver disease.","The anti-inflammatory, antioxidant properties of many probiotic microbes and their ability to modulate the composition of intestinal flora suggest that they have the potential to prevent and/or treat nonalcoholic fatty liver disease (NAFLD). The present study provides evidence that Lactiplantibacillus plantarum HP-B1280 can significantly reduce fat accumulation and inflammatory cell infiltration within the hepatocytes of fatty liver mice and thus may have potential application value in the proph...",Antonie van Leeuwenhoek,2025-Oct
41036806,Creatine Supplementation Enhances Fat Graft Survival by Mitochondrial Protection and Revascularization Promotion.,"Autologous fat grafting is compromised by post-grafting ischemic necrosis and volumetric resorption, clinical challenges stemming from inadequate vascularization and metabolic stress. Here, we identify oral creatine supplementation as a translatable metabolic therapy to enhance fat graft survival. Through adipose organoids and a murine grafting model, we demonstrate that creatine stabilizes mitochondrial membrane potential (ΔΨm), reduces reactive oxygen species (ROS), and redirects energy produc...",FASEB journal : official publication of the Federation of American Societies for Experimental Biology,2025-Oct
