pmid,title,abstract,journal,pub_date
41374094,Oral Supplementation with Prunus domestica L. Extract Restores Recognition Memory Impairment Caused by D-Galactose in Rats.,"Background/Objectives: Aging-related cognitive decline, linked to oxidative stress and impaired hippocampal neurogenesis, is a major contributor to neurodegenerative disorders. In rodents, this condition can be modeled by D-galactose (D-gal) administration, which induces oxidative stress and recognition memory deficits. Prunus domestica L. (PD), rich in phenolic and flavonoid compounds with antioxidant properties, may counteract such impairments. This study evaluated the effects of PD extract on...",Nutrients,2025-Dec
41374085,"Baduanjin Exercise, With or Without Vitamin D, Outperforms Vitamin D Alone in Reducing Frailty Among Institutionalized Older Adults: A Cluster-Based Randomized Controlled Trial.","Background: Frailty is a common condition among older adults residing in long-term care facilities and is associated with adverse health outcomes. Physical exercise and vitamin D supplementation have been proposed as preventive and therapeutic strategies, yet the combined effects of the two interventions remain uncertain. This cluster-based randomized controlled trial evaluated the independent and combined effects of Baduanjin exercise and vitamin D supplementation on frailty among residents of ...",Nutrients,2025-Dec
41374052,"Probiotic Supplementation Can Alter Inflammation Parameters and Self-Reported Sleep After a Marathon: A Randomized, Double-Blind, Placebo-Controlled Study.","Background: Sleep is essential for athletes' physical performance and recovery. However, strenuous exercise has the potential to increase inflammation and worsen sleep. This study evaluated the effect of probiotic supplementation on self-reported sleep quality, daytime sleepiness, and inflammatory profile 24 h after a marathon. Methods: 27 marathon male runners were divided into the Probiotic group (Probiotic n = 14) or the Placebo group (Placebo n = 13). The Probiotic group consumed 1 × 1010 CF...",Nutrients,2025-Nov
41374046,Assessment of the Isolated and Combined Impact of β-Glucan and Lacticaseibacillus rhamnosus on Cystic Fibrosis Gut Microbiota Using a SHIME® System.,"Cystic fibrosis (CF) is a genetic disorder that disrupts gut microbiota composition, promoting dysbiosis associated with chronic inflammation, impaired nutrient absorption, and poor clinical outcomes. While modulation of the intestinal microbiota through prebiotics, probiotics, and synbiotics has been proposed as a therapeutic strategy, clinical evidence remains limited, especially in children.",Nutrients,2025-Nov
41374044,"Community Pharmacists' Knowledge, Attitudes, and Readiness to Provide Counseling on Food Supplements-A Scoping Review.","Food supplements (FSs) are widely used by the general population and are commonly available in community pharmacies. As highly accessible healthcare professionals, pharmacists are well positioned to provide evidence-based information and guidance regarding their safe and appropriate use. Adequate knowledge of FSs is essential for pharmacists to prevent adverse effects, identify potential interactions with other medications, and ensure rational use. The objective of this study was to assess commu...",Nutrients,2025-Nov
41374029,"Effects of L-Citrulline Supplementation on Endothelial Function, Arterial Stiffness, and Blood Glucose Level in the Fasted and Acute Hyperglycemic States in Middle-Aged and Older Adults with Type 2 Diabetes.","Background: Acute and chronic hyperglycemia in patients with type 2 diabetes mellitus (T2DM) causes endothelial dysfunction and arterial stiffness, contributing to early mortality from cardiovascular disease (CVD). Although L-citrulline (CIT) supplementation improves endothelial function in older women and decreases fasting glucose in those with T2DM, whether it improves vascular function and blood glucose during acute hyperglycemic states in T2DM is unknown. Methods: We randomized 16 patients w...",Nutrients,2025-Nov
41374026,"Dose-Response Effects of Short-Term Rhodiola rosea (Golden Root Extract) Supplementation on Anaerobic Exercise Performance and Cognitive Function in Resistance-Trained Athletes: A Randomized, Crossover, Double-Blind, and Placebo-Controlled Study.","Background: Rhodiola rosea (RR) is marketed as an adaptogen; however, evidence for acute/short-term effects-and especially dose-response effects-in trained adults across performance and cognition is limited. Objective: Test whether RR improves resistance performance (strength, power) and executive function in resistance-trained adults using a randomized crossover with placebo and a capsule-free baseline. Methods: In a randomized, double-blind, crossover trial with four conditions-no-capsule cont...",Nutrients,2025-Nov
41374014,Exploring Dietary Supplement Utilization Patterns Among African American Survivors of Prostate and Breast Cancer: A Cross-Sectional Analysis.,"Background/Objectives: Cancer survivors are a growing population in the United States, with projections of 22.5 million by 2030. Cancers of the prostate (PC) and breast (BC) are among the most prevalent. Despite a high burden of disease, African American survivors are underrepresented in health behavior research. Leveraging two large databases, this study uniquely characterizes dietary supplement (DS) use among African American cancer survivors to explore potential intervention points. Methods: ...",Nutrients,2025-Nov
