pmid,title,abstract,journal,pub_date
40283009,Utilization of Dietary Supplements in People with the Atopic Triad in Korea: A Cross-Sectional Study Using KNHANES (2018-2021).,"Background and Objectives: Studies investigating the types of dietary supplements associated with the atopic triad using large-scale data remain limited. We assessed the prevalence of the atopic triad, the types of dietary supplements used, and their associations in Korean adults using a 4-year national survey data. Materials and Methods: This cross-sectional study utilized data from the Korea National Health and Nutrition Examination Survey (2018-2021). Adults aged ≥ 19 years were included. Des...","Medicina (Kaunas, Lithuania)",2025-Apr
40263114,"Dietary supplement use and knowledge among athletes: prevalence, compliance with AIS classification, and awareness of certification programs.","The use of dietary supplements is widespread among athletes, with intake influenced by factors such as sport-discipline, competitive level, and gender. The Australian Institute of Sport (AIS) has categorized supplements based on scientific evidence regarding their efficacy and safety. Despite extensive global research on dietary supplement use among athletes, data on Polish athletes remain limited. Therefore, this study aimed to evaluate supplement use among Polish athletes, considering their co...",Journal of the International Society of Sports Nutrition,2025-Dec
40257056,The role of nutritional factors in exercise-induced bronchoconstriction: a narrative review.,"Exercise-induced bronchoconstriction (EIB) describes an acute narrowing of the airways that develops following vigorous physical activity. Clinical responses to current asthma therapy, such as leukotriene antagonists and corticosteroids, are heterogeneous, even with optimal treatment. Epidemiological studies indicate an increasing use of complementary and alternative medicine therapy in asthma patients due to the lack of efficacy of conventional treatment, concerns about potentially harmful side...","American journal of physiology. Regulatory, integrative and comparative physiology",2025-Jun
40194561,"Exploring customer segmentation for food products with additional health benefits: A case study on iron-biofortified vegetables, functional foods, and dietary supplements.","Iron deficiency is a widespread global health concern affecting women, in particular, but also individuals adhering to vegan or vegetarian diets, as well as athletes. Inadequate iron intake can lead to various diseases, necessitating an iron-rich diet or dietary supplements. In addition to existing iron-enriched functional foods and supplements, the potential emergence of iron-biofortified vegetables, high in vitamin C, could enhance iron absorption in the future. As these vegetables are not est...",Appetite,2025-Jul
40120775,"Berry supplementation in healthy volunteers modulates gut microbiota, increases fecal polyphenol metabolites and reduces viability of colon cancer cells exposed to fecal water- a randomized controlled trial.",Diets high in red and processed meat and low in plant-based foods are associated with an increased risk of colorectal cancer. We investigated whether berry supplementation can impact gut metabolism to counteract the presumably cancer promoting luminal environment sustained by high red and processed meat consumption. Altogether 43 healthy adults were randomized either into Meat group (150 g/d red and processed pork meat) or Meat & Berries group (150 g/d red and processed meat and 200 g/d of mixed...,The Journal of nutritional biochemistry,2025-Jul
40114535,Proteomic Correlates of Vitamin D Supplementation in the Atherosclerosis Risk in Communities (ARIC) Study.,"Proteins are key effectors of biological functions and play roles in signaling, transport, growth, repair, and immunity. Vitamin D biomarkers may be reflected in the plasma proteome. The aim of this discovery study was to identify novel proteins associated with vitamin D supplementation.",Proteomics. Clinical applications,2025-May
40100255,Hydrolysed Collagen Supplementation Enhances Patellar Tendon Adaptations to 12 Weeks' Resistance Training in Middle-Aged Men.,"Resistance exercise (RE) with hydrolysed collagen (HC) supplementation increases collagen synthesis in young and middle-aged populations, and further enhances tendon adaptations to chronic RE in young athletes. However, it is unknown if middle-aged tendon can benefit from chronic RE with HC supplementation. We investigated the effects of 12-weeks' RE, combined with HC supplementation, on changes in patellar tendon (PT) properties in middle-aged men. In a double-blind design, 20 recreationally ac...",European journal of sport science,2025-Apr
40057759,Intravenous Glutathione and Vitamin Supplementation Causing Stevens-Johnson Syndrome: A Case Report.,"Stevens-Johnson syndrome and toxic epidermal necrolysis are severe mucocutaneous reactions with high morbidity and mortality, most commonly triggered by prescribed medications. Here we report a case of a 33-year-old female who developed Stevens-Johnson/toxic epidermal necrolysis after receiving an IV vitamin infusion containing glutathione, vitamin C, and vitamin D. While not commonly associated with the development of Stevens-Johnson syndrome, glutathione has been previously reported to have be...",Journal of burn care & research : official publication of the American Burn Association,2025-Aug
40049594,The Effect of Maternal Antioxidant Vitamin Supplementation on Maternal and Cord Blood Adiponectin Concentrations.,Adiponectin is a hormone that modulates glucose regulation and fatty acid oxidation. Low adiponectin concentration has been associated with increased insulin resistance. Studies show a beneficial effect of vitamin E supplementation on insulin sensitivity. We aimed to investigate the association of prenatal antioxidant supplementation with increased adiponectin concentrations in pregnant participants and their newborn infants.Secondary analysis of a randomized control trial of prenatal vitamin C ...,American journal of perinatology,2025-Aug
